ingested_date,genre,asin,title,author,author_url,series,price,rating,review_count,rank_overall,release_date,publisher,blurb_text,cover_url,product_url,topic_tags,subcategories,blurb_keyphrases,estimated_pov,has_supernatural,has_romance,cover_ok
2025-08-11,Teen & Young Adult,B01CXYSEB2,A Thousand Boy Kisses (NEW BONUS CONTENT),Tillie Cole,https://www.amazon.com/stores/author/B00COA8WSQ,A Thousand Boy Kisses,3.99,4.50,63682,1482,2016-03-13,Tillie Cole Ltd.,"One kiss lasts a moment. But a thousand kisses can last a lifetime. One boy. One girl. A bond that is forged in an instant and cherished for a decade. A bond that neither time nor distance can break. A bond that will last forever. Or so they believe. When seventeen-year-old Rune Kristiansen returns from his native Norway to the sleepy town of Blossom Grove, Georgia, where he befriended Poppy Litchfield as a child, he has just one thing on his mind. Why did the girl who was one half of his soul, who promised to wait faithfully for his return, cut him off without a word of explanation? Rune’s heart was broken two years ago when Poppy fell silent. When he discovers the truth, he finds that the greatest heartache is yet to come. Standalone Young Adult Tearjerker Romance. For ages 14 and up.",https://m.media-amazon.com/images/I/51qiSmOxWML._SY445_SX342_.jpg,https://www.amazon.com/dp/B01CXYSEB2,,"[""[#11 in Teen & Young Adult Contemporary Romance](https://www.amazon.com/gp/bestsellers/books/10368617011/ref=pd_zg_hrsr_books)\n[#13 in Teen & Young Adult Contemporary Romance eBooks](https://www.amazon.com/gp/bestsellers/digital-text/7006648011/ref=pd_zg_hrsr_digital-text)\n[#38 in Teen & Young Adult Literature & Fiction](https://www.amazon.com/gp/bestsellers/books/17443/ref=pd_zg_hrsr_books)""]",Standalone Young Adult Tearjerker Romance seventeen-year-old Rune Kristiansen,Third,false,false,true
2025-08-11,Teen & Young Adult,B00UG9LC4I,Six of Crows,Leigh Bardugo,https://www.amazon.com/stores/author/B005ZZ8XQS,Six of Crows,9.99,4.60,49620,1501,2015-09-29,Henry Holt and Co.,"See the Grishaverse come to life on screen with the Netflix series, Shadow and Bone -- Season 2 streaming now! Meet Kaz Brekker and his crew: Jesper, Inej, Wylan, and the star-crossed Nina and Matthias, on the heist of a lifetime in Six of Crows from #1 bestselling author, Leigh Bardugo. Ketterdam: a bustling hub of international trade where anything can be had for the right price—and no one knows that better than criminal prodigy Kaz Brekker. Kaz is offered a chance at a deadly heist that could make him rich beyond his wildest dreams. But he can't pull it off alone. . . . A convict with a thirst for revenge. A sharpshooter who can't walk away from a wager. A runaway with a privileged past. A spy known as the Wraith. A Heartrender using her magic to survive the slums. A thief with a gift for unlikely escapes. Six dangerous outcasts. One impossible heist. Kaz's crew is the only thing that might stand between the world and destruction—if they don't kill each other first. Six of Crows by Leigh Bardugo returns to the breathtaking world of the Grishaverse in this unforgettable tale about the opportunity—and the adventure—of a lifetime. Read all the books in the Grishaverse! The Shadow and Bone Trilogy (previously published as The Grisha Trilogy) Shadow and Bone Siege and Storm Ruin and Rising The Six of Crows Duology Six of Crows Crooked Kingdom The King of Scars Duology King of Scars Rule of Wolves The Language of Thorns: Midnight Tales and Dangerous Magic The Severed Moon: A Year-Long Journal of Magic The Lives of Saints",https://m.media-amazon.com/images/I/51qvcFbMT5L._SY445_SX342_.jpg,https://www.amazon.com/dp/B00UG9LC4I,"[""Crime"",""Magic""]","[""[#1 in Teen & Young Adult Mystery & Thriller Action & Adventure](https://www.amazon.com/gp/bestsellers/books/10368511011/ref=pd_zg_hrsr_books)\n[#2 in Teen & Young Adult Fantasy & Supernatural Mystery eBooks](https://www.amazon.com/gp/bestsellers/digital-text/7006630011/ref=pd_zg_hrsr_digital-text)\n[#4 in Teen & Young Adult Thrillers & Suspense (Kindle Store)](https://www.amazon.com/gp/bestsellers/digital-text/11650875011/ref=pd_zg_hrsr_digital-text)""]",Grisha Trilogy) Shadow and Bone Siege and Storm Ruin Scars Duology King Six of Crows Duology Crows Crooked Kingdom star-crossed Nina Year-Long Journal criminal prodigy Kaz Brekker,Third,true,false,true
2025-08-11,Teen & Young Adult,B087V733YJ,Midnight Sun (The Twilight Saga),Stephenie Meyer,https://www.amazon.com/stores/author/B001H6GO92,The Twilight Saga,11.99,4.50,35862,1551,2020-08-04,"Little, Brown Books for Young Readers","Relive the passion and thrill of the New York Times bestselling Twilight Saga romance with this highly anticipated companion, retelling the iconic love story of Bella and Edward, from the vampire's point of view. When Edward Cullen and Bella Swan met in Twilight, an iconic love story was born. But until now, fans have heard only Bella's side of the story. At last, readers can experience Edward's version in the long-awaited companion novel, Midnight Sun. This unforgettable tale as told through Edward's eyes takes on a new and decidedly dark twist. Meeting Bella is both the most unnerving and intriguing event he has experienced in all his years as a vampire. As we learn more fascinating details about Edward's past and the complexity of his inner thoughts, we understand why this is the defining struggle of his life. How can he justify following his heart if it means leading Bella into danger? In Midnight Sun, Stephenie Meyer transports us back to a world that has captivated millions of readers and delivers an epic novel about the profound pleasures and devastating consequences of immortal love. Praise for The Twilight Saga “This tale of tortured demon lovers entices”— Kirkus Reviews ""In the tradition of Anne Rice. . . this dark romance is gripping."" — Booklist (starred review) ""The novel's danger-factor skyrockets as the excitement of secret love and hushed affection morphs into a terrifying race to stay alive."" — School Library Journal (starred review) “Relish this new adventure and hunger for more”— Booklist A New York Times bestseller A New York Times ""Editor's Choice"" A Publishers Weekly Best Book of the Year An Amazon best of #Booktok Book",https://m.media-amazon.com/images/I/41zKxJRUapL._SY445_SX342_.jpg,https://www.amazon.com/dp/B087V733YJ,"[""School/Academy"",""Dark Romance"",""Vampire"",""Sports"",""Demon"",""Supernatural""]","[""[#1 in Teen & Young Adult Werewolf & Shifter Fiction](https://www.amazon.com/gp/bestsellers/books/13922495011/ref=pd_zg_hrsr_books)\n[#1 in Teen & Young Adult Paranormal Romance](https://www.amazon.com/gp/bestsellers/books/10368621011/ref=pd_zg_hrsr_books)\n[#2 in Teen & Young Adult Werewolf & Shifter eBooks](https://www.amazon.com/gp/bestsellers/digital-text/15249174011/ref=pd_zg_hrsr_digital-text)""]","iconic love story long-awaited companion novel highly anticipated companion New York Times vampire's point only Bella's side Twilight Saga A New York Times bestseller A New York Times ""Editor's Choice"" A Publishers Weekly Best Book most unnerving and intriguing event new and decidedly dark twist Year An Amazon",Third,true,true,true
2025-08-11,Teen & Young Adult,B0DLJCMJ69,After We Burned,Marieke Nijkamp,https://www.amazon.com/stores/author/B00W25N13E,,9.50,4.50,18,1473,2025-07-01,Sourcebooks Fire,"**This limited edition includes designed edges**  She deserved more. They all did. A gripping and emotional new suspense novel from the #1 New York Times bestselling author of This is Where it Ends.  A terrible accident. A horrible loss. A regrettable tragedy. That's all anyone in Fenix can talk about when a fire consumes the local high school, taking the life of a student. The town mourns, except who really knew—let alone cared about—Eden when she was alive? And why was she in the building that night?  Five teens each hold a piece of the truth about what happened. They also have their own secrets, secrets they will fight to protect with the same fury as the blaze that killed Eden. But silence is meant to be broken, and this story can't be extinguished…",https://m.media-amazon.com/images/I/41YCuuHC90L._SY445_SX342_.jpg,https://www.amazon.com/dp/B0DLJCMJ69,"[""School/Academy"",""Suspense""]","[""[#1 in Teen & Young Adult Fantasy & Supernatural Mystery eBooks](https://www.amazon.com/gp/bestsellers/digital-text/7006630011/ref=pd_zg_hrsr_digital-text)\n[#3 in Teen & Young Adult Mystery & Thriller Action & Adventure](https://www.amazon.com/gp/bestsellers/books/10368511011/ref=pd_zg_hrsr_books)\n[#3 in Teen & Young Adult Thrillers & Suspense (Kindle Store)](https://www.amazon.com/gp/bestsellers/digital-text/11650875011/ref=pd_zg_hrsr_digital-text)""]",local high school #1 New York Times gripping and emotional new suspense novel,Third,false,false,true
2025-08-11,Teen & Young Adult,B002MQYOFW,"The Hunger Games (Hunger Games Trilogy, Book 1)",Suzanne Collins,https://www.amazon.com/stores/author/B001H6V7I0,Hunger Games,9.99,4.70,99262,1627,2009-09-01,Scholastic Press,"This Special Edition of The Hunger Games includes the most extensive interview Suzanne Collins has given since the publication of The Hunger Games; an absorbing behind-the-scenes look at the creation of the series; and an engaging archival conversation between Suzanne Collins and YA legend Walter Dean Myers on writing about war. The Special Edition answers many questions fans have had over the years, and gives great insight into the creation of this era-defining work.  In the ruins of a place once known as North America lies the nation of Panem, a shining Capitol surrounded by twelve outlying districts. The Capitol keeps the districts in line by forcing them all to send one boy and one girl between the ages of twelve and eighteen to participate in the annual Hunger Games, a fight to the death on live TV.Sixteen-year-old Katniss Everdeen regards it as a death sentence when she steps forward to take her sister's place in the Games. But Katniss has been close to death before-and survival, for her, is second nature. Still, if she is to win, she will have to start making choices that weigh survival against humanity and life against love.",https://m.media-amazon.com/images/I/51fpAO2BjXL._SY445_SX342_.jpg,https://www.amazon.com/dp/B002MQYOFW,,"[""[#1 in Teen & Young Adult Fiction on Physical & Emotional Abuse (Books)](https://www.amazon.com/gp/bestsellers/books/10368572011/ref=pd_zg_hrsr_books)\n[#2 in Teen & Young Adult Fiction on Physical & Emotional Abuse (Kindle Store)](https://www.amazon.com/gp/bestsellers/digital-text/15249114011/ref=pd_zg_hrsr_digital-text)\n[#2 in Teen & Young Adult Science Fiction Action & Adventure](https://www.amazon.com/gp/bestsellers/books/10368513011/ref=pd_zg_hrsr_books)""]",her sister's place live TV.Sixteen-year-old Katniss Everdeen annual Hunger Games most extensive interview era-defining work engaging archival conversation Suzanne Collins and YA legend Walter Dean Myers,Third,false,false,true
2025-08-11,Teen & Young Adult,B0BGHFGT3F,The Brothers Hawthorne (The Inheritance Games Book 4),Jennifer Lynn Barnes,https://www.amazon.com/stores/author/B001IU4QME,The Inheritance Games,12.99,4.30,8921,1831,2023-08-29,"Little, Brown Books for Young Readers","OVER 6 MILLION COPIES SOLD OF THE #1 BESTSELLING SERIES! Four brothers. Two missions. One explosive read. Jennifer Lynn Barnes returns to the world of her #1 bestselling, TikTok sensation Inheritance Games trilogy, and the stakes have never been higher. Grayson Hawthorne was raised as the heir apparent to his billionaire grandfather, taught from the cradle to put family first. Now the great Tobias Hawthorne is dead and his family disinherited, but some lessons linger. When Grayson’s half-sisters find themselves in trouble, he swoops in to do what he does best: take care of the problem—efficiently, effectively, mercilessly. And without getting bogged down in emotional entanglements. Jameson Hawthorne is a risk-taker, a sensation-seeker, a player of games. When his mysterious father appears and asks for a favor, Jameson can’t resist the challenge. Now he must infiltrate London’s most exclusive underground gambling club, which caters to the rich, the powerful, and the aristocratic, and win an impossible game of greatest stakes. Luckily, Jameson Hawthorne lives for impossible. Drawn into twisted games on opposite sides of the globe, Grayson and Jameson—with the help of their brothers and the girl who inherited their grandfather’s fortune—must dig deep to decide who they want to be and what each of them will sacrifice to win. **Don’t miss a moment of The Inheritance Games Saga, including the Grandest Game, the thrilling new series set in the world of the Inheritance Games. Reading them all? The ideal reading order is: The Inheritance Games, The Hawthorne Legacy, The Final Gambit, The Brothers Hawthorne, The Grandest Game, Games Untold, Glorious Rivals, and The Same Backward As Forward. Looking for more unputdownable reads from Jennifer Lynn Barnes? Check out The Naturals series (The Naturals, Killer Instinct, All In, Bad Blood, and the enovella, Twelve), The Debutantes duet (Little White Lies, Deadly Little Scandals), and The Lovely and the Lost",https://m.media-amazon.com/images/I/51gcsL+Sj+L._SY445_SX342_.jpg,https://www.amazon.com/dp/B0BGHFGT3F,"[""Crime"",""Billionaire"",""Aristocracy"",""Mystery""]","[""[#1 in Teen & Young Adult Fiction about Siblings](https://www.amazon.com/gp/bestsellers/digital-text/15249106011/ref=pd_zg_hrsr_digital-text)\n[#5 in Teen & Young Adult Romantic Mystery eBooks](https://www.amazon.com/gp/bestsellers/digital-text/7006631011/ref=pd_zg_hrsr_digital-text)\n[#6 in Teen & Young Adult Romantic Mysteries & Thrillers](https://www.amazon.com/gp/bestsellers/books/10368597011/ref=pd_zg_hrsr_books)""]","great Tobias Hawthorne their grandfather’s fortune risk-taker her #1 bestselling, TikTok sensation Inheritance Games trilogy Inheritance Games Saga thrilling new series ideal reading order sensation-seeker #1 BESTSELLING SERIES OVER 6 MILLION COPIES SOLD Grayson’s half-sisters Little White Lies London’s most exclusive underground gambling club",Third,false,true,true
2025-08-11,Teen & Young Adult,B06Y5HPRLC,The Cruel Prince (The Folk of the Air Book 1),Holly Black,https://www.amazon.com/stores/author/B001H6GPWS,The Folk of the Air,11.99,4.30,64304,2101,2018-01-02,"Little, Brown Books for Young Readers","From #1 New York Times bestselling author Holly Black, comes the first book in a stunning new series about a mortal girl who finds herself caught in a web of royal faerie intrigue. Of course I want to be like them. They're beautiful as blades forged in some divine fire. They will live forever. And Cardan is even more beautiful than the rest. I hate him more than all the others. I hate him so much that sometimes when I look at him, I can hardly breathe. Jude was seven years old when her parents were murdered and she and her two sisters were stolen away to live in the treacherous High Court of Faerie. Ten years later, Jude wants nothing more than to belong there, despite her mortality. But many of the fey despise humans. Especially Prince Cardan, the youngest and wickedest son of the High King. To win a place at the Court, she must defy him--and face the consequences. In doing so, she becomes embroiled in palace intrigues and deceptions, discovering her own capacity for bloodshed. But as civil war threatens to drown the Courts of Faerie in violence, Jude will need to risk her life in a dangerous alliance to save her sisters, and Faerie itself.",https://m.media-amazon.com/images/I/51O-rvZjzKL._SY445_SX342_.jpg,https://www.amazon.com/dp/B06Y5HPRLC,"[""Crime"",""Aristocracy"",""Fae/Elves""]","[""[#1 in Teen & Young Adult Fiction on Bullying (Kindle Store)](https://www.amazon.com/gp/bestsellers/digital-text/15249086011/ref=pd_zg_hrsr_digital-text)\n[#2 in Teen & Young Adult Fiction about Siblings](https://www.amazon.com/gp/bestsellers/digital-text/15249106011/ref=pd_zg_hrsr_digital-text)\n[#6 in Teen & Young Adult Dark Fantasy](https://www.amazon.com/gp/bestsellers/books/13922497011/ref=pd_zg_hrsr_books)""]",fey despise humans youngest and wickedest son treacherous High Court stunning new series,Third,true,false,true
2025-08-11,Teen & Young Adult,B0CP8P487F,Coven Cove: The Complete Series,David Clark,https://www.amazon.com/stores/author/B0787K85LT,Collects books from: Coven Cove,0.99,4.60,714,2192,2023-11-29,,"Larissa is the child of two worlds. She is a witch and a vampire… Witches fear her… Vampires want her blood... and she is in love with a human, which is forbidden by both  In the shadowed aftermath of her father's murder by a dark figure, Larissa Norton’s mother sends her away to the protection of Coven Cove Academy. There she joins other vampires like her, where, alongside witches, werewolves, and shapeshifters, they learn how to live in the world of mortals while honing their particular skills. It doesn’t take long before Larissa discovers she has more in common with the others than she even knew. Her mother isn’t her mother, and just like the other students, she too is an orphan, but that is only the first of many mysteries Larissa must face. The headmistress vows to help Larissa discover who she is, and why she is being chased. In return, Larissa must follow two simple rules at the school. First, one must never use their abilities against a fellow student. A rule broken on just her third day, but in Larissa’s defense, at that time she didn’t know she was also a witch, one of Larissa’s other hidden secrets from a past life she can’t remember. Second, she, and all students, are to stay away from the headmistress’s mortal son, a temptation that is both painful and impossible to ignore. With the help of the headmistresses and instructors, Larissa unravels a series of secrets and lies and uncovers the truth of who and what she is, leading to the frightening truth about who and what is after her. It's not just one, but many. Some are driven by fear, others driven by a desire for power. All obsessed with what her blood holds. The race against dark forces is not just for her survival but for the power that runs through her veins, which could either save or destroy them all.  Books included:  Book 1 - The Secret of the Blood Charm Book 2 - The Shape of things to Come Book 3 - BloodLust Book 4 - The Curse of the Crescent Moon Book 5 - The House of the Rising Son Book 6 - BloodWars Book 7 - The Revenge of the Shadow Witch",https://m.media-amazon.com/images/I/41S2Zu6DJnL._SX342_SY445_.jpg,https://www.amazon.com/dp/B0CP8P487F,"[""Crime"",""School/Academy"",""Witch"",""Mystery"",""Shifter"",""Vampire"",""Supernatural""]","[""[#1 in Teen & Young Adult Magical Realism eBooks](https://www.amazon.com/gp/bestsellers/digital-text/15249170011/ref=pd_zg_hrsr_digital-text)\n[#2 in Teen & Young Adult Coming of Age Fantasy eBooks](https://www.amazon.com/gp/bestsellers/digital-text/7006652011/ref=pd_zg_hrsr_digital-text)\n[#2 in Teen & Young Adult Magical Realism Fiction](https://www.amazon.com/gp/bestsellers/books/13922489011/ref=pd_zg_hrsr_books)""]",just her third day headmistress’s mortal son Larissa’s other hidden secrets Rising Son Book Larissa Norton’s mother Crescent Moon Book Blood Charm Book her father's murder,Third,true,true,true
2025-08-11,Teen & Young Adult,B000QRIGJ4,New Moon (The Twilight Saga Book 2),Stephenie Meyer,https://www.amazon.com/stores/author/B001H6GO92,The Twilight Saga,10.99,4.60,25194,1978,2007-08-08,"Little, Brown Books for Young Readers","In this irresistible continuation of the New York Times bestselling Twilight Saga, a heartbroken and reckless Bella clings to the support of Jacob, while new threats of danger and vengeance test her and Edwards’s romance—and chances of survival. For Bella Swan, there is one thing more important than life itself: Edward Cullen. But being in love with a vampire is even more dangerous than Bella could ever have imagined. Edward has already rescued Bella from the clutches of one evil vampire, but now, as their daring relationship threatens all that is near and dear to them, they realize their troubles may be just beginning. Bella and Edward face a devastating separation, the mysterious appearance of dangerous wolves roaming the forest in Forks, a terrifying threat of revenge from a female vampire and a deliciously sinister encounter with Italy's reigning royal family of vampires, the Volturi. Passionate, riveting, and full of surprising twists and turns, this vampiric love story has reached literary immortality. “ New Moon will more than feed the bloodthirsty hankerings of fans of the first volume and leave them breathless for the third” (School Library Journal) Praise for The Twilight Saga “This tale of tortured demon lovers entices”— Kirkus Reviews ""In the tradition of Anne Rice. . . this dark romance is gripping."" — Booklist (starred review) ""The novel's danger-factor skyrockets as the excitement of secret love and hushed affection morphs into a terrifying race to stay alive."" — School Library Journal (starred review) “Relish this new adventure and hunger for more”— Booklist A New York Times bestseller A New York Times ""Editor's Choice"" A Publishers Weekly Best Book of the Year An Amazon best of #Booktok Book",https://m.media-amazon.com/images/I/41urJNhlFzL._SY445_SX342_.jpg,https://www.amazon.com/dp/B000QRIGJ4,"[""School/Academy"",""Dark Romance"",""Aristocracy"",""Mystery"",""Vampire"",""Demon"",""Supernatural""]","[""[#3 in Teen & Young Adult Werewolf & Shifter eBooks](https://www.amazon.com/gp/bestsellers/digital-text/15249174011/ref=pd_zg_hrsr_digital-text)\n[#3 in Teen & Young Adult Paranormal & Urban Fantasy Romance eBooks](https://www.amazon.com/gp/bestsellers/digital-text/7006650011/ref=pd_zg_hrsr_digital-text)\n[#4 in Teen & Young Adult Vampire eBooks](https://www.amazon.com/gp/bestsellers/digital-text/15249173011/ref=pd_zg_hrsr_digital-text)""]","Year An Amazon New York Times heartbroken and reckless Bella clings Italy's reigning royal family Twilight Saga A New York Times bestseller A New York Times ""Editor's Choice"" A Publishers Weekly Best Book deliciously sinister encounter vampiric love story",Third,true,true,true
2025-08-11,Teen & Young Adult,B09XGQ142Z,Five Survive,Holly Jackson,https://www.amazon.com/stores/author/B07QKBC6JZ,,7.99,4.30,8907,2022,2022-11-29,Delacorte Press,"#1 NEW YORK TIMES BESTSELLER • From the author of the multimillion-copy bestselling A Good Girl’s Guide to Murder series comes a new blockbuster thriller about a road trip that turns deadly. Eight hours. Six friends. Five survive. Red Kenny is on a road trip for spring break with five friends: Her best friend - the older brother - his perfect girlfriend - a secret crush - a classmate - and a killer. When their RV breaks down in the middle of nowhere with no cell service, they soon realize this is no accident. They have been trapped by someone out there in the dark, someone who clearly wants one of them dead. With eight hours until dawn, the six friends must escape, or figure out which of them is the target. But is there a liar among them? Buried secrets will be forced to light and tensions inside the RV will reach deadly levels. Not all of them will survive the night. . . . With edge-of-your-seat tension and a gripping mystery, Holly Jackson has written another instant classic! And don't miss Holly Jackson's latest mystery thriller, The Reappearance of Rachel Price!",https://m.media-amazon.com/images/I/51mqpRtyaAL._SY445_SX342_.jpg,https://www.amazon.com/dp/B09XGQ142Z,"[""Crime"",""Thriller"",""Mystery""]","[""[#1 in Teen & Young Adult Law & Crime Fiction eBooks](https://www.amazon.com/gp/bestsellers/digital-text/15249145011/ref=pd_zg_hrsr_digital-text)\n[#1 in Teen & Young Adult Fiction on Prejudice & Racism](https://www.amazon.com/gp/bestsellers/books/10368574011/ref=pd_zg_hrsr_books)\n[#1 in Teen & Young Adult Law & Crime Stories](https://www.amazon.com/gp/bestsellers/books/10434552011/ref=pd_zg_hrsr_books)""]",1 NEW YORK TIMES BESTSELLER Good Girl’s Guide multimillion-copy Holly Jackson's latest mystery thriller new blockbuster thriller,Third,false,false,true
