ingested_date,genre,asin,title,author,author_url,series,price,rating,review_count,rank_overall,release_date,publisher,blurb_text,cover_url,product_url,topic_tags,subcategories,blurb_keyphrases,estimated_pov,has_supernatural,has_romance,cover_ok
2025-08-11,Fantasy,B09NLKXZ4J,City of Gods and Monsters (House of Devils Book 1),Kayla Edwards,https://www.amazon.com/stores/author/B09F5H5Z4Z,House of Devils,3.99,4.10,20021,406,2022-01-25,Independently Published,"Welcome to the city of Angelthene. We hope you survive. Loren Calla has only ever been ordinary. As a human struggling to survive in a city that caters to the needs of vampires, werewolves, witches, and other supernatural creatures, she always assumed her life would remain simple, predictable, and as safe as her world would allow. Until she barely escapes abduction at the hands of Darkslayers—supernatural bounty hunters that possess the Sight, a magical tracking ability that allows them to see a person’s aura—and one of her friends is taken in her place. The abductors are demanding a ransom: Loren's life in exchange for her friend's safe return. Loren will do whatever it takes to get her friend back—even if it means accepting help from Darien Cassel, the leader of the Seven Devils, the most feared Darkslaying circle in the city. Darien specializes in tracking down demons and criminals that are better off dead than alive, so when he takes a job to track down Loren and finds out she is human—and couldn't hurt a fly if her life depended on it—he decides to protect her instead of turn her in for a reward. As much as Loren doesn't want to admit it, Darien is her best and only chance at finding her friend alive, if she can somehow manage to get along with him—and not fall head-over-heels in love with him in the process, which is far easier said than done. When more women start disappearing, and some of them slowly turn up dead, Loren and Darien's search for answers takes them deep into Angelthene's corrupt underbelly, where they discover a dark secret that threatens to unravel their world. And when tragedy strikes, Loren learns that love can make an ordinary person do extraordinary things. From the author of Dreams of Ice and Iron comes a new fantasy romance perfect for fans of Sarah J Maas, Ilona Andrews, and Cassandra Clare.",https://m.media-amazon.com/images/I/51yHInb42iL._SY445_SX342_.jpg,https://www.amazon.com/dp/B09NLKXZ4J,"[""Crime"",""Monsters"",""Witch"",""Shifter"",""Vampire"",""Magic"",""Supernatural""]","[""[#2 in Urban Fantasy (Kindle Store)](https://www.amazon.com/gp/bestsellers/digital-text/6157854011/ref=pd_zg_hrsr_digital-text)\n[#3 in Urban Fantasy (Books)](https://www.amazon.com/gp/bestsellers/books/383988011/ref=pd_zg_hrsr_books)\n[#35 in Romantic Fantasy (Books)](https://www.amazon.com/gp/bestsellers/books/13922577011/ref=pd_zg_hrsr_books)""]",magical tracking ability her friend's safe return Loren and Darien's search her best and only chance new fantasy romance most feared Darkslaying circle Angelthene's corrupt underbelly person’s aura,Third,true,true,true
2025-08-11,Fantasy,B0BZCP8RC6,"Heat of the Everflame: The Kindred's Curse Saga, Book Three",Penn Cole,https://www.amazon.com/stores/author/B0BZCBVB8F,The Kindred's Curse Saga,7.99,4.50,53771,412,2023-09-12,,"The war has begun. Both sides demand Diem’s allegiance—or her death. After her disastrous coronation, Diem finds herself at the center of the conflict between the Descended and the Guardians. With her newfound friends and the man she’s falling for on one side, and the mortals she has vowed to protect on the other, Diem must walk a careful line to save the people she loves… even from each other. The mystery of her unusual heritage begins to unravel, sending Diem and Luther on an unexpected journey across the realms. The answers may hold the key to winning the war, but finding them will require her to face painful truths about her mother, her bloodline, and her fate. Meanwhile, the Crowns have set Diem in their sights. Some could be her greatest allies—while others want her dead. To end their oppressive reign, Diem must sort friend from foe and risk it all to build an army of her own. But a powerful figure in the north has plans that could change everything... Heat of the Everflame is the third book in The Kindred's Curse Saga, a four-book epic fantasy romance series that follows our fiesty, bad*ss heroine Diem Bellator in her fight against injustice, her struggle to survive in a royal palace full of betrayal and intrigue, and her journey of self-discovery and finding true love. This slow burn, enemies-to-lovers series is perfect for fans of unique magic systems, dragons and other mythical creatures, angst and romantic tension, and hilarious banter. This book will appeal to fans of plot-heavy, character-driven romantasy such as A Court of Thorns and Roses, Throne of Glass, From Blood and Ash, Gild, Shadow & Bone, and The Serpent & the Wings of Night.",https://m.media-amazon.com/images/I/41m+HtgNVYL._SY445_SX342_.jpg,https://www.amazon.com/dp/B0BZCP8RC6,"[""Dragon"",""Epic Fantasy"",""Enemies to Lovers"",""Aristocracy"",""Mystery"",""Military"",""Supernatural"",""Magic"",""Slow Burn""]","[""[#16 in Sword & Sorcery Fantasy eBooks](https://www.amazon.com/gp/bestsellers/digital-text/6809432011/ref=pd_zg_hrsr_digital-text)\n[#18 in Sword & Sorcery Fantasy (Books)](https://www.amazon.com/gp/bestsellers/books/16205/ref=pd_zg_hrsr_books)\n[#49 in Romantasy](https://www.amazon.com/gp/bestsellers/books/7654406011/ref=pd_zg_hrsr_books)""]","plot-heavy, character-driven romantasy our fiesty, bad*ss heroine Diem Bellator Kindred's Curse Saga four-book epic fantasy romance series",Third,true,true,true
2025-08-11,Fantasy,B0DFW71SG1,The Knight and the Moth (The Stonewater Kingdom),Rachel Gillig,https://www.amazon.com/stores/author/B09F3VGD53,The Stonewater Kingdom,14.99,4.50,10396,438,2025-05-20,Orbit,"INSTANT #1 NEW YORK TIMES BESTSELLER! ""Prepare to meet your next obsession."" — Rebecca Ross, author of Divine Rivals From New York Times bestselling author Rachel Gillig comes the next big romantasy sensation, a gothic, mist-cloaked tale of a young prophetess forced on an impossible quest with the one knight whose future is beyond her sight. Perfect for fans of Jennifer L. Armentrout and Leigh Bardugo. Sybil Delling has spent nine years dreaming of having no dreams at all. Like the other foundling girls who traded a decade of service for a home in the great cathedral, Sybil is a Diviner. In her dreams she receives visions from six unearthly figures known as Omens. From them, she can predict terrible things before they occur, and lords and common folk alike travel across the kingdom of Traum’s windswept moors to learn their futures by her dreams. Just as she and her sister Diviners near the end of their service, a mysterious knight arrives at the cathedral. Rude, heretical, and devilishly handsome, the knight Rodrick has no respect for Sybil's visions. But when Sybil's fellow Diviners begin to vanish one by one, she has no choice but to seek his help in finding them. For the world outside the cathedral’s cloister is wrought with peril. Only the gods have the answers she is seeking, and as much as she'd rather avoid Rodrick's dark eyes and sharp tongue, only a heretic can defeat a god.",https://m.media-amazon.com/images/I/51DNB0VpXgL._SY445_SX342_.jpg,https://www.amazon.com/dp/B0DFW71SG1,"[""Aristocracy"",""Mystery""]","[""[#11 in Dark Fantasy](https://www.amazon.com/gp/bestsellers/books/9803/ref=pd_zg_hrsr_books)\n[#13 in Sword & Sorcery Fantasy (Books)](https://www.amazon.com/gp/bestsellers/books/16205/ref=pd_zg_hrsr_books)\n[#15 in Dark Fantasy Horror](https://www.amazon.com/gp/bestsellers/digital-text/157062011/ref=pd_zg_hrsr_digital-text)""]","Traum’s windswept moors Sybil's fellow Diviners INSTANT #1 NEW YORK TIMES BESTSELLER next big romantasy sensation Rodrick's dark eyes gothic, mist-cloaked tale cathedral’s cloister other foundling girls",Third,false,false,true
2025-08-11,Fantasy,B07YK1K1YK,Mexican Gothic,Silvia Moreno-Garcia,https://www.amazon.com/stores/author/B004H7M5PA,,9.99,4.10,32936,429,2020-06-30,Del Rey,"NEW YORK TIMES BESTSELLER • “It’s Lovecraft meets the Brontës in Latin America, and after a slow-burn start Mexican Gothic gets seriously weird.”— The Guardian ONE OF TIME ’S 100 BEST MYSTERY AND THRILLER BOOKS OF ALL TIME • WINNER OF THE LOCUS AWARD • NOMINATED FOR THE BRAM STOKER AWARD ONE OF THE BEST BOOKS OF THE YEAR: The New Yorker, Vanity Fair, NPR, The Washington Post, Tordotcom, Marie Claire, Vox, Mashable, Men’s Health, Library Journal, Book Riot, LibraryReads An isolated mansion. A chillingly charismatic aristocrat. And a brave socialite drawn to expose their treacherous secrets. . . . From the author of Gods of Jade and Shadow comes “a terrifying twist on classic gothic horror” (Kirkus Reviews) set in glamorous 1950s Mexico. After receiving a frantic letter from her newly-wed cousin begging for someone to save her from a mysterious doom, Noemí Taboada heads to High Place, a distant house in the Mexican countryside. She’s not sure what she will find—her cousin’s husband, a handsome Englishman, is a stranger, and Noemí knows little about the region. Noemí is also an unlikely rescuer: She’s a glamorous debutante, and her chic gowns and perfect red lipstick are more suited for cocktail parties than amateur sleuthing. But she’s also tough and smart, with an indomitable will, and she is not afraid: Not of her cousin’s new husband, who is both menacing and alluring; not of his father, the ancient patriarch who seems to be fascinated by Noemí; and not even of the house itself, which begins to invade Noemi’s dreams with visions of blood and doom. Her only ally in this inhospitable abode is the family’s youngest son. Shy and gentle, he seems to want to help Noemí, but might also be hiding dark knowledge of his family’s past. For there are many secrets behind the walls of High Place. The family’s once colossal wealth and faded mining empire kept them from prying eyes, but as Noemí digs deeper she unearths stories of violence and madness. And Noemí, mesmerized by the terrifying yet seductive world of High Place, may soon find it impossible to ever leave this enigmatic house behind. “It’s as if a supernatural power compels us to turn the pages of the gripping Mexican Gothic.”— The Washington Post “Mexican Gothic is the perfect summer horror read, and marks Moreno-Garcia with her hypnotic and engaging prose as one of the genre’s most exciting talents.” — Nerdist “A period thriller as rich in suspense as it is in lush ’50s atmosphere.” — Entertainment Weekly",https://m.media-amazon.com/images/I/51wPZT9-TJS._SY445_SX342_.jpg,https://www.amazon.com/dp/B07YK1K1YK,"[""Amateur Sleuth"",""Aristocracy"",""Mind Control"",""Suspense"",""Mystery"",""Thriller"",""Detective"",""Horror"",""Supernatural"",""Slow Burn""]","[""[#2 in Historical Fantasy (Kindle Store)](https://www.amazon.com/gp/bestsellers/digital-text/158582011/ref=pd_zg_hrsr_digital-text)\n[#3 in Historical Fantasy (Books)](https://www.amazon.com/gp/bestsellers/books/16201/ref=pd_zg_hrsr_books)\n[#7 in Gothic Fiction](https://www.amazon.com/gp/bestsellers/books/10159332011/ref=pd_zg_hrsr_books)""]",family’s youngest son terrifying yet seductive world her cousin’s new husband chillingly charismatic aristocrat her cousin’s husband a terrifying twist his family’s past slow-burn start Mexican Gothic a brave socialite The New Yorker TIME ’S 100 BEST MYSTERY NEW YORK TIMES BESTSELLER her newly-wed cousin,Third,true,true,true
2025-08-11,Fantasy,B072L58JW6,The Poppy War: A Novel,R. F Kuang,https://www.amazon.com/stores/author/B0788VXRHP,The Poppy War,15.99,4.30,30640,435,2018-05-01,Harper Voyager,"One of Time Magazine’s 100 Best Fantasy Books of All Time  “I have no doubt this will end up being the best fantasy debut of the year...I have absolutely no doubt that [Kuang’s] name will be up there with the likes of Robin Hobb and N.K. Jemisin.” -- Booknest  From #1 New York Times bestselling author of Babel and Yellowface, the brilliantly imaginative debut of R.F. Kuang: an epic historical military fantasy, inspired by the bloody history of China’s twentieth century and filled with treachery and magic, in the tradition of Ken Liu’s Grace of Kings and N.K. Jemisin’s Inheritance Trilogy.  When Rin aced the Keju—the Empire-wide test to find the most talented youth to learn at the Academies—it was a shock to everyone: to the test officials, who couldn’t believe a war orphan from Rooster Province could pass without cheating; to Rin’s guardians, who believed they’d finally be able to marry her off and further their criminal enterprise; and to Rin herself, who realized she was finally free of the servitude and despair that had made up her daily existence. That she got into Sinegard—the most elite military school in Nikan—was even more surprising.  But surprises aren’t always good.  Because being a dark-skinned peasant girl from the south is not an easy thing at Sinegard. Targeted from the outset by rival classmates for her color, poverty, and gender, Rin discovers she possesses a lethal, unearthly power—an aptitude for the nearly-mythical art of shamanism. Exploring the depths of her gift with the help of a seemingly insane teacher and psychoactive substances, Rin learns that gods long thought dead are very much alive—and that mastering control over those powers could mean more than just surviving school.  For while the Nikara Empire is at peace, the Federation of Mugen still lurks across a narrow sea. The militarily advanced Federation occupied Nikan for decades after the First Poppy War, and only barely lost the continent in the Second. And while most of the people are complacent to go about their lives, a few are aware that a Third Poppy War is just a spark away . . .  Rin’s shamanic powers may be the only way to save her people. But as she finds out more about the god that has chosen her, the vengeful Phoenix, she fears that winning the war may cost her humanity . . . and that it may already be too late.",https://m.media-amazon.com/images/I/41bnANqltqL._SY445_SX342_.jpg,https://www.amazon.com/dp/B072L58JW6,"[""Crime"",""School/Academy"",""Historical"",""Military"",""Teacher"",""Magic""]","[""[#1 in Asian Myth & Legend eBooks](https://www.amazon.com/gp/bestsellers/digital-text/6809428011/ref=pd_zg_hrsr_digital-text)\n[#2 in Cultural Heritage Fiction](https://www.amazon.com/gp/bestsellers/books/8946929011/ref=pd_zg_hrsr_books)\n[#3 in Fantasy (Kindle Store)](https://www.amazon.com/gp/bestsellers/digital-text/15195314011/ref=pd_zg_hrsr_digital-text)""]","Rin’s shamanic powers First Poppy War most talented youth brilliantly imaginative debut Empire-wide test lethal, unearthly power 100 Best Fantasy Books China’s twentieth century most elite military school militarily advanced Federation Third Poppy War seemingly insane teacher N.K. Jemisin’s Inheritance Trilogy nearly-mythical art Ken Liu’s Grace epic historical military fantasy dark-skinned peasant girl",Third,true,false,true
2025-08-11,Fantasy,B0DK76G7QJ,Throne of Ice and Blood (Flame and Thorns Book 2),Marion Blackwood,https://www.amazon.com/stores/author/B07YX7BN75,Flame and Thorns,4.99,4.40,8271,432,2025-02-24,Black Dagger Publishing,"After the Atonement Trials, Selena is trying to navigate her new life outside the Seelie Court. The world is very different from what she imagined, but her mission remains the same. Using every skill she has, she is going to help the secret resistance take down the Iceheart Dynasty. But that path yet again sets her on a collision course with Draven Ryat. While the rebellion plots a daring scheme, important people start turning up dead. Draven is tasked with solving the murders. Selena is trying to help the killer. If either one of them fails, they will face dire consequences. When blood stains the ice and dangerous secrets are brought to light, Selena must decide if she is willing to doom Draven in order to achieve her own goals. After everything that has happened between them, their relationship is already complicated. But now, with their very lives on the line, their tangled feelings for each other might destroy them both.",https://m.media-amazon.com/images/I/51J3z0VVBaL._SY445_SX342_.jpg,https://www.amazon.com/dp/B0DK76G7QJ,"[""Crime"",""Aristocracy""]","[""[#10 in Dragons & Mythical Creatures Fantasy (Books)](https://www.amazon.com/gp/bestsellers/books/16926919011/ref=pd_zg_hrsr_books)\n[#17 in Sword & Sorcery Fantasy eBooks](https://www.amazon.com/gp/bestsellers/digital-text/6809432011/ref=pd_zg_hrsr_digital-text)\n[#19 in Sword & Sorcery Fantasy (Books)](https://www.amazon.com/gp/bestsellers/books/16205/ref=pd_zg_hrsr_books)""]",,Third,false,false,true
2025-08-11,Fantasy,B082FRD429,Daughter of No Worlds (The War of Lost Hearts Book 1),Carissa Broadbent,https://www.amazon.com/stores/author/B01N1NMBV6,The War of Lost Hearts,3.99,4.30,44733,439,2020-01-07,,"A former slave fighting for justice. A reclusive warrior who no longer believes it exists. And a dark magic that will entangle their fates.  Ripped from a forgotten homeland as a child, Tisaanah learned how to survive with nothing but a sharp wit and a touch of magic. But the night she tries to buy her freedom, she barely escapes with her life.  Desperate to save the best friend she left behind, Tisaanah journeys to the Orders, the most powerful organizations of magic Wielders in the world. But to join their ranks, she must complete an apprenticeship with Maxantarius Farlione, a handsome and reclusive fire wielder who despises the Orders.  The Orders’ intentions are cryptic, and Tisaanah must prove herself under the threat of looming war. But even more dangerous are her growing feelings for Maxantarius. The bloody past he wants to forget may be the key to her future… or the downfall of them both.  But Tisaanah will stop at nothing to save those she abandoned. Even if it means gambling in the Orders’ deadly games. Even if it means sacrificing her heart.  Even if it means wielding death itself.  Fans of epic romantic fantasy like Sarah J. Maas and Raven Kennedy will devour this tale of dark magic, passionate romance, vengeance, and redemption.  (Note: This book contains adult material.)",https://m.media-amazon.com/images/I/519eIUjr-qL._SY445_SX342_.jpg,https://www.amazon.com/dp/B082FRD429,"[""Military"",""Magic""]","[""[#19 in Sword & Sorcery Fantasy eBooks](https://www.amazon.com/gp/bestsellers/digital-text/6809432011/ref=pd_zg_hrsr_digital-text)\n[#20 in Sword & Sorcery Fantasy (Books)](https://www.amazon.com/gp/bestsellers/books/16205/ref=pd_zg_hrsr_books)\n[#26 in Epic Fantasy (Kindle Store)](https://www.amazon.com/gp/bestsellers/digital-text/158580011/ref=pd_zg_hrsr_digital-text)""]",most powerful organizations handsome and reclusive fire wielder a dark magic former slave fighting Orders’ intentions Orders’ deadly games,Third,true,false,true
2025-08-11,Fantasy,B0F7GTJG72,Dispute: Welcome to the Multiverse,Sean Oswald,https://www.amazon.com/stores/author/B082P3914C,Welcome to the Multiverse,6.99,4.80,433,447,2025-08-04,,"ULTIMATE POWER WILL BE SOLD TO THE HIGHEST BIDDER Silas has a lot on his plate. Not only does he have to juggle the affections of three peak family suitors, but he has to prepare for the evacuation of Galen, before the unspeakable evil from his vision strikes. To do this, he's going to need some help from his friends, and a few hot ticket items at the multiverse's biggest auction, where only the most powerful even get a seat at the table. But there's a fourth peak family vying for his attentions, and if they can't have him, nobody will. The auction holds the key to Galen's salvation, but if he's not careful, certain items up for bid could mean the end of Silas, the Earth, and everyone he holds dear.",https://m.media-amazon.com/images/I/51EOPv48DML._SY445_SX342_.jpg,https://www.amazon.com/dp/B0F7GTJG72,,"[""[#1 in Coming of Age Fantasy eBooks](https://www.amazon.com/gp/bestsellers/digital-text/6809425011/ref=pd_zg_hrsr_digital-text)\n[#1 in Coming of Age Fantasy (Books)](https://www.amazon.com/gp/bestsellers/books/10387328011/ref=pd_zg_hrsr_books)\n[#2 in Post-Apocalyptic Science Fiction (Kindle Store)](https://www.amazon.com/gp/bestsellers/digital-text/6361471011/ref=pd_zg_hrsr_digital-text)""]",few hot ticket items multiverse's biggest auction fourth peak family three peak family suitors,Third,false,false,true
2025-08-11,Fantasy,B000FC1HBY,"A Clash of Kings (A Song of Ice and Fire, Book 2)",George R. R. Martin,https://www.amazon.com/stores/author/B000APIGH4,A Song of Ice and Fire,7.99,4.70,44261,449,2003-01-01,Random House Worlds,"THE BOOK BEHIND THE SECOND SEASON OF GAME OF THRONES, AN ORIGINAL SERIES NOW ON HBO. A SONG OF ICE AND FIRE: BOOK TWO In this thrilling sequel to A Game of Thrones, George R. R. Martin has created a work of unsurpassed vision, power, and imagination. A Clash of Kings transports us to a world of revelry and revenge, wizardry and warfare unlike any we have ever experienced. A comet the color of blood and flame cuts across the sky. And from the ancient citadel of Dragonstone to the forbidding shores of Winterfell, chaos reigns. Six factions struggle for control of a divided land and the Iron Throne of the Seven Kingdoms, preparing to stake their claims through tempest, turmoil, and war. It is a tale in which brother plots against brother and the dead rise to walk in the night. Here a princess masquerades as an orphan boy; a knight of the mind prepares a poison for a treacherous sorceress; and wild men descend from the Mountains of the Moon to ravage the countryside. Against a backdrop of incest and fratricide, alchemy and murder, victory may go to the men and women possessed of the coldest steel . . . and the coldest hearts. For when kings clash, the whole land trembles.",https://m.media-amazon.com/images/I/517-FlMRWkL._SY445_SX342_.jpg,https://www.amazon.com/dp/B000FC1HBY,"[""Crime"",""Dragon"",""Aristocracy"",""Sports"",""Magic"",""Supernatural""]","[""[#2 in Fantasy Adventure Fiction](https://www.amazon.com/gp/bestsellers/digital-text/7588728011/ref=pd_zg_hrsr_digital-text)\n[#20 in Science Fiction Adventures](https://www.amazon.com/gp/bestsellers/books/16273/ref=pd_zg_hrsr_books)\n[#20 in Sword & Sorcery Fantasy eBooks](https://www.amazon.com/gp/bestsellers/digital-text/6809432011/ref=pd_zg_hrsr_digital-text)""]",Here a princess masquerades the coldest hearts George R. R. Martin,Unknown,true,false,true
2025-08-11,Fantasy,B0F4J3PXH7,A Bargain So Bloody: A Dark Fantasy Romance (Kingdom of Dark Magic Book 1),Vasilisa Drake,https://www.amazon.com/stores/author/B0BXY4NXMD,Kingdom of Dark Magic,4.99,4.30,1216,451,2025-06-30,Late Night Daydreams LLC,"She’s trapped in a magical prison. To break out, she’ll make a deal with the most dangerous prisoner of them all.  Sentenced for a crime she didn’t commit, Samara is bullied by guards and tormented by the screams of her fellow prisoners. She’s resigned herself to enduring her fifteen-year term… until she learns that the freedom she's been promised is the cruelest lie of all.  Now she's faced with a choice: resign herself to dying in the cold walls of Castle Greymere, or do the unthinkable and escape. But no one leaves Greymere alive. So to break out of the prison? She’ll have to use one of the undead.  Raphael is the worst kind of monster: a vampire with a thirst for blood, the mortal enemy of witches, the same breed that killed her mother. And most importantly, he’s unspeakably powerful, his supernatural strength tamed only by the enchanted cuffs forced on him.  He’s her only chance at a life outside the prison walls.  The deal is simple: Samara unlocks his shackles, and he'll help her escape. But although Raphael agreed to help her leave Greymere, he never promised to let her go…  A Bargain So Bloody is the first book in an exciting new romantasy series, perfect for readers who love slow burn romance with morally grey heroes who fall first and hard and heroines who find their own strength.",https://m.media-amazon.com/images/I/51lYJ7RE+oL._SY445_SX342_.jpg,https://www.amazon.com/dp/B0F4J3PXH7,"[""Crime"",""Slow Burn"",""Witch"",""Dark Fantasy"",""Vampire"",""Magic"",""Supernatural""]","[""[#10 in Paranormal Vampire Romance](https://www.amazon.com/gp/bestsellers/digital-text/6190488011/ref=pd_zg_hrsr_digital-text)\n[#16 in Vampire Romances](https://www.amazon.com/gp/bestsellers/books/16399311/ref=pd_zg_hrsr_books)\n[#56 in Romantasy eBooks](https://www.amazon.com/gp/bestsellers/digital-text/158569011/ref=pd_zg_hrsr_digital-text)""]",exciting new romantasy series her fifteen-year term most dangerous prisoner,Third,true,true,true
