ingested_date,genre,asin,title,author,author_url,series,price,rating,review_count,rank_overall,release_date,publisher,blurb_text,cover_url,product_url,topic_tags,subcategories,blurb_keyphrases,estimated_pov,has_supernatural,has_romance,cover_ok
2025-08-11,Science Fiction & Fantasy,B09DCKSR8V,One Dark Window (The Shepherd King Book 1),Rachel Gillig,https://www.amazon.com/stores/author/B09F3VGD53,The Shepherd King,9.99,4.50,76914,100,2022-09-27,Orbit,"THE FANTASY BOOKTOK SENSATION! For fans of Uprooted and For the Wolf comes a dark, lushly gothic fantasy about a maiden who must unleash the monster within to save her kingdom—but the monster in her head isn't the only threat lurking. Elspeth needs a monster. The monster might be her. Elspeth Spindle needs more than luck to stay safe in the eerie, mist-locked kingdom she calls home—she needs a monster. She calls him the Nightmare, an ancient, mercurial spirit trapped in her head. He protects her. He keeps her secrets.  But nothing comes for free, especially magic.  When Elspeth meets a mysterious highwayman on the forest road, her life takes a drastic turn. Thrust into a world of shadow and deception, she joins a dangerous quest to cure the kingdom of the dark magic infecting it. Except the highwayman just so happens to be the King’s own nephew, Captain of the Destriers…and guilty of high treason.  He and Elspeth have until Solstice to gather twelve Providence Cards—the keys to the cure. But as the stakes heighten and their undeniable attraction intensifies, Elspeth is forced to face her darkest secret yet: the Nightmare is slowly, darkly, taking over her mind. And she might not be able to stop him.",https://m.media-amazon.com/images/I/5127EIyJPHL._SY445_SX342_.jpg,https://www.amazon.com/dp/B09DCKSR8V,"[""Magic"",""Mystery""]","[""[#1 in Gothic Fiction](https://www.amazon.com/gp/bestsellers/books/10159332011/ref=pd_zg_hrsr_books)\n[#3 in Sword & Sorcery Fantasy (Books)](https://www.amazon.com/gp/bestsellers/books/16205/ref=pd_zg_hrsr_books)\n[#4 in Dark Fantasy](https://www.amazon.com/gp/bestsellers/books/9803/ref=pd_zg_hrsr_books)""]","only threat lurking dark, lushly gothic fantasy King’s own nephew FANTASY BOOKTOK SENSATION mist-locked kingdom ancient, mercurial spirit",Third,true,false,true
2025-08-11,Science Fiction & Fantasy,B0CXNJDB4B,Phantasma: A dark fantasy romance (Wicked Games Book 1),Kaylie Smith,https://www.amazon.com/stores/author/B0B4BMB522,Wicked Games,3.99,4.30,50204,104,2024-09-03,Second Sky,"“WHERE DO I BEGIN? Has my heart forever!!… I absolutely devoured this… Plenty of spice… Had me on the edge of my seat the entire time, I was hanging onto every word that came out of that man’s mouth… I was sobbing!!… A complete rollercoaster!” Books.and.bunlife ⭐⭐⭐⭐⭐ Welcome to Phantasma. There are only two rules to the game. Stay alive. And don’t fall in love. When Ophelia’s sister disappears, there is only one way to save her. Ophelia must enter Phantasma, a deadly contest inside a haunted mansion, and claim its prize— a single wish. Phantasma is a maze of twisting corridors and lavish ballrooms, of demons and temptations. Ophelia will face nine challenges, each more dangerous than the last. There can only be one winner, and the other contestants will stop at nothing to eliminate their rivals. Every day the house creates new monsters. But just as Ophelia’s fears threaten to overwhelm her, a mysterious stranger offers her a bargain. Charming, arrogant and infuriatingly attractive, Blackwell claims he can guide her through the lethal trials ahead. All he asks in return is ten years of her life. Ophelia knows she shouldn’t trust him. Blackwell doesn’t seem dangerous, but appearances can be deceptive. Worse still, she feels a dark and irresistible attraction drawing them closer and closer. Her life is on the line. But in Phantasma, the only thing deadlier than losing the game is losing your heart… The #1 Kindle bestseller and TikTok sensation! A Court of Thorns and Roses meets Caraval in this seductive fantasy adventure. With steamy romance, a sexy morally gray love interest, OCD rep and jaw-dropping twists, Phantasma is perfect for fans of Rebecca Yarros, Nisha J. Tuli and Carissa Broadbent. See why readers love Phantasma: “ WOW what a ride! … Leaves you breathless … A hauntingly addictive read that will keep you on the edge of your seat from start to finish … What am I going to do with my life now? I need more Phantasma!!! ” NESSAS_BOOK_REVIEWS ⭐⭐⭐⭐⭐ “ ALL THE STARS. I LOVED THIS BOOK. I finished this in less than two days and I didn’t want it to end!… Gripping … An absolute must-read.” Goodreads reviewer ⭐⭐⭐⭐⭐ “ God, I am never going to recover from this book … I’m addicted! … I can’t even begin to put into words the rollercoaster of this book; the tension, the twists and turns that literally had me holding my breath until the VERY last page.” Goodreads reviewer ⭐⭐⭐⭐⭐ “I cannot begin to describe how much I love this… I have not stopped thinking about this story … Oh gosh I wish I could read this for the first time again!… I FELT EVERY EMOTION POSSIBLE WHILE READING THIS!!! … will forever hold a special place in my heart.” Goodreads reviewer ⭐⭐⭐⭐⭐ “ So freaking amazing! … So sold! I devoured this… I’m so in love with Blackwell… I can’t even… he has my heart… Such an epic romance, I just want to go back and read this for the first time … Loved, loved, loved… Thrilling. Sexy. Heartwrenching. I squealed, I screamed, I laughed and yes, I cried, too … In my favourite reads!” Goodreads reviewer ⭐⭐⭐⭐⭐ “ The most addictive romantasy I have read … SO good … Seductive, exciting PERFECTION… The SPICE was dangerously hot … Shouting from the rooftops for everyone to READ THIS RIGHT NOW.” Theveganbookdragon ⭐⭐⭐⭐⭐ “ My favorite book of all time! … A Necromancer in New Orleans?? Does it get cooler or more gothic than that???… The OCD REP was fantastic!!! … Blackwell, he was so freaking dreamy! … Marvelous … Beyond beautiful… I FREAKING LOVED THIS!!!!! ” Brittsbookbabblings ⭐⭐⭐⭐⭐",https://m.media-amazon.com/images/I/51tYEdS2t9L._SY445_SX342_.jpg,https://www.amazon.com/dp/B0CXNJDB4B,"[""Dark Fantasy"",""Steamy"",""Monsters"",""Supernatural"",""Dragon"",""Mystery""]","[""[#3 in New Adult & College Romance (Kindle Store)](https://www.amazon.com/gp/bestsellers/digital-text/6487838011/ref=pd_zg_hrsr_digital-text)\n[#5 in New Adult & College Romance (Books)](https://www.amazon.com/gp/bestsellers/books/8373230011/ref=pd_zg_hrsr_books)\n[#6 in Dark Fantasy Horror](https://www.amazon.com/gp/bestsellers/digital-text/157062011/ref=pd_zg_hrsr_digital-text)""]",#1 Kindle bestseller and TikTok sensation seductive fantasy adventure dark and irresistible attraction jaw-dropping twists,Third,true,true,true
2025-08-11,Science Fiction & Fantasy,B0DMTF6XR6,Kingdom of Tomorrow (Book of Arden 1),Gena Showalter,https://www.amazon.com/stores/author/B001I9RQQ8,Book of Arden,1.99,4.10,201,114,2025-09-01,Montlake,"From New York Times bestselling author Gena Showalter comes a fusion of modern and fantastical worlds, where a young woman must navigate a secret society, uncover a shocking enemy…and resist an undeniable attraction.  Twenty-year-old Arden Roosa knows only Ourland. Two worlds split and stitched together, with broken pieces from each, statues of fallen gods, and heavenly artifacts that are worshipped…or feared.  But nothing is more fearsome than the night.  A strange madness haunts the darkest hours, turning innocents into gleeful killers. Arden does her best to stay safe, until she reads a book written about her life― The Book of Arden ―and everything changes.  Forced to join Fort Bala Royal Academy, Arden is paired with the ruthless High Prince Cyrus Dolion. But while he trains her for combat against a mystical adversary, she can’t deny the sparks burning between them.  If her panic attacks and war games aren’t enough, Arden is also tapped to join the Tome Society, rumored guardians of an invisible library with books that foretell the future. But the more she learns about the society, the less she understands about Ourland, the gods…and the person she’s destined to be.",https://m.media-amazon.com/images/I/51YPrasqn-L._SY445_SX342_.jpg,https://www.amazon.com/dp/B0DMTF6XR6,"[""School/Academy"",""Crime"",""Aristocracy""]","[""[#2 in Magic Romance eBooks](https://www.amazon.com/gp/bestsellers/digital-text/120220984011/ref=pd_zg_hrsr_digital-text)\n[#6 in Dystopian Fiction (Books)](https://www.amazon.com/gp/bestsellers/books/3559311011/ref=pd_zg_hrsr_books)\n[#9 in New Adult & College Romance (Books)](https://www.amazon.com/gp/bestsellers/books/8373230011/ref=pd_zg_hrsr_books)""]",Twenty-year-old Arden Roosa ruthless High Prince Cyrus Dolion modern and fantastical worlds strange madness haunts Fort Bala Royal Academy her life― The Book,Third,false,false,true
2025-08-11,Science Fiction & Fantasy,B0DSTFZ54X,Freaky Festivals (Mystic Caravan Mysteries Book 20),Amanda M. Lee,https://www.amazon.com/stores/author/B00B522Z32,Mystic Caravan Mysteries,5.99,4.80,624,117,2025-08-05,WinchesterShaw Publications,"Mystic Caravan is hitting San Francisco. Unfortunately, a magical force in the city is hitting back. On their first night in town, they discover somebody has unleashed skeletons on the city…and there’s an army of them. The good news is that as far as foes go, they’re not very impressive. Poet Parker’s team can take them out with relative ease. The bad news is they’re not stopping…and they’re getting bolder each and every night. San Francisco’s history leads to a lot of questions. Are the skeletons coming from the cemeteries that were closed? Seems only a fraction of the bodies were moved when the city shut down for burials more than a century before. Who is raising them, though? Between Golden Gate Park, Fisherman’s Wharf, and Alcatraz, Mystic Caravan has a lot of dark corners to search through. A nosy police officer—one who has his own paranormal task force at the ready—is another concern. Not all evil is created equal. Sometimes what looks like evil isn’t evil at all. Still, the city needs to be saved. Are Poet and her motley crew of magical misfits up to the task? You’re about to find out. It’s going to be a bumpy—and bony—ride.",https://m.media-amazon.com/images/I/41ITbVIQIpL._SY445_SX342_.jpg,https://www.amazon.com/dp/B0DSTFZ54X,"[""Military"",""Police"",""Supernatural"",""Magic"",""Mystery""]","[""[#1 in Paranormal Fantasy (Kindle Store)](https://www.amazon.com/gp/bestsellers/digital-text/12569916011/ref=pd_zg_hrsr_digital-text)\n[#1 in Witch & Wizard Mysteries](https://www.amazon.com/gp/bestsellers/books/9536087011/ref=pd_zg_hrsr_books)\n[#1 in Mystery Romance](https://www.amazon.com/gp/bestsellers/digital-text/6487840011/ref=pd_zg_hrsr_digital-text)""]",his own paranormal task force nosy police officer Poet Parker’s team San Francisco’s history,Third,true,false,true
2025-08-11,Science Fiction & Fantasy,B0DS6MXLZC,The Night Prince: A Fantasy Romance (The Wolf King Book 2),Lauren Palphreyman,https://www.amazon.com/stores/author/B07B2Z4DKQ,The Wolf King,5.99,4.60,18434,121,2025-03-31,,"""Let me have you. Just once. Please."" Aurora is caught between powerful alphas as they fight for the Wolf Throne. But darker forces are rising. . . Aurora may have survived the Wolf King, but his bite marks her skin. In accordance with wolf law, that makes her his property. Now, he wants her back.  To beat him and take his throne, Aurora and Callum must form a dangerous alliance with one of the most feared Wolves in the Kingdom, Blake. He is their enemy, but he has entangled his life with Aurora’s—meaning she cannot harm him without forfeiting her own life.  As she fights to break their connection, she suspects Blake is keeping secrets about a dark power that rises in the north, and the unsettling nature of the bond between them. It seems there is a bigger game at play than who sits on the Wolf Throne—one that threatens both the Kingdom of Wolves, and the Kingdom of Men.  With her wolf awakening, enemies closing in, relationships tested, and secrets revealed—Aurora may be the only one who can stop an ancient evil from rising.  If she can figure out who to trust.  If she can figure out where she, and her heart, belong.  If she can stay alive. The highly anticipated sequel to The Wolf King. A romantasy for fans of enemies to lovers, shifters, forbidden romance, villains you love to hate (or maybe just love!), and werewolves. Contains strong language and sexual situations.",https://m.media-amazon.com/images/I/5160lq1gjkL._SY445_SX342_.jpg,https://www.amazon.com/dp/B0DS6MXLZC,"[""Shifter"",""Enemies to Lovers"",""Alpha Male"",""Aristocracy""]","[""[#2 in Paranormal Fantasy (Kindle Store)](https://www.amazon.com/gp/bestsellers/digital-text/12569916011/ref=pd_zg_hrsr_digital-text)\n[#4 in Paranormal Fantasy Books](https://www.amazon.com/gp/bestsellers/books/9673710011/ref=pd_zg_hrsr_books)\n[#8 in Romantic Fantasy (Books)](https://www.amazon.com/gp/bestsellers/books/13922577011/ref=pd_zg_hrsr_books)""]","Kingdom, Blake most feared Wolves highly anticipated sequel",Third,true,true,true
2025-08-11,Science Fiction & Fantasy,B08CHNCDN5,A Court of Silver Flames (A Court of Thorns and Roses Book 5),Sarah J. Maas,https://www.amazon.com/stores/author/B0070291GK,A Court of Thorns and Roses,8.21,4.80,227959,143,2021-02-16,Bloomsbury Publishing,"Sarah J. Maas's sexy, richly imagined series continues with the journey of Feyre's fiery sister, Nesta. Nesta Archeron has always been prickly-proud, swift to anger, and slow to forgive. And ever since being forced into the Cauldron and becoming High Fae against her will, she's struggled to find a place for herself within the strange, deadly world she inhabits. Worse, she can't seem to move past the horrors of the war with Hybern and all she lost in it. The one person who ignites her temper more than any other is Cassian, the battle-scarred warrior whose position in Rhysand and Feyre's Night Court keeps him constantly in Nesta's orbit. But her temper isn't the only thing Cassian ignites. The fire between them is undeniable, and only burns hotter as they are forced into close quarters with each other. Meanwhile, the treacherous human queens who returned to the Continent during the last war have forged a dangerous new alliance, threatening the fragile peace that has settled over the realms. And the key to halting them might very well rely on Cassian and Nesta facing their haunting pasts. Against the sweeping backdrop of a world seared by war and plagued with uncertainty, Nesta and Cassian battle monsters from within and without as they search for acceptance-and healing-in each other's arms.",https://m.media-amazon.com/images/I/51bs545ZE6L._SY445_SX342_.jpg,https://www.amazon.com/dp/B08CHNCDN5,"[""Fae/Elves"",""Military"",""Monsters"",""Pandemic""]","[""[#2 in Fantasy Action & Adventure](https://www.amazon.com/gp/bestsellers/books/10159265011/ref=pd_zg_hrsr_books)\n[#8 in Romantasy](https://www.amazon.com/gp/bestsellers/books/7654406011/ref=pd_zg_hrsr_books)\n[#12 in Epic Fantasy (Kindle Store)](https://www.amazon.com/gp/bestsellers/digital-text/158580011/ref=pd_zg_hrsr_digital-text)""]","strange, deadly world other's arms treacherous human queens Feyre's fiery sister uncertainty, Nesta and Cassian battle monsters dangerous new alliance Rhysand and Feyre's Night Court battle-scarred warrior Sarah J. Maas's sexy, richly imagined series",Third,true,false,true
2025-08-11,Science Fiction & Fantasy,B08XK8L1J7,Gleam (The Plated Prisoner Series Book 3),Raven Kennedy,https://www.amazon.com/stores/author/B07GT8KZCC,The Plated Prisoner Series,6.99,4.60,67277,134,2021-05-31,Raven Kennedy,"Book 3 of this adult fantasy series continues in this epic story inspired by the myth of King Midas, fae, fated romance, and insurmountable greed. ""I don't choose him. Not anymore. I'm choosing me."" King Midas made me the woman I am today. Notorious. Unattainable. His. The thing about being confined is that you believe it’s to keep the bad out. ...Until you realize it’s about keeping you in. I’m now in a strange kingdom surrounded by liars, with no allies of my own, but I won’t sit idly by and let myself wither. No, there’s something that’s bloomed from the pit of my repression. Something dark. Something angry. But the last thing I expected was for my anger to call out to him. King Ravinger. He’s sinister and powerful and entirely too seductive. I’ve learned my lesson with trusting manipulative kings, so why does my chest constrict every time he’s near? I need to tread carefully, or I’m at risk of losing much more than just my freedom. Regret and revenge war inside of me, and I need to figure out a plan fast before I get tangled up in the schemes of kings and queens. Because I won’t be caught in a cage again. No, this time, it’ll be me setting the trap. …I just hope my heart comes out of this unscathed. Please note: This adult fantasy book contains explicit content and dark elements that may be triggering to some. It includes explicit romance, mature language, violence, Stockholm Syndrome and emotional manipulation/abuse, drug use, and death. This is book 3 in a series.",https://m.media-amazon.com/images/I/51+Z6-J6+NL._SY445_SX342_.jpg,https://www.amazon.com/dp/B08XK8L1J7,"[""Fae/Elves""]","[""[#1 in Fairy Tale Fantasy (Kindle Store)](https://www.amazon.com/gp/bestsellers/digital-text/169457011/ref=pd_zg_hrsr_digital-text)\n[#1 in Greek & Roman Myth & Legend](https://www.amazon.com/gp/bestsellers/books/10387332011/ref=pd_zg_hrsr_books)\n[#5 in Sword & Sorcery Fantasy (Books)](https://www.amazon.com/gp/bestsellers/books/16205/ref=pd_zg_hrsr_books)""]",emotional manipulation/abuse adult fantasy book Regret and revenge war adult fantasy series,First,true,false,true
2025-08-11,Science Fiction & Fantasy,B007N6JEII,Throne of Glass,Sarah J. Maas,https://www.amazon.com/stores/author/B0070291GK,Throne Of Glass Series,9.99,4.40,154005,147,2012-08-07,Bloomsbury Publishing,"Lethal. Loyal. Legendary. Enter the world of Throne of Glass with the first book in the #1 bestselling series by Sarah J. Maas. In a land without magic, an assassin is summoned to the castle. She has no love for the vicious king who rules from his throne of glass, but she has not come to kill him. She has come to win her freedom. If she defeats twenty-three murderers, thieves, and warriors in a competition, she will be released from prison to serve as the King's Champion. Her name is Celaena Sardothien. The Crown Prince will provoke her. The Captain of the Guard will protect her. And a princess from a faraway country will befriend her. But something rotten dwells in the castle, and it's there to kill. When her competitors start dying mysteriously, one by one, Celaena's fight for freedom becomes a fight for survival-and a desperate quest to root out the evil before it destroys her world. Thrilling and fierce, Throne of Glass is the first book in the #1 New York Times bestselling series that has captivated readers worldwide.",https://m.media-amazon.com/images/I/4183SUxHN7L._SY445_SX342_.jpg,https://www.amazon.com/dp/B007N6JEII,"[""Aristocracy"",""Military"",""Magic"",""Mystery"",""Crime""]","[""[#1 in Paranormal Fantasy Books](https://www.amazon.com/gp/bestsellers/books/9673710011/ref=pd_zg_hrsr_books)\n[#5 in Romantasy](https://www.amazon.com/gp/bestsellers/books/7654406011/ref=pd_zg_hrsr_books)\n[#9 in Epic Fantasy (Books)](https://www.amazon.com/gp/bestsellers/books/16197/ref=pd_zg_hrsr_books)""]",#1 bestselling series #1 New York Times twenty-three murderers King's Champion,Third,true,false,true
2025-08-11,Science Fiction & Fantasy,B00CVS2J80,Red Rising (Red Rising Series Book 1),Pierce Brown,https://www.amazon.com/stores/author/B00EDBZVNI,Red Rising,5.99,4.60,78203,142,2014-01-28,Del Rey,"NEW YORK TIMES BESTSELLER • Pierce Brown’s relentlessly entertaining debut channels the excitement of The Hunger Games by Suzanne Collins and Ender’s Game by Orson Scott Card. “ Red Rising ascends above a crowded dys­topian field.” —USA Today ONE OF THE BEST BOOKS OF THE YEAR— Entertainment Weekly, BuzzFeed, Shelf Awareness “I live for the dream that my children will be born free,” she says. “That they will be what they like. That they will own the land their father gave them.” “I live for you,” I say sadly. Eo kisses my cheek. “Then you must live for more.” Darrow is a Red, a member of the lowest caste in the color-coded society of the future. Like his fellow Reds, he works all day, believing that he and his people are making the surface of Mars livable for future generations. Yet he toils willingly, trusting that his blood and sweat will one day result in a better world for his children. But Darrow and his kind have been betrayed. Soon he discovers that humanity reached the surface generations ago. Vast cities and lush wilds spread across the planet. Darrow—and Reds like him—are nothing more than slaves to a decadent ruling class. Inspired by a longing for justice, and driven by the memory of lost love, Darrow sacrifices everything to infiltrate the legendary Institute, a proving ground for the dominant Gold caste, where the next generation of humanity’s overlords struggle for power. He will be forced to compete for his life and the very future of civilization against the best and most brutal of Society’s ruling class. There, he will stop at nothing to bring down his enemies . . . even if it means he has to become one of them to do so. Praise for Red Rising “[A] spectacular adventure . . . one heart-pounding ride . . . Pierce Brown’s dizzyingly good debut novel evokes The Hunger Games, Lord of the Flies, and Ender’s Game. . . . [ Red Rising ] has everything it needs to become meteoric.” — Entertainment Weekly “Ender, Katniss, and now Darrow.” —Scott Sigler “ Red Rising is a sophisticated vision. . . . Brown will find a devoted audience.” — Richmond Times-Dispatch Don’t miss any of Pierce Brown’s Red Rising Saga: RED RISING • GOLDEN SON • MORNING STAR • IRON GOLD • DARK AGE • LIGHT BRINGER",https://m.media-amazon.com/images/I/51D77-p9JJL._SY445_SX342_.jpg,https://www.amazon.com/dp/B00CVS2J80,,"[""[#1 in War & Military Action Fiction (Books)](https://www.amazon.com/gp/bestsellers/books/10159275011/ref=pd_zg_hrsr_books)\n[#1 in Fantasy Adventure Fiction](https://www.amazon.com/gp/bestsellers/digital-text/7588728011/ref=pd_zg_hrsr_digital-text)\n[#2 in Science Fiction Adventures](https://www.amazon.com/gp/bestsellers/books/16273/ref=pd_zg_hrsr_books)""]",NEW YORK TIMES BESTSELLER • Pierce Brown’s relentlessly entertaining debut channels color-coded society Suzanne Collins and Ender’s Game dominant Gold caste Society’s ruling class humanity’s overlords struggle Shelf Awareness Eo Pierce Brown’s Red Rising Saga decadent ruling class,Third,false,false,true
2025-08-11,Science Fiction & Fantasy,B075818VDG,A Court of Frost and Starlight (A Court of Thorns and Roses Book 4),Sarah J. Maas,https://www.amazon.com/stores/author/B0070291GK,A Court of Thorns and Roses,8.06,4.20,170004,166,2018-05-01,Bloomsbury Publishing,"A tender addition to the #1 New York Times bestselling Court of Thorns and Roses series by Sarah J. Maas, bridging the events of A Court of Wings and Ruin and upcoming books. Feyre, Rhysand, and their friends are still busy rebuilding the Night Court and the vastly altered world beyond, recovering from the war that changed everything. But Winter Solstice is finally approaching, and with it, the joy of a hard-earned reprieve. Yet even the festive atmosphere can't keep the shadows of the past from looming. As Feyre navigates her first Winter Solstice as High Lady, her concern for those dearest to her deepens. They have more wounds than she anticipated-scars that will have a far-reaching impact on the future of their court. Bridging the events of A Court of Wings and Ruin with the later books in the series, A Court of Frost and Starlight explores the far-reaching effects of a devastating war and the fierce love between friends.",https://m.media-amazon.com/images/I/51zRpAiY8KL._SY445_SX342_.jpg,https://www.amazon.com/dp/B075818VDG,,"[""[#9 in Romantasy](https://www.amazon.com/gp/bestsellers/books/7654406011/ref=pd_zg_hrsr_books)\n[#13 in Epic Fantasy (Kindle Store)](https://www.amazon.com/gp/bestsellers/digital-text/158580011/ref=pd_zg_hrsr_digital-text)\n[#16 in Epic Fantasy (Books)](https://www.amazon.com/gp/bestsellers/books/16197/ref=pd_zg_hrsr_books)""]",Thorns and Roses series #1 New York Times far-reaching impact vastly altered world her first Winter Solstice hard-earned reprieve even the festive atmosphere far-reaching effects,Third,false,false,true
