ingested_date,genre,asin,title,author,author_url,series,price,rating,review_count,rank_overall,release_date,publisher,blurb_text,cover_url,product_url,topic_tags,subcategories,blurb_keyphrases,estimated_pov,has_supernatural,has_romance,cover_ok
2025-08-11,Science Fiction & Fantasy,B0FC3LXWGR,Ultimate Level 1: Ultimate Dreams,Shawn Wilson,https://www.amazon.com/stores/author/B0C6FR5G5N,Ultimate Level 1,6.99,4.90,370,212,2025-08-07,Mango Media LLC,"Max's decision to have Rakonath enter the tower with him and the party has cost Bob, his black skill, to be imprisoned. With the tower now throwing difficult scenarios and choices that supposedly have long term impact on something.  Now Max must face the tower and what lies within without the ability to consume new skills. What kind of power will he miss out on and can the team find a way to fix the problem with Bob?",https://m.media-amazon.com/images/I/41wbglOQ1sL._SY445_SX342_.jpg,https://www.amazon.com/dp/B0FC3LXWGR,,"[""[#1 in GameLit & LitRPG Fiction](https://www.amazon.com/gp/bestsellers/books/99546083011/ref=pd_zg_hrsr_books)\n[#1 in GameLit & LitRPG Fiction eBooks](https://www.amazon.com/gp/bestsellers/digital-text/99546054011/ref=pd_zg_hrsr_digital-text)\n[#1 in Action & Adventure Fantasy (Kindle Store)](https://www.amazon.com/gp/bestsellers/digital-text/16232448011/ref=pd_zg_hrsr_digital-text)""]",,Third,false,false,true
2025-08-11,Science Fiction & Fantasy,B0BTYYVX9Q,Two Twisted Crowns (The Shepherd King Book 2),Rachel Gillig,https://www.amazon.com/stores/author/B09F3VGD53,The Shepherd King,11.99,4.60,76227,236,2023-10-17,Orbit,"In the New York Times bestselling sequel to One Dark Window, Elspeth must confront the weight of her actions as she and Ravyn embark on a perilous quest to save the kingdom—perfect for readers of Hannah Whitten's For the Wolf and Alexis Henderson's The Year of the Witching. Gripped by a tyrant king and in the thrall of dark magic, the kingdom is in peril. Elspeth and Ravyn have gathered most of the twelve Providence Cards, but the last—and most important—one remains to be found: the Twin Alders. If they’re going to find the card before Solstice and set free the kingdom, they will need to journey through the dangerous mist-cloaked forest. The only one who can lead them through is the monster that shares Elspeth’s head: the Nightmare. And he’s not eager to share any longer. Praise for One Dark Window: ""Enthralling from beginning to shocking end."" —Hannah Whitten, New York Times bestselling author of For the Wolf ""Pulse pounding, darkly whimsical, and aglow with treacherous magic."" —Allison Saft, New York Times bestselling author of A Far Wilder Magic The Shepherd King One Dark Window Two Twisted Crowns",https://m.media-amazon.com/images/I/51zjHQ1FVyL._SY445_SX342_.jpg,https://www.amazon.com/dp/B0BTYYVX9Q,"[""Magic"",""Witch"",""Supernatural""]","[""[#3 in Gothic Fiction](https://www.amazon.com/gp/bestsellers/books/10159332011/ref=pd_zg_hrsr_books)\n[#6 in Sword & Sorcery Fantasy (Books)](https://www.amazon.com/gp/bestsellers/books/16205/ref=pd_zg_hrsr_books)\n[#7 in Dark Fantasy](https://www.amazon.com/gp/bestsellers/books/9803/ref=pd_zg_hrsr_books)""]",Wolf and Alexis Henderson's The Year Shepherd King One Dark Window Two Twisted Crowns dangerous mist-cloaked forest twelve Providence Cards New York Times,Third,true,false,true
2025-08-11,Science Fiction & Fantasy,B0BGT7SZPT,The Book of Azrael (Gods & Monsters 1),Amber V. Nicole,https://www.amazon.com/stores/author/B09PJ8SMRJ,Gods & Monsters,2.99,4.40,35847,245,2022-09-28,Rose & Star Publishing,"World Ender meets Ender of Worlds... A thousand years ago, Dianna gave up her life in the deserts of Eoria to save her dying sister. She called upon anyone who would listen, not expecting a monster far worse than any nightmare to answer. Now she does what Kaden asks, even if that means securing an ancient relic from the very creatures that hunt her. A King thought long dead and long forgotten. In the old world his name was Samkiel. In the new world it is Liam, but one title remains true throughout time. He is the World Ender, a myth to his enemies, a savior and King to those loyal to him. After the Gods War, he locked himself away, hiding from the world. He denied his crown and responsibilities, leaving the very ones who needed him most to deal with the fallout of the death of their homeworld. Now an attack on those he holds dear sends him back to the one realm he never wished to visit again and into the sights of an enemy he thought imprisoned eons ago. Now enemies older than time must put aside their differences and work together in hopes of saving both their world and every realm in between.",https://m.media-amazon.com/images/I/511KlkbPMAL._SY445_SX342_.jpg,https://www.amazon.com/dp/B0BGT7SZPT,"[""Monsters""]","[""[#1 in Urban Fantasy (Kindle Store)](https://www.amazon.com/gp/bestsellers/digital-text/6157854011/ref=pd_zg_hrsr_digital-text)\n[#4 in Urban Fantasy (Books)](https://www.amazon.com/gp/bestsellers/books/383988011/ref=pd_zg_hrsr_books)\n[#8 in Dark Fantasy Horror](https://www.amazon.com/gp/bestsellers/digital-text/157062011/ref=pd_zg_hrsr_digital-text)""]",,Third,true,false,true
2025-08-11,Science Fiction & Fantasy,B07YLBYWPD,Zodiac Academy 4: Shadow Princess,Caroline Peckham,https://www.amazon.com/stores/author/B01A4DVOU2,Zodiac Academy,7.99,4.50,69722,233,2020-01-13,King's Hollow,"The shadows are in my blood. I can feel them crawling through me, slithering under my skin and taking me hostage. But the darkness within me isn't nearly as bad as the darkness that lives around me.  The four Celestial Heirs will stop at nothing to destroy the lives of me and my sister. But they haven't figured out yet, that we're the strongest creatures they've ever known. And when that secret comes out, we need to be ready to face them as well as any other cruel Fae who rises against us. It’s us or them. And it damn well won’t be us.",https://m.media-amazon.com/images/I/510oMJt8FEL._SY445_SX342_.jpg,https://www.amazon.com/dp/B07YLBYWPD,"[""Fae/Elves"",""School/Academy""]","[""[#5 in Paranormal Vampire Romance](https://www.amazon.com/gp/bestsellers/digital-text/6190488011/ref=pd_zg_hrsr_digital-text)\n[#5 in Vampire Romances](https://www.amazon.com/gp/bestsellers/books/16399311/ref=pd_zg_hrsr_books)\n[#27 in Romantic Fantasy (Books)](https://www.amazon.com/gp/bestsellers/books/13922577011/ref=pd_zg_hrsr_books)""]",four Celestial Heirs other cruel Fae,First,true,false,true
2025-08-11,Science Fiction & Fantasy,B08914K4F9,Zodiac Academy 5: Cursed Fates,Caroline Peckham,https://www.amazon.com/stores/author/B01A4DVOU2,Zodiac Academy,7.99,4.50,68514,235,2020-05-20,King's Hollow,"The stars have cursed us all. After the devastating events at Zodiac Academy, we have to deal with this hollow reality we're faced with. Lionel seeks to destroy us, the Nymphs seek to destroy the entire Fae race, and between all of it, we have to try and survive each day and prove our worth in this forsaken place. I'm afraid of everything falling apart, but it looks like it already has. Death lurks around every corner, and it wants to claim me and my sister. But together, we will overcome the darkness that seeks to defeat us. Because we were forged in fire. And these flames will never die.",https://m.media-amazon.com/images/I/51wavuiLVkL._SY445_SX342_.jpg,https://www.amazon.com/dp/B08914K4F9,"[""Fae/Elves"",""School/Academy""]","[""[#6 in Paranormal Vampire Romance](https://www.amazon.com/gp/bestsellers/digital-text/6190488011/ref=pd_zg_hrsr_digital-text)\n[#7 in Vampire Romances](https://www.amazon.com/gp/bestsellers/books/16399311/ref=pd_zg_hrsr_books)\n[#29 in Romantic Fantasy (Books)](https://www.amazon.com/gp/bestsellers/books/13922577011/ref=pd_zg_hrsr_books)""]",entire Fae race,First,true,false,true
2025-08-11,Science Fiction & Fantasy,B093WB84G1,House of Sky and Breath (Crescent City),Sarah J. Maas,https://www.amazon.com/stores/author/B0070291GK,Crescent City,9.99,4.70,109594,259,2022-02-15,Bloomsbury Publishing,"The #1 New York Times bestseller! Sarah J. Maas's sexy, groundbreaking CRESCENT CITY series continues with the second installment. Bryce Quinlan and Hunt Athalar are trying to get back to normal-they may have saved Crescent City, but with so much upheaval in their lives lately, they mostly want a chance to relax. Slow down. Figure out what the future holds. The Asteri have kept their word so far, leaving Bryce and Hunt alone. But with the rebels chipping away at the Asteri's power, the threat the rulers pose is growing. As Bryce, Hunt, and their friends get pulled into the rebels' plans, the choice becomes clear: stay silent while others are oppressed, or fight for what's right. And they've never been very good at staying silent. In this sexy, action-packed sequel to the #1 bestseller House of Earth and Blood, Sarah J. Maas weaves a captivating story of a world about to explode-and the people who will do anything to save it.",https://m.media-amazon.com/images/I/510yEVsHAIL._SY445_SX342_.jpg,https://www.amazon.com/dp/B093WB84G1,,"[""[#6 in Fantasy Action & Adventure](https://www.amazon.com/gp/bestsellers/books/10159265011/ref=pd_zg_hrsr_books)\n[#13 in Epic Fantasy (Books)](https://www.amazon.com/gp/bestsellers/books/16197/ref=pd_zg_hrsr_books)\n[#18 in Epic Fantasy (Kindle Store)](https://www.amazon.com/gp/bestsellers/digital-text/158580011/ref=pd_zg_hrsr_digital-text)""]","#1 bestseller House sexy, action-packed sequel rebels' plans #1 New York Times bestseller Sarah J. Maas's sexy, groundbreaking CRESCENT CITY series  second installment Asteri's power",Third,false,false,true
2025-08-11,Science Fiction & Fantasy,B0F2S9VDDW,Hex to Nothing (A Supernatural Speakeasy Cozy Mystery Book 18),Lily Harper Hart,https://www.amazon.com/stores/author/B00NW0JTG6,A Supernatural Speakeasy Cozy Mystery,4.99,4.80,409,237,2025-08-05,HarperHart Publications,"Ofelia Archer thought she’d faced off with every paranormal enemy known to man. She was wrong. She’s about to fight something even bigger than she ever imagined. The weird thing is the packaging is somewhat smaller. When at a Carnival parade, goblins descend and take Ofelia and her fiancé Zach Sully by surprise. The attack is quick and brutal. When the dust clears, one of New Orleans’ richest men is dead. Was that an accident or by design? As Ofelia and Sully start digging, they find a tangled web of deceit. The goblins have been in New Orleans before, but they were driven out by a magical contingent of vampires. They have no intention of leaving again. On top of that, their king has decided he needs a wife. He wants that wife to be Ofelia. As Ofelia learns about the past she starts worrying about the future. Can she fight off an entire army of goblins and keep those she loves safe? The war is on, and only one side will come out victorious. Who will it be, the goblin king or the French Quarter’s favorite witch?",https://m.media-amazon.com/images/I/517gToVJlcL._SY445_SX342_.jpg,https://www.amazon.com/dp/B0F2S9VDDW,"[""Military"",""Cozy"",""Witch"",""Supernatural"",""Magic"",""Vampire"",""Mystery""]","[""[#1 in Paranormal Witches & Wizards Romance](https://www.amazon.com/gp/bestsellers/digital-text/6401743011/ref=pd_zg_hrsr_digital-text)\n[#2 in Witch & Wizard Mysteries](https://www.amazon.com/gp/bestsellers/books/9536087011/ref=pd_zg_hrsr_books)\n[#2 in Mystery Romance](https://www.amazon.com/gp/bestsellers/digital-text/6487840011/ref=pd_zg_hrsr_digital-text)""]",French Quarter’s favorite witch,Third,true,false,true
2025-08-11,Science Fiction & Fantasy,B01M8NHXGH,Tower of Dawn (Throne of Glass Book 6),Sarah J. Maas,https://www.amazon.com/stores/author/B0070291GK,Throne Of Glass Series,8.21,4.60,92034,257,2017-09-05,Bloomsbury Publishing,"A glorious empire. A desperate quest. An ancient secret. The search for allies extends to a new land in the sixth book of the #1 bestselling Throne of Glass series by Sarah J. Maas. Chaol Westfall and Nesryn Faliq have arrived in the shining city of Antica to forge an alliance with the Khagan of the Southern Continent, whose vast armies are Erilea's last hope. But they have also come to Antica for another purpose: to seek healing at the famed Torre Cesme for the wounds Chaol received in Rifthold. After enduring unspeakable horrors as a child at the hands of Adarlanian soldiers, Yrene Towers has no desire to help the young lord from Adarlan, let alone heal him. Yet she has sworn an oath to assist those in need, and she will honor it. But Lord Westfall carries his own dark past, and Yrene soon realizes that those shadows could engulf them both. Chaol, Nesryn, and Yrene will have to draw on every scrap of their resilience to overcome the danger that surrounds them. But while they become entangled in the political webs of the khaganate, long-awaited answers slumber deep in the mountains, where warriors soar on legendary ruks. Answers that might offer their world a chance at survival . . . or doom them all. The final battle looms in this sixth book in the #1 New York Times bestselling Throne of Glass series.",https://m.media-amazon.com/images/I/51qv3sw7EHL._SY445_SX342_.jpg,https://www.amazon.com/dp/B01M8NHXGH,"[""Military"",""Aristocracy""]","[""[#19 in Epic Fantasy (Kindle Store)](https://www.amazon.com/gp/bestsellers/digital-text/158580011/ref=pd_zg_hrsr_digital-text)\n[#24 in New Adult & College Romance (Books)](https://www.amazon.com/gp/bestsellers/books/8373230011/ref=pd_zg_hrsr_books)\n[#35 in Romantasy eBooks](https://www.amazon.com/gp/bestsellers/digital-text/158569011/ref=pd_zg_hrsr_digital-text)""]","#1 New York Times famed Torre Cesme Erilea's last hope khaganate, long-awaited answers slumber his own dark past",Third,false,false,true
2025-08-11,Science Fiction & Fantasy,B0CXQDZZCT,The Songbird and the Heart of Stone (Crowns of Nyaxia Book 3),Carissa Broadbent,https://www.amazon.com/stores/author/B01N1NMBV6,Crowns of Nyaxia,6.99,4.30,28987,242,2024-11-19,Independently Published,"New York Times bestselling author and BookTok sensation Carissa Broadbent returns with a brand new novel in the Crowns of Nyaxia series, Songbird and the Heart of Stone, where A Court of Thorns and Roses meets Dante’s Inferno, in an epic fantasy romance of love and treachery between mortals and gods.  Mische lost everything when she was forcibly Turned into a vampire–her home, her humanity, and most devastating of all, the love of the sun god to whom she had devoted her life. Now, sentenced to death for murdering the vampire prince who Turned her, redemption feels impossible.  But when Mische is saved by Asar, the bastard prince of the House of Shadow with a past as brutal as his scars, she’s forced into a mission worse than execution: a journey to the underworld to resurrect the god of death himself.  Yet, Mische’s punishment may be the key to her salvation. In a secret meeting, her sun god commands her to help Asar in his mission, only to betray him… by killing the god of death.  Mische and Asar must travel the treacherous path to the underworld, facing trials, beasts, and the vengeful ghosts of their pasts. But most dangerous of all is the alluring call of the darkness–and her forbidden attraction to Asar, a burgeoning bond that risks invoking the wrath of gods.  As her betrayal looms, the underworld closes in and angry gods grow restless. Mische will be forced to choose between the redemption of the sun or the damnation of the darkness.",https://m.media-amazon.com/images/I/51xRwOC-MrL._SY445_SX342_.jpg,https://www.amazon.com/dp/B0CXQDZZCT,"[""Epic Fantasy"",""Ghosts"",""Supernatural"",""Vampire"",""Crime""]","[""[#10 in Sword & Sorcery Fantasy eBooks](https://www.amazon.com/gp/bestsellers/digital-text/6809432011/ref=pd_zg_hrsr_digital-text)\n[#11 in Sword & Sorcery Fantasy (Books)](https://www.amazon.com/gp/bestsellers/books/16205/ref=pd_zg_hrsr_books)\n[#15 in Romantic Fantasy (Books)](https://www.amazon.com/gp/bestsellers/books/13922577011/ref=pd_zg_hrsr_books)""]",BookTok sensation Carissa Broadbent epic fantasy romance brand new novel,Third,true,false,true
2025-08-11,Science Fiction & Fantasy,B0DPJ9FRYL,While the Dark Remains (The Winter Dark Book 1),Joanna Ruth Meyer,https://www.amazon.com/stores/author/B074HSX5NZ,The Winter Dark,4.99,4.30,1289,249,2025-08-01,47North,"In an icebound palace of magic and menace, a young woman plots to outwit a cruel king in a bracing fantasy about love, found family, and immeasurable revenge.  Brynja spent her childhood as a captive performer in Tenebris, the imposing mountain palace of King Kallias. Every night she risked death for the king’s entertainment until his rebellious son, Prince Ballast, helped her escape. Now twenty, Brynja has never forgotten the brutal king. Or forgiven him. Under the cloak of a three-month-long Winter Dark, Brynja is returning to Tenebris for revenge.  Accompanied by a rival court, including the alluring Prince Vil, Brynja poses as diplomatic royalty to barter peace between nations. No one is better equipped to infiltrate the palace than Brynja—she remembers every hidden passage like a bad dream. But her quest to destroy Kallias is complicated by her feelings for Prince Ballast, whom she isn’t sure she can still trust. And Kallias’s own quest to mine a catastrophic weapon of war buried in the mountain’s heart will threaten them all, and force Brynja to face the darkest parts of herself.  The lives of everyone she loves depend on the choices she must make. So, too, does the fate of the world.",https://m.media-amazon.com/images/I/51n8F2WM1VL._SY445_SX342_.jpg,https://www.amazon.com/dp/B0DPJ9FRYL,"[""Magic"",""Aristocracy""]","[""[#1 in Fairy Tales (Books)](https://www.amazon.com/gp/bestsellers/books/297517/ref=pd_zg_hrsr_books)\n[#3 in Fairy Tale Fantasy (Kindle Store)](https://www.amazon.com/gp/bestsellers/digital-text/169457011/ref=pd_zg_hrsr_digital-text)\n[#10 in Dark Fantasy Horror](https://www.amazon.com/gp/bestsellers/digital-text/157062011/ref=pd_zg_hrsr_digital-text)""]",Kallias’s own quest three-month-long Winter Dark king’s entertainment alluring Prince Vil mountain’s heart imposing mountain palace,Third,true,false,true
2025-08-11,Science Fiction & Fantasy,B0F9VMQX47,The Dark Lord's Guide to Dating (And Other War Crimes) (Guides to Villainy and Love Book 1),Tiffany Hunt,https://www.amazon.com/stores/author/B0BMPWYVRZ,Guides to Villainy and Love,4.99,4.40,1856,250,2025-05-24,,"Perfect for fans of Assistant to the Villain, but darker and spicier. In this riotously funny dark romantasy, a conflicted villain and his unstoppable bride form the realm's most chaotic alliance.  “What’s mine, stays mine.”  Step One: Kidnap someone cute.  Step Two: Force her into marriage.  Step Three: Try not to get feelings.  When Dark Lord Kazimir Blackrose kidnaps Lady Arabella for a forced marriage, he expects an obedient, trembling bride. What he gets is a knife to the throat and a furious woman with her own terms. He may need her heroic bloodline to achieve ultimate dominion, but she's not about to make this easy for him.  Arabella has already survived her father's tower prison and a lifetime of being treated like property. Being abducted by the realm's most notorious villain is just another Tuesday. If she must be married to the infuriating (and infuriatingly attractive) Dark Lord, she'll do it on her terms: freedom within his fortress, hands strictly to himself, and complete honesty about his plans.  But when his plans go awry, Kazimir faces his most terrifying challenge yet. He must actually date his own wife. Between magical training sessions, playing golf with the eyeballs of his enemies, and aphrodisiac dinners gone spectacularly wrong, his villainous seduction plans are failing at every turn.  As they navigate magical explosions and jealous exes, they discover a far more terrifying prospect than war or magical catastrophe:  They might actually be falling for each other.  This dark and sexy fantasy romance is perfect for readers who love:  A morally gray antihero (who stays that way) A strong heroine who embraces her dark side (she doesn't need rescuing, thanks) Touch her and die Hilarious, wicked banter and sizzling spice One bed/forced proximity Kidnapped bride/forced marriage Dark humor",https://m.media-amazon.com/images/I/51ao8GjfobL._SY445_SX342_.jpg,https://www.amazon.com/dp/B0F9VMQX47,"[""Magic"",""Comedy"",""Crime""]","[""[#1 in Humorous Fantasy (Kindle Store)](https://www.amazon.com/gp/bestsellers/digital-text/11650864011/ref=pd_zg_hrsr_digital-text)\n[#8 in Humorous Fantasy (Books)](https://www.amazon.com/gp/bestsellers/books/11764648011/ref=pd_zg_hrsr_books)\n[#11 in Sword & Sorcery Fantasy eBooks](https://www.amazon.com/gp/bestsellers/digital-text/6809432011/ref=pd_zg_hrsr_digital-text)""]","his most terrifying challenge realm's most notorious villain riotously funny dark romantasy dark and sexy fantasy romance her father's tower prison far more terrifying prospect realm's most chaotic alliance his villainous seduction plans morally gray antihero One bed/forced proximity Kidnapped bride/forced marriage Dark humor obedient, trembling bride",Third,true,false,true
2025-08-11,Science Fiction & Fantasy,B0CZ8XFQ84,When the Moon Hatched: A Novel (The Moonfall Series Book 1),Sarah A. Parker,https://www.amazon.com/stores/author/B095JHHY8C,Moonfall,12.99,4.40,46334,260,2024-04-02,Avon,"NEW YORK TIMES BESTSELLER  The #1 internationally bestselling phenomenon, When the Moon Hatched, is a fast-paced fantasy romance featuring an immersive, vibrant world with mysterious creatures, a unique magic system, and a love that blazes through the ages.  The Creators did not expect their beloved dragons to sail skyward upon their end. To curl into balls just beyond gravity’s grip, littering the sky with tombstones. With moons. They certainly did not expect them to FALL.  As an assassin for the rebellion group Fíur du Ath, Raeve’s job is to complete orders and never get caught. When a rival bounty hunter turns her world upside down, blood spills, hearts break, and Raeve finds herself imprisoned by the Guild of Nobles—a group of powerful fae who turn her into a political statement.  Crushed by the loss of his great love, Kaan Vaegor took the head of a king and donned his melted crown. Now on a tireless quest to quell the never-ebbing ache in his chest, he is lured by a clue into the capitol’s high-security prison where he stumbles upon the imprisoned Raeve …  Echoes of the past race between them.  There’s more to their story than meets the eye, but some truths are too poisonous to swallow.  ""A wild ride that thrills as much as it enchants . . . This remarkable book is an instant classic.” — Thea Guanzon, New York Times bestselling author of The Hurricane Wars  “ When The Moon Hatched breathes new, beautiful life into the genre, as Sarah A. Parker weaves lyrical prose with undeniable chemistry. I laughed, I cried, I got everything out of this. It’s an absolutely stunning fantasy world that everyone should sink their teeth into.” — Raven Kennedy, internationally bestselling author of The Plated Prisoner series",https://m.media-amazon.com/images/I/51SljhsgseL._SY445_SX342_.jpg,https://www.amazon.com/dp/B0CZ8XFQ84,"[""Fae/Elves"",""Supernatural"",""Magic"",""Dragon"",""Mystery""]","[""[#3 in Dragons & Mythical Creatures Fantasy (Books)](https://www.amazon.com/gp/bestsellers/books/16926919011/ref=pd_zg_hrsr_books)\n[#12 in Sword & Sorcery Fantasy eBooks](https://www.amazon.com/gp/bestsellers/digital-text/6809432011/ref=pd_zg_hrsr_digital-text)\n[#25 in Epic Fantasy (Books)](https://www.amazon.com/gp/bestsellers/books/16197/ref=pd_zg_hrsr_books)""]","#1 internationally bestselling phenomenon When the Moon Hatched unique magic system immersive, vibrant world never-ebbing ache capitol’s high-security prison fast-paced fantasy romance NEW YORK TIMES BESTSELLER rival bounty hunter",Third,true,false,true
