ingested_date,genre,asin,title,author,author_url,series,price,rating,review_count,rank_overall,release_date,publisher,blurb_text,cover_url,product_url,topic_tags,subcategories,blurb_keyphrases,estimated_pov,has_supernatural,has_romance,cover_ok
2025-08-11,Romance,B01M5IJM2U,The Seven Husbands of Evelyn Hugo: A Novel,Taylor Jenkins Reid,https://www.amazon.com/stores/author/B00DX8B85M,,3.99,4.60,260026,94,2017-06-13,Washington Square Press,"NEW YORK TIMES BESTSELLER ""If you ' re looking for a book to take on holiday this summer, The Seven Husbands of Evelyn Hugo has got all the glitz and glamour to make it a perfect beach read."" — Bustle From the New York Times bestselling author of Daisy Jones & the Six —an entrancing and ""wildly addictive journey of a reclusive Hollywood starlet"" (PopSugar) as she reflects on her relentless rise to the top and the risks she took, the loves she lost, and the long-held secrets the public could never imagine. Aging and reclusive Hollywood movie icon Evelyn Hugo is finally ready to tell the truth about her glamorous and scandalous life. But when she chooses unknown magazine reporter Monique Grant for the job, no one is more astounded than Monique herself. Why her? Why now? Monique is not exactly on top of the world. Her husband has left her, and her professional life is going nowhere. Regardless of why Evelyn has selected her to write her biography, Monique is determined to use this opportunity to jumpstart her career. Summoned to Evelyn's luxurious apartment, Monique listens in fascination as the actress tells her story. From making her way to Los Angeles in the 1950s to her decision to leave show business in the '80s, and, of course, the seven husbands along the way, Evelyn unspools a tale of ruthless ambition, unexpected friendship, and a great forbidden love. Monique begins to feel a very real connection to the legendary star, but as Evelyn's story near its conclusion, it becomes clear that her life intersects with Monique's own in tragic and irreversible ways. ""Heartbreaking, yet beautiful"" (Jamie Blynn, Us Weekly), The Seven Husbands of Evelyn Hugo is ""Tinseltown drama at its finest"" (Redbook): a mesmerizing journey through the splendor of old Hollywood into the harsh realities of the present day as two women struggle with what it means—and what it costs—to face the truth.",https://m.media-amazon.com/images/I/41Ohor4O+rL._SY445_SX342_.jpg,https://www.amazon.com/dp/B01M5IJM2U,"[""Friendship"",""Holiday"",""Forbidden Love""]","[""[#1 in LGBTQ+ Romance (Books)](https://www.amazon.com/gp/bestsellers/books/13922579011/ref=pd_zg_hrsr_books)\n[#4 in American Literature (Books)](https://www.amazon.com/gp/bestsellers/books/9822/ref=pd_zg_hrsr_books)\n[#6 in Women's Domestic Life Fiction](https://www.amazon.com/gp/bestsellers/books/542656/ref=pd_zg_hrsr_books)""]",Evelyn's luxurious apartment NEW YORK TIMES BESTSELLER unknown magazine reporter Monique Grant great forbidden love her glamorous and scandalous life tragic and irreversible ways reclusive Hollywood movie icon Evelyn Hugo very real connection reclusive Hollywood starlet long-held secrets wildly addictive journey New York Times,Third,false,true,true
2025-08-11,Romance,B0DZZ1ZRSD,Make Me Yours: A Friends-to-Lovers Close Proximity Hockey Romance (Chicago Railers Hockey Book 1),Jennifer Sucevic,https://www.amazon.com/stores/author/B0177EONK4,Chicago Railers Hockey,5.99,4.30,912,95,2025-08-01,,"A steamy friends-to-lovers, off-limits, close proximity pro hockey romance from USA Today and Amazon Top 26 bestselling author Jennifer Sucevic.  Steele Sanderson has always been my safe place. My best friend. My constant. My person.  So when I walk in on my boyfriend, who also happens to be my boss, screwing a colleague on his desk, it’s Steele who picks up the pieces.  Now I’m living in his penthouse, crashing in his guest room, and working as his assistant while I figure out what’s next. Every day, I tell myself this is temporary. That just because he looks at me like I already belong to him doesn’t mean I actually do.  Except… Steele doesn’t see it that way. To him, I’ve always been his. The only one he’s ever wanted. The only one he’s ever loved.  He’s protective. Possessive. And done waiting.  I keep telling myself that crossing the line could ruin everything—that risking our friendship isn’t worth it. But when he offers a friends-with-benefits arrangement, promising to give me everything I’ve secretly craved, how am I supposed to say no?  It doesn’t take long for the lines between us to blur.  Now I have to decide... keep pretending nothing’s changed or finally give in to the man who’s been mine all along.  Make Me Yours is a swoony, boy-obsessed, friends-to-lovers hockey romance with close proximity, undeniable tension, a hero who was always all in, and no third-act breakup. It’s book one in the Chicago Railers series and can be read as a standalone.",https://m.media-amazon.com/images/I/51us8PjOXNL._SY445_SX342_.jpg,https://www.amazon.com/dp/B0DZZ1ZRSD,"[""Sports"",""Friends to Lovers"",""Friendship"",""Forbidden Love"",""Steamy""]","[""[#1 in Workplace Romance eBooks](https://www.amazon.com/gp/bestsellers/digital-text/120220979011/ref=pd_zg_hrsr_digital-text)\n[#2 in New Adult & College Romance (Kindle Store)](https://www.amazon.com/gp/bestsellers/digital-text/6487838011/ref=pd_zg_hrsr_digital-text)\n[#2 in Workplace Romance](https://www.amazon.com/gp/bestsellers/books/120214347011/ref=pd_zg_hrsr_books)""]",third-act breakup Chicago Railers series bestselling author Jennifer Sucevic,First,false,true,true
2025-08-11,Romance,B0D888FZSD,Rewind It Back (Windy City Series Book 5),Liz Tomforde,https://www.amazon.com/stores/author/B09DWX54JM,Windy City Series,5.99,4.60,58900,96,2025-05-20,,"Hallie When I was eleven, my family moved next door to his. When I was thirteen, he was my first crush. When I was sixteen, we fell for each other. And when I was nineteen, we broke each other's hearts. Six years later, I've landed an internship with a big-name interior designer in a new city. Unfortunately, that city just so happens to be the one he plays hockey for. I thought Chicago was big enough to avoid him, until I get the surprise of a lifetime and unknowingly move in right next door. Even worse? The renovation project I'm assigned to in hopes of turning that internship into my full-time dream job... It's his house. But how am I supposed to update his bachelor pad into a family home when we can't even stand to be in the same room? I may have loved Rio DeLuca once, but I'm not that same girl anymore. Rio I never thought I'd be the only single one left in my friend group. But after years of trying to find love, I've concluded it may not exist for me anymore. That is until I accidentally hire Hallie Hart to renovate my house and our jaded history has me rewinding memories I've kept secret for years. You see, there's something that my friends don't know. That connection I've been looking for since I moved to Chicago, that one person some search their entire lives to find... I had already found her when I was twelve years old. And now the only girl I've ever loved is moving into the house next door. Again.",https://m.media-amazon.com/images/I/511yV8EF4PL._SY445_SX342_.jpg,https://www.amazon.com/dp/B0D888FZSD,"[""Sports""]","[""[#3 in Sports Romance (Books)](https://www.amazon.com/gp/bestsellers/books/10387327011/ref=pd_zg_hrsr_books)\n[#4 in Sports Romance (Kindle Store)](https://www.amazon.com/gp/bestsellers/digital-text/6487842011/ref=pd_zg_hrsr_digital-text)\n[#7 in Romantic Comedy (Kindle Store)](https://www.amazon.com/gp/bestsellers/digital-text/6487841011/ref=pd_zg_hrsr_digital-text)""]",other's hearts big-name interior designer my full-time dream job,First,false,false,true
2025-08-11,Romance,B0FH8MW5T2,The Alpha's Second Chance Mate,Sadie Sears,https://www.amazon.com/stores/author/B08JTNFQ1H,,8.99,4.40,1135,97,2025-07-09,Special Fiction Books,"He never knew she was carrying his child. Now she’s back—and this time, she’s his to claim. Avery never expected to return to Harbor Mills—or to face the alpha who once broke her heart. But with her son’s life on the line, she has no choice but to turn to the only man who can help. Cole didn’t know he had a son. He never stopped loving Avery—and now that fate has brought her back, nothing will keep him from protecting what’s his. The pack is dangerous. The threats are real. But this time, Cole won’t let anything—or anyone—stand between him and his mate. Perfect for fans of fated mates, second chances, protective alpha wolves, and small-town shifter heat.  This edition includes both parts of the duology—over 800 pages of steamy, emotional, fated-mates goodness.  No cliffhangers. No waiting. Just one deliciously chunky book you can devour in a single sitting (or several very late nights).",https://m.media-amazon.com/images/I/51ISx+fco9L._SY445_SX342_.jpg,https://www.amazon.com/dp/B0FH8MW5T2,"[""Fated Mates"",""Alpha Male"",""Shifter"",""Second Chance"",""Steamy""]","[""[#1 in Werewolf & Shifter Thrillers](https://www.amazon.com/gp/bestsellers/books/9536079011/ref=pd_zg_hrsr_books)\n[#1 in Werewolves & Shifters Suspense](https://www.amazon.com/gp/bestsellers/digital-text/7130642011/ref=pd_zg_hrsr_digital-text)\n[#2 in Later in Life Romance (Books)](https://www.amazon.com/gp/bestsellers/books/17745834011/ref=pd_zg_hrsr_books)""]","small-town shifter heat her son’s life several very late nights steamy, emotional, fated-mates goodness Just one deliciously chunky book",Third,true,true,true
2025-08-11,Romance,B0D98DLGGJ,Story of My Life (Story Lake Book 1),Lucy Score,https://www.amazon.com/stores/author/B00G2DKSBU,Story Lake,5.99,4.50,42905,99,2025-03-11,"That's What She Said Publishing, Inc.","A Gilmore Girls meets Schitt’s Creek redemption romcom. Hazel Hart was a successful romance novelist until a breakup drives her straight into writer’s block. Having failed (and failed some more) to deliver her new manuscript, she’s hiding from the world behind a wall of old takeout containers until her publisher lays down the law. If she misses her next deadline it’s The End. Desperate for inspiration, Hazel impulse-buys a historic home online and flees Manhattan to tiny Story Lake, PA. Upon her dramatic arrival—involving an incident with a bald eagle—she discovers the charm of her new home may have been slightly exaggerated. The house is a wreck and the town is struggling after their biggest employer shut down. Also, since her raccoon-infested home came with a seat on the town council our introverted heroine is stuck with a front row seat to all the small-town shenanigans. But Hazel isn’t worried. Not since all six-feet-three inches of grouchy contractor Campbell Bishop slapped a bandage on her forehead and unintentionally inspired the heck out of her. There’s only one thing to do: Hire Cam and his equally gorgeous brothers to renovate her new spider museum…er…house. Okay two things. A fake date for “research purposes” will really put her work-in-progress on track. Before Hazel knows it, she’s writing a romance novel and living one. At least until the drywall dust settles, the town she’s falling in love with faces bankruptcy, and growly Cam remembers why he can’t live happily ever after.",https://m.media-amazon.com/images/I/51LRxmHBBpL._SY445_SX342_.jpg,https://www.amazon.com/dp/B0D98DLGGJ,"[""Office/Workplace"",""Fake Relationship""]","[""[#7 in Romantic Comedy (Books)](https://www.amazon.com/gp/bestsellers/books/9059885011/ref=pd_zg_hrsr_books)\n[#8 in Romantic Comedy (Kindle Store)](https://www.amazon.com/gp/bestsellers/digital-text/6487841011/ref=pd_zg_hrsr_digital-text)\n[#11 in Contemporary Romance Fiction](https://www.amazon.com/gp/bestsellers/digital-text/7588748011/ref=pd_zg_hrsr_digital-text)""]",six-feet-three inches Schitt’s Creek redemption romcom front row seat his equally gorgeous brothers successful romance novelist grouchy contractor Campbell Bishop her raccoon-infested home her new spider museum the small-town shenanigans,Third,false,true,true
2025-08-11,Romance,B0FL81D5N6,"It's Kind of a Bunny Story (Hey There, Hop Stuff Book 3)",Sedona Ashe,https://www.amazon.com/stores/author/B08WJWJPD5,"Hey There, Hop Stuff",3.99,4.40,341,103,2025-08-04,"Gobble Ink, LLC","I’m a bunny shifter whose future was decided by a cruel burrow. Now I’m choosing my own path… even if it means war. In Blackberry Burrow, females like me were nothing more than property, used to breed and controlled by rules I didn’t agree to. With my first heat due any day, the rabbit shifter men had already started negotiating who would be sharing my bed, like I was nothing more than a toy for their amusement. I’d rather mop a bathroom floor with my tongue than let that happen. With the help of my best friend Fletcher, I ran—straight into the arms of two very large, very dangerous, and very growly wolf shifters. Linc and Copeland didn’t just protect me; they claimed me. Alongside Fletcher, they became my mates. My future. My family. But peace doesn’t last long when your past wants you back… dead or alive. The burrow has a plan to get their revenge, and my mates are their first targets. When I left, I promised myself I’d die before ever stepping foot on burrow land again. But now I’m going back to the place that caged me. Armed with a plan, determination, and a whole lot of rage, I’m ready to bop a few bunnies on the head if it means saving my mates. They underestimated me before. But this bunny? She bites back. It’s Kind of a Bunny Story is a standalone within the Hey There, Hop Stuff series. Expect possessive wolves, stubborn bunnies, heat cycles, and plenty of steam. There are mentions of past abuse, but all steamy scenes are fully consensual. The Hey There, Hop Stuff series will feature a different bunny shifter girl and her mates within the same community. Each girl will get her happy ending. The books can be read out of order, but the community and shifter communities will make slightly more sense if you read the books in order.",https://m.media-amazon.com/images/I/51-+lx7acxL._SY445_SX342_.jpg,https://www.amazon.com/dp/B0FL81D5N6,"[""Shifter"",""Steamy""]","[""[#5 in Paranormal Werewolves & Shifters Romance](https://www.amazon.com/gp/bestsellers/digital-text/6401742011/ref=pd_zg_hrsr_digital-text)\n[#6 in Werewolf & Shifter Romance](https://www.amazon.com/gp/bestsellers/books/13922582011/ref=pd_zg_hrsr_books)\n[#10 in Romantic Comedy (Kindle Store)](https://www.amazon.com/gp/bestsellers/digital-text/6487841011/ref=pd_zg_hrsr_digital-text)""]","two very large, very dangerous, and very growly wolf shifters Kind of a Bunny Story There, Hop Stuff series different bunny shifter girl",First,true,true,true
2025-08-11,Romance,B0CXNJDB4B,Phantasma: A dark fantasy romance (Wicked Games Book 1),Kaylie Smith,https://www.amazon.com/stores/author/B0B4BMB522,Wicked Games,3.99,4.30,50203,104,2024-09-03,Second Sky,"“WHERE DO I BEGIN? Has my heart forever!!… I absolutely devoured this… Plenty of spice… Had me on the edge of my seat the entire time, I was hanging onto every word that came out of that man’s mouth… I was sobbing!!… A complete rollercoaster!” Books.and.bunlife ⭐⭐⭐⭐⭐ Welcome to Phantasma. There are only two rules to the game. Stay alive. And don’t fall in love. When Ophelia’s sister disappears, there is only one way to save her. Ophelia must enter Phantasma, a deadly contest inside a haunted mansion, and claim its prize— a single wish. Phantasma is a maze of twisting corridors and lavish ballrooms, of demons and temptations. Ophelia will face nine challenges, each more dangerous than the last. There can only be one winner, and the other contestants will stop at nothing to eliminate their rivals. Every day the house creates new monsters. But just as Ophelia’s fears threaten to overwhelm her, a mysterious stranger offers her a bargain. Charming, arrogant and infuriatingly attractive, Blackwell claims he can guide her through the lethal trials ahead. All he asks in return is ten years of her life. Ophelia knows she shouldn’t trust him. Blackwell doesn’t seem dangerous, but appearances can be deceptive. Worse still, she feels a dark and irresistible attraction drawing them closer and closer. Her life is on the line. But in Phantasma, the only thing deadlier than losing the game is losing your heart… The #1 Kindle bestseller and TikTok sensation! A Court of Thorns and Roses meets Caraval in this seductive fantasy adventure. With steamy romance, a sexy morally gray love interest, OCD rep and jaw-dropping twists, Phantasma is perfect for fans of Rebecca Yarros, Nisha J. Tuli and Carissa Broadbent. See why readers love Phantasma: “ WOW what a ride! … Leaves you breathless … A hauntingly addictive read that will keep you on the edge of your seat from start to finish … What am I going to do with my life now? I need more Phantasma!!! ” NESSAS_BOOK_REVIEWS ⭐⭐⭐⭐⭐ “ ALL THE STARS. I LOVED THIS BOOK. I finished this in less than two days and I didn’t want it to end!… Gripping … An absolute must-read.” Goodreads reviewer ⭐⭐⭐⭐⭐ “ God, I am never going to recover from this book … I’m addicted! … I can’t even begin to put into words the rollercoaster of this book; the tension, the twists and turns that literally had me holding my breath until the VERY last page.” Goodreads reviewer ⭐⭐⭐⭐⭐ “I cannot begin to describe how much I love this… I have not stopped thinking about this story … Oh gosh I wish I could read this for the first time again!… I FELT EVERY EMOTION POSSIBLE WHILE READING THIS!!! … will forever hold a special place in my heart.” Goodreads reviewer ⭐⭐⭐⭐⭐ “ So freaking amazing! … So sold! I devoured this… I’m so in love with Blackwell… I can’t even… he has my heart… Such an epic romance, I just want to go back and read this for the first time … Loved, loved, loved… Thrilling. Sexy. Heartwrenching. I squealed, I screamed, I laughed and yes, I cried, too … In my favourite reads!” Goodreads reviewer ⭐⭐⭐⭐⭐ “ The most addictive romantasy I have read … SO good … Seductive, exciting PERFECTION… The SPICE was dangerously hot … Shouting from the rooftops for everyone to READ THIS RIGHT NOW.” Theveganbookdragon ⭐⭐⭐⭐⭐ “ My favorite book of all time! … A Necromancer in New Orleans?? Does it get cooler or more gothic than that???… The OCD REP was fantastic!!! … Blackwell, he was so freaking dreamy! … Marvelous … Beyond beautiful… I FREAKING LOVED THIS!!!!! ” Brittsbookbabblings ⭐⭐⭐⭐⭐",https://m.media-amazon.com/images/I/51tYEdS2t9L._SY445_SX342_.jpg,https://www.amazon.com/dp/B0CXNJDB4B,"[""Monsters"",""Dragon"",""Fantasy"",""Supernatural"",""Dark Fantasy"",""Steamy"",""Mystery""]","[""[#3 in New Adult & College Romance (Kindle Store)](https://www.amazon.com/gp/bestsellers/digital-text/6487838011/ref=pd_zg_hrsr_digital-text)\n[#5 in New Adult & College Romance (Books)](https://www.amazon.com/gp/bestsellers/books/8373230011/ref=pd_zg_hrsr_books)\n[#6 in Dark Fantasy Horror](https://www.amazon.com/gp/bestsellers/digital-text/157062011/ref=pd_zg_hrsr_digital-text)""]",#1 Kindle bestseller and TikTok sensation seductive fantasy adventure jaw-dropping twists dark and irresistible attraction,Third,true,true,true
2025-08-11,Romance,B000FC281W,Hissy Fit: A Novel,Mary Kay Andrews,https://www.amazon.com/stores/author/B001I9QCCM,,1.99,4.40,3049,106,2009-10-13,Harper,"""Andrews is at her best in this thoroughly satisfying story with the right blend of mystery, romance, and sharply funny writing."" — Orlando Sentinel  A delicious tale of revenge and renovation from New York Times bestselling author Mary Kay Andrews  The night before her wedding, in the middle of an oh-so-smart rehearsal dinner, interior decorator Keeley Murdock chances upon her fiancé and maid of honor in flaming flagrante delicto. Keeley throws the hissy fit to end all hissy fits, storms out and earns herself instant notoriety in her tiny hometown of Madison, GA.  The next day, though, she has to deal not only with a broken engagement but also with her business being shut out by folks in a town financially obligated to her ex. Rescue comes in the form of the new owner of the local bra plant. A hunk of a guy, Keeley can’t decide if he’s a hopeless romantic or hopelessly weird. Either way, he’s hired her to redo the broken-down antebellum mansion he’s bought for the woman of his dreams. The woman—now here’s the weird part—that he’s never met. Or maybe he just has.",https://m.media-amazon.com/images/I/41YtBasLbHL._SY445_SX342_.jpg,https://www.amazon.com/dp/B000FC281W,"[""Mystery""]","[""[#2 in Fiction Satire](https://www.amazon.com/gp/bestsellers/books/3558941011/ref=pd_zg_hrsr_books)\n[#5 in Women's Divorce Fiction](https://www.amazon.com/gp/bestsellers/books/542660/ref=pd_zg_hrsr_books)\n[#7 in Contemporary Women's Fiction](https://www.amazon.com/gp/bestsellers/digital-text/6190493011/ref=pd_zg_hrsr_digital-text)""]",local bra plant interior decorator Keeley Murdock broken-down antebellum mansion oh-so-smart rehearsal dinner,Third,false,false,true
2025-08-11,Romance,B07K6G7QBR,The Friend Zone,Abby Jimenez,https://www.amazon.com/stores/author/B07KX5X24Y,The Friend Zone,10.99,4.30,60404,107,2019-06-11,Forever,"A slow burn, hilarious and heartwarming romantic comedy that Tessa Bailey calls ""a romance for the ages!"" from the New York Times bestselling author of Yours Truly. Kristen Peterson doesn't do drama, will fight to the death for her friends, and has no room in her life for guys who just don't get her. She's also keeping a big secret: facing a medically necessary procedure that will make it impossible for her to have children. Planning her best friend's wedding is bittersweet for Kristen -- especially when she meets the best man, Josh Copeland. He's funny, sexy, never offended by her mile-wide streak of sarcasm, and always one chicken enchilada ahead of her hangry. Even her dog, Stuntman Mike, adores him. The only catch: Josh wants a big family someday. Kristen knows he'd be better off with someone else, but as their attraction grows, it's harder and harder to keep him at arm's length. The Friend Zone will have you laughing one moment and grabbing for tissues the next as it tackles the realities of infertility and loss with wit, heart, and a lot of sass. ""Your next favorite romantic comedy... The Friend Zone is that rare beach read with tons of heart that will make you laugh and cry in equal parts."" ---PopSugar ""Your next rom-com to obsess and cry over."" -- - Cosmopolitan  Goodreads Choice Awards nominee - Best Romance, Best Debut O, The Oprah Magazine Best Romance Novels of the year Audie Award Finalist USA Today bestseller Bookish Best Books of the year SheReads Best Romances of the year Women's Health Best Romance Novels of the year Good Housekeeping Best New Books for Summer PopSugar Best Books of Summer Publishers Weekly Starred Review Booklist Starred Review Booklist Top 10 Romance Debuts",https://m.media-amazon.com/images/I/41bHrAq6s7L._SY445_SX342_.jpg,https://www.amazon.com/dp/B07K6G7QBR,"[""Pregnancy"",""Slow Burn"",""Comedy"",""Animals""]","[""[#1 in Firefighters Romance](https://www.amazon.com/gp/bestsellers/books/120214353011/ref=pd_zg_hrsr_books)\n[#4 in Military Romance (Books)](https://www.amazon.com/gp/bestsellers/books/8373231011/ref=pd_zg_hrsr_books)\n[#11 in Romantic Comedy (Kindle Store)](https://www.amazon.com/gp/bestsellers/digital-text/6487841011/ref=pd_zg_hrsr_digital-text)""]",Audie Award Finalist USA Today bestseller Bookish Best Books Summer PopSugar Best Books Good Housekeeping Best New Books her mile-wide streak medically necessary procedure Oprah Magazine Best Romance Novels Summer Publishers Weekly Starred Review Booklist Starred Review Booklist Top 10 Romance Debuts Best Debut O New York Times Women's Health Best Romance Novels her best friend's wedding hilarious and heartwarming romantic comedy,Third,false,true,true
