ingested_date,genre,asin,title,author,author_url,series,price,rating,review_count,rank_overall,release_date,publisher,blurb_text,cover_url,product_url,topic_tags,subcategories,blurb_keyphrases,estimated_pov,has_supernatural,has_romance,cover_ok
2025-08-11,Teen & Young Adult,B08NWT51T7,The Gilded Cage (The Prison Healer Book 2),Lynette Noni,https://www.amazon.com/stores/author/B00OPO5JOY,The Prison Healer,13.99,4.40,8687,2592,2021-10-12,Clarion Books,"Kiva trades one cage for another when she leaves behind a deadly prison for a deceptive palace in this dark and dangerous sequel to The Prison Healer, which Sarah J. Maas called ""a must-read.""  Kiva Meridan is a survivor.  She survived not only Zalindov prison, but also the deadly Trial by Ordeal. Now Kiva’s purpose goes beyond survival to vengeance. For the past ten years, her only goal was to reunite with her family and destroy the people responsible for ruining their lives. But now that she has escaped Zalindov, her mission has become more complicated than ever.  As Kiva settles into her new life in the capital, she discovers she wasn’t the only one who suffered while she was in Zalindov—her siblings and their beliefs have changed too. Soon it’s not just her enemies she’s keeping secrets from, but her own family as well.  Outside the city walls, tensions are brewing from the rebels, along with whispers of a growing threat from the northern kingdoms. Kiva’s allegiances are more important than ever, but she’s beginning to question where they truly lie. To survive this time, she’ll have to navigate a complicated web of lies before both sides of the battle turn against her and she loses everything.",https://m.media-amazon.com/images/I/51kPCtDBJ+L._SY445_SX342_.jpg,https://www.amazon.com/dp/B08NWT51T7,,"[""[#3 in Teen & Young Adult Coming of Age Fantasy eBooks](https://www.amazon.com/gp/bestsellers/digital-text/7006652011/ref=pd_zg_hrsr_digital-text)\n[#3 in Teen & Young Adult Historical Romance](https://www.amazon.com/gp/bestsellers/books/10368620011/ref=pd_zg_hrsr_books)\n[#6 in Teen & Young Adult Epic Fantasy eBooks](https://www.amazon.com/gp/bestsellers/digital-text/15249163011/ref=pd_zg_hrsr_digital-text)""]",not only Zalindov prison past ten years dark and dangerous sequel,Third,false,false,true
2025-08-11,Teen & Young Adult,B0D8BPSYR7,My Return to the Walter Boys,Ali Novak,https://www.amazon.com/stores/author/B00HCZR58G,My Life with the Walter Boys,7.39,4.20,1427,2741,2025-04-15,Sourcebooks Fire,"New York Times Bestseller!  USA Today Bestseller!  The highly anticipated sequel to My Life with the Walter Boys, the internationally bestselling novel that inspired the Netflix series!  Jackie Howard returns to the Walter ranch after a summer in New York. She needed space—and got it. But she doesn't know where things stand with her and Cole Walter after that goodbye kiss. Over the summer, she stopped texting him. She never stopped thinking about him.  Still, with Cole living off in town to work at Tony's garage before he heads off to college, Jackie thinks it'll be easy to avoid him—only to find that when she sees him face to face at last, it's, well... impossible to resist him. Things are getting complicated: he's the boy she can't get off her mind, and the Walters have become the family she loves and needs. How can Jackie move forward when she's afraid of taking the next step?",https://m.media-amazon.com/images/I/41PI19HRYnL._SY445_SX342_.jpg,https://www.amazon.com/dp/B0D8BPSYR7,"[""College""]","[""[#1 in Teen & Young Adult Fiction about Alternative Families](https://www.amazon.com/gp/bestsellers/digital-text/15249100011/ref=pd_zg_hrsr_digital-text)\n[#1 in Teen & Young Adult Alternative Family Fiction](https://www.amazon.com/gp/bestsellers/books/10368557011/ref=pd_zg_hrsr_books)\n[#13 in Teen & Young Adult Contemporary Romance](https://www.amazon.com/gp/bestsellers/books/10368617011/ref=pd_zg_hrsr_books)""]",highly anticipated sequel New York Times Bestseller internationally bestselling novel,Third,false,false,true
2025-08-11,Teen & Young Adult,B07MBY35R9,The Grace Year: A Novel,Kim Liggett,https://www.amazon.com/stores/author/B00UO9952Q,,9.99,4.40,27308,2683,2019-10-08,Wednesday Books,"The Instant New York Times Bestseller! Kim Liggett's The Grace Year is a speculative thriller in the vein of The Handmaid’s Tale and The Power. Survive the year. No one speaks of the grace year. It’s forbidden. In Garner County, girls are told they have the power to lure grown men from their beds, to drive women mad with jealousy. They believe their very skin emits a powerful aphrodisiac, the potent essence of youth, of a girl on the edge of womanhood. That’s why they’re banished for their sixteenth year, to release their magic into the wild so they can return purified and ready for marriage. But not all of them will make it home alive. Sixteen-year-old Tierney James dreams of a better life—a society that doesn’t pit friend against friend or woman against woman, but as her own grace year draws near, she quickly realizes that it’s not just the brutal elements they must fear. It’s not even the poachers in the woods, men who are waiting for a chance to grab one of the girls in order to make a fortune on the black market. Their greatest threat may very well be each other. With sharp prose and gritty realism, The Grace Year examines the complex and sometimes twisted relationships between girls, the women they eventually become, and the difficult decisions they make in-between. “A visceral, darkly haunting fever dream of a novel and an absolute page-turner.” – Libba Bray, New York Times bestselling author",https://m.media-amazon.com/images/I/41AdHdQZ1dL._SY445_SX342_.jpg,https://www.amazon.com/dp/B07MBY35R9,"[""Thriller"",""Magic""]","[""[#5 in Teen & Young Adult Fiction on Girls' & Women's Issues (Kindle Store)](https://www.amazon.com/gp/bestsellers/digital-text/15249110011/ref=pd_zg_hrsr_digital-text)\n[#6 in Teen & Young Adult Dystopian eBooks](https://www.amazon.com/gp/bestsellers/digital-text/7006666011/ref=pd_zg_hrsr_digital-text)\n[#7 in Teen & Young Adult Thrillers & Suspense (Kindle Store)](https://www.amazon.com/gp/bestsellers/digital-text/11650875011/ref=pd_zg_hrsr_digital-text)""]",just the brutal elements her own grace year Handmaid’s Tale Instant New York Times Bestseller Kim Liggett's The Grace Year complex and sometimes twisted relationships,Third,true,false,true
2025-08-11,Teen & Young Adult,B09ZYDK71G,These Infinite Threads (This Woven Kingdom Book 2),Tahereh Mafi,https://www.amazon.com/stores/author/B005DISZ0Q,This Woven Kingdom,13.99,4.40,3120,2830,2023-02-07,Storytide,"Instant #1 New York Times bestseller! A stunning romantasy full of explosive magic, searing romance, and heartbreaking betrayal, this breathtaking sequel to This Woven Kingdom is from the award-winning and bestselling author of the Shatter Me series and is perfect for fans of Sarah J. Maas, Leigh Bardugo, and Sabaa Tahir.  With the heat of a kiss, the walls between Alizeh, the long-lost heir to an ancient Jinn kingdom, and Kamran, the crown prince of the Ardunian empire, have crumbled. And so have both of their lives.  Alizeh, the heir to the Jinn throne, is destined to free her people from the half-lives they’ve been forced to live under human rule. When Kamran, the heir to the human throne, falls in love with her, he’s forced to question everything he’s been taught about Jinn.  Kamran’s grandfather lays dead at the hand of Cyrus, ruler of the neighboring kingdom of Tulan. Cyrus has stolen Alizeh away to his homeland and plans to marry her there, giving her everything she needs to become the Jinn queen—and when she assumes the throne he will have fulfilled his own bargain with the devil.  Alizeh wants nothing to do with Cyrus’s deal or the devil. But without a way to escape Tulan, and with the fulfillment of her own destiny tantalizingly close, she’ll have to decide whether she can set aside her emotions to become the queen her people need.  Kamran, meanwhile, is picking up the pieces in Ardunia. Facing betrayal at every turn, all he knows is that he must go to Tulan to avenge his grandfather. He can only hope that Alizeh will be waiting for him there—and that she hasn’t yet become the queen of Tulan.",https://m.media-amazon.com/images/I/41Ays1hawLL._SY445_SX342_.jpg,https://www.amazon.com/dp/B09ZYDK71G,"[""Aristocracy"",""Magic""]","[""[#2 in Teen & Young Adult Royalty Fairy Tales & Folklore eBooks](https://www.amazon.com/gp/bestsellers/digital-text/15249168011/ref=pd_zg_hrsr_digital-text)\n[#2 in Teen & Young Adult Historical Romance](https://www.amazon.com/gp/bestsellers/books/10368620011/ref=pd_zg_hrsr_books)\n[#3 in Teen & Young Adult Historical Fantasy eBooks](https://www.amazon.com/gp/bestsellers/digital-text/15249169011/ref=pd_zg_hrsr_digital-text)""]",long-lost heir half-lives award-winning and bestselling author Shatter Me series Instant #1 New York Times bestseller ancient Jinn kingdom,Third,true,false,true
2025-08-11,Teen & Young Adult,B00Z7C1I6Q,Love & Gelato,Jenna Evans Welch,https://www.amazon.com/stores/author/B01E66CSEE,The Love & Gelato,1.99,4.50,6975,3023,2016-05-03,Simon & Schuster Books for Young Readers,"Now a movie streaming on Netflix! A summer in Italy turns into a road trip across Tuscany in this sweeping New York Times bestseller filled with romance, mystery, and adventure that Kirkus Reviews called “a sure bet for fans of romance fiction.” Lina is spending the summer in Tuscany, but she isn’t in the mood for Italy’s famous sunshine and fairy-tale landscape. She’s only there because it was her mother’s dying wish that she get to know her father. But what kind of father isn’t around for sixteen years? All Lina wants to do is get back home. But then Lina is given a journal that her mom had kept when she lived in Italy. Suddenly Lina’s uncovering a magical world of secret romances, art, and hidden bakeries. A world that inspires Lina, along with the ever-so-charming Ren, to follow in her mother’s footsteps and unearth a secret that has been kept for far too long. It’s a secret that will change everything Lina knew about her mother, her father—and even herself. People come to Italy for love and gelato, someone tells her, but sometimes they discover much more.",https://m.media-amazon.com/images/I/51+2DzqQMdL._SY445_SX342_.jpg,https://www.amazon.com/dp/B00Z7C1I6Q,"[""Magic"",""Mystery""]","[""[#1 in Teen & Young Adult Clean & Wholesome Romance eBooks](https://www.amazon.com/gp/bestsellers/digital-text/15249159011/ref=pd_zg_hrsr_digital-text)\n[#1 in Teen & Young Adult European Geography & Cultures Fiction eBooks](https://www.amazon.com/gp/bestsellers/digital-text/15249022011/ref=pd_zg_hrsr_digital-text)\n[#1 in Teen & Young Adult Travel Fiction eBooks](https://www.amazon.com/gp/bestsellers/digital-text/15249000011/ref=pd_zg_hrsr_digital-text)""]",a sure bet fairy-tale landscape ever-so-charming Ren Italy’s famous sunshine her mother’s dying her mother’s footsteps sweeping New York Times bestseller,Third,true,false,true
2025-08-11,Teen & Young Adult,B0FBVHKPNG,Hunt for the White Dragon (Dragons of Fire and Ice Book 1),Jada Fisher,https://www.amazon.com/stores/author/B07HFRWS4S,Dragons of Fire and Ice,0.99,4.50,403,3243,2025-06-17,Fairfield Publishing,"An exiled warrior. A rare white dragon. A bond that could alter the course of history. The first book in an epic dragon rider series from Amazon All-Star and international bestselling author Jada Fisher and K. L. Reinhart. Valda Hemmsdottir was born a warrior. She was raised in a brutal land and is now feared across the kingdoms as a ruthless and highly effective bounty hunter. But when a mission goes wrong, she’s captured by an old enemy and dragged back to the icy homeland she fled years ago. When given an ultimatum to hunt the white dragon or watch her clan be destroyed, she has no choice but to agree. It's what she does after all. In the process, she discovers a magic thought lost in time and forges a bond that could change her destiny and the fate of the world. Hunt for the White Dragon is the first book in the Dragons of Fire and Ice series, a fantasy adventure full of intrigue, betrayal, magic, and... dragons. If you enjoy magical worlds and unforgettable characters, you don't want to miss this epic adventure from Jada Fisher and K. L. Reinhart. Download Hunt for the White Dragon and get lost in a world of magic and adventure. Always free on Kindle Unlimited!",https://m.media-amazon.com/images/I/51v9dqzxlVL._SY445_SX342_.jpg,https://www.amazon.com/dp/B0FBVHKPNG,"[""Fantasy"",""Dragon"",""Military"",""Magic"",""Supernatural""]","[""[#1 in Teen & Young Adult Sword & Sorcery Fantasy eBooks](https://www.amazon.com/gp/bestsellers/digital-text/7006663011/ref=pd_zg_hrsr_digital-text)\n[#1 in Teen & Young Adult Mythical Creatures eBooks](https://www.amazon.com/gp/bestsellers/digital-text/15249171011/ref=pd_zg_hrsr_digital-text)\n[#1 in Teen & Young Adult Nature & the Natural World Fiction eBooks](https://www.amazon.com/gp/bestsellers/digital-text/15249044011/ref=pd_zg_hrsr_digital-text)""]","ruthless and highly effective bounty hunter Fire and Ice series intrigue, betrayal, magic, and... dragons rare white dragon Amazon All-Star epic dragon rider series international bestselling author Jada Fisher",Third,true,false,true
2025-08-11,Teen & Young Adult,B07VJ9DJFL,Crave,Tracy Wolff,https://www.amazon.com/stores/author/B001JSE918,Crave,9.99,4.40,29128,2919,2020-04-07,Entangled: Teen,"The instant #1 New York Times Bestselling Series Glitter Magazine’s #1 Pick for Best YA of 2020 Optioned for Film by Universal My whole world changed when I stepped inside the academy. Nothing is right about this place or the other students in it. Here I am, a mere mortal among gods…or monsters. I still can’t decide which of these warring factions I belong to, if I belong at all. I only know the one thing that unites them is their hatred of me. Then there’s Jaxon Vega. A vampire with deadly secrets who hasn’t felt anything for a hundred years. But there’s something about him that calls to me, something broken in him that somehow fits with what’s broken in me. Which could spell death for us all. Because Jaxon walled himself off for a reason. And now someone wants to wake a sleeping monster, and I’m wondering if I was brought here intentionally—as the bait. ***INCLUDES 3 BONUS SCENES FROM THE HERO’S POV*** Don’t miss a single book in the series that spawned a phenomenon! The Crave series is best enjoyed in order: Crave Crush Covet Court Charm Cherish",https://m.media-amazon.com/images/I/31lY-CNf6dL._SY445_SX342_.jpg,https://www.amazon.com/dp/B07VJ9DJFL,"[""School/Academy"",""Vampire"",""Monsters"",""Supernatural""]","[""[#1 in Teen & Young Adult Loners & Outcasts Fiction eBooks](https://www.amazon.com/gp/bestsellers/digital-text/15249043011/ref=pd_zg_hrsr_digital-text)\n[#4 in Teen & Young Adult Coming of Age Fiction](https://www.amazon.com/gp/bestsellers/books/13922486011/ref=pd_zg_hrsr_books)\n[#5 in Teen & Young Adult Vampire eBooks](https://www.amazon.com/gp/bestsellers/digital-text/15249173011/ref=pd_zg_hrsr_digital-text)""]",Series Glitter Magazine HERO’S POV,First,true,false,true
2025-08-11,Teen & Young Adult,B0DC534G8Q,Verity Vox and the Curse of Foxfire,Don Martin,https://www.amazon.com/stores/author/B084F2YDTG,,9.99,4.90,34,2998,2025-08-05,Page Street YA,"Witch apprentice Verity Vox has never encountered a problem magic can’t solve. So when a cryptic note invites her to Foxfire, she goes. With her apprenticeship limiting her services to a year, Foxfire will be her biggest challenge yet. The town has already lost its only bridge, and many loved ones have disappeared in dealings with a shady magic peddler named Earl—leaving the whole town wary of magic. Even as Verity wins the townsfolk over, she realizes she may not be able to save them. Going after Earl only returns Tacita, the missing girl who summoned Verity, but no one else. And the fight costs Verity the ability to fly and draws her to the old dark magic beneath the mountain. As Verity hones her powers and grows to care for Tacita, she must learn that not everything can be solved with strength alone.",https://m.media-amazon.com/images/I/51yEzV7odOL._SY445_SX342_.jpg,https://www.amazon.com/dp/B0DC534G8Q,"[""Witch"",""Magic"",""Supernatural""]","[""[#3 in Teen & Young Adult Wizards & Witches Fantasy](https://www.amazon.com/gp/bestsellers/books/13922500011/ref=pd_zg_hrsr_books)\n[#4 in Teen & Young Adult Historical Fantasy eBooks](https://www.amazon.com/gp/bestsellers/digital-text/15249169011/ref=pd_zg_hrsr_digital-text)\n[#10 in Teen & Young Adult Wizards & Witches Fantasy eBooks](https://www.amazon.com/gp/bestsellers/digital-text/15249176011/ref=pd_zg_hrsr_digital-text)""]",old dark magic Witch apprentice Verity Vox shady magic peddler,Third,true,false,true
2025-08-11,Teen & Young Adult,B07T3XJH4Z,A Good Girl's Guide to Murder,Holly Jackson,https://www.amazon.com/stores/author/B07QKBC6JZ,A Good Girl's Guide To Murder,9.99,4.40,59242,3580,2020-02-04,Delacorte Press,"THE MUST-READ MULTIMILLION BESTSELLING MYSTERY SERIES — NOW ON NETFLIX! This is the story about an investigation turned obsession, full of twists and turns and with an ending you'll never expect. Everyone in Fairview knows the story. Pretty and popular high school senior Andie Bell was murdered by her boyfriend, Sal Singh, who then killed himself. It was all anyone could talk about. And five years later, Pip sees how the tragedy still haunts her town. But she can't shake the feeling that there was more to what happened that day. She knew Sal when she was a child, and he was always so kind to her. How could he possibly have been a killer? Now a senior herself, Pip decides to reexamine the closed case for her final project, at first just to cast doubt on the original investigation. But soon she discovers a trail of dark secrets that might actually prove Sal innocent . . . and the line between past and present begins to blur. Someone in Fairview doesn't want Pip digging around for answers, and now her own life might be in danger. And don't miss the sequel, Good Girl, Bad Blood! ""The perfect nail-biting mystery."" —Natasha Preston, #1 New York Times bestselling author",https://m.media-amazon.com/images/I/51PwlEPOwHL._SY445_SX342_.jpg,https://www.amazon.com/dp/B07T3XJH4Z,"[""Crime"",""School/Academy"",""Mystery""]","[""[#2 in Teen & Young Adult Law & Crime Fiction eBooks](https://www.amazon.com/gp/bestsellers/digital-text/15249145011/ref=pd_zg_hrsr_digital-text)\n[#2 in Teen & Young Adult Fiction on Prejudice](https://www.amazon.com/gp/bestsellers/digital-text/15249116011/ref=pd_zg_hrsr_digital-text)\n[#2 in Teen & Young Adult Law & Crime Stories](https://www.amazon.com/gp/bestsellers/books/10434552011/ref=pd_zg_hrsr_books)""]",Pretty and popular high school MUST-READ MULTIMILLION,Third,false,false,true
2025-08-11,Teen & Young Adult,B0015DYIH2,Breaking Dawn (The Twilight Saga Book 4),Stephenie Meyer,https://www.amazon.com/stores/author/B001H6GO92,The Twilight Saga,10.99,4.70,28539,3231,2008-08-02,"Little, Brown Books for Young Readers","In the explosive fourth book in the epic romantic saga, Bella has one final choice to make. Should she stay mortal and strengthen her connection to the werewolves—or leave it all behind to become a vampire? When you loved the one who was killing you, it left you no options. How could you run, how could you fight, when doing so would hurt that beloved one? If your life was all you had to give, how could you not give it? If it was someone you truly loved? To be irrevocably in love with a vampire is both fantasy and nightmare woven into a dangerously heightened reality for Bella Swan. Pulled in one direction by her intense passion for Edward Cullen, and in another by her profound connection to werewolf Jacob Black, a tumultuous year of temptation, loss, and strife have led her to the ultimate turning point. Her imminent choice to either join the dark but seductive world of immortals or to pursue a fully human life has become the thread from which the fates of two tribes hangs. This astonishing, breathlessly anticipated fourth book of The Twilight Saga illuminates the secrets and mysteries of this heart electrifying romantic epic. “You too might fall in love with its suspense and moving sensitivity"" (The Daily News Tribune) Praise for The Twilight Saga “This tale of tortured demon lovers entices”— Kirkus Reviews ""In the tradition of Anne Rice. . . this dark romance is gripping."" — Booklist (starred review) ""The novel's danger-factor skyrockets as the excitement of secret love and hushed affection morphs into a terrifying race to stay alive."" — School Library Journal (starred review) “Relish this new adventure and hunger for more”— Booklist A New York Times bestseller A New York Times ""Editor's Choice"" A Publishers Weekly Best Book of the Year An Amazon best of #Booktok Book",https://m.media-amazon.com/images/I/41I6YnFdiwL._SY445_SX342_.jpg,https://www.amazon.com/dp/B0015DYIH2,"[""Fantasy"",""School/Academy"",""Dark Romance"",""Suspense"",""Mystery"",""Shifter"",""Vampire"",""Demon"",""Supernatural""]","[""[#4 in Teen & Young Adult Werewolf & Shifter eBooks](https://www.amazon.com/gp/bestsellers/digital-text/15249174011/ref=pd_zg_hrsr_digital-text)\n[#6 in Teen & Young Adult Paranormal & Urban Fantasy Romance eBooks](https://www.amazon.com/gp/bestsellers/digital-text/7006650011/ref=pd_zg_hrsr_digital-text)\n[#7 in Teen & Young Adult Vampire eBooks](https://www.amazon.com/gp/bestsellers/digital-text/15249173011/ref=pd_zg_hrsr_digital-text)""]","ultimate turning point dark but seductive world epic romantic saga fully human life dangerously heightened reality Year An Amazon astonishing, breathlessly anticipated fourth book Twilight Saga A New York Times bestseller A New York Times ""Editor's Choice"" A Publishers Weekly Best Book heart electrifying romantic epic explosive fourth book",Third,true,true,true
2025-08-11,Teen & Young Adult,B0FCD4PVJJ,Le Scapegoat,Daniel Amory,https://www.amazon.com/stores/author/B004GFI3CW,,0.99,,,3002,2025-06-07,Patron Press,"""Brilliant!"" ""An instant classic."" ""Thought-provoking."" Set in provincial France, ""Le Scapegoat"" tells the magnificent and entertaining drama-comedy of Jean des Michels, and his family, as they struggle to survive during a long drought in the years leading up to the French Revolution. Forced to give up his dream of traveling throughout Europe and seeing the world, Jean takes over the family farm. As the years go by, Jean's dairy goat, Marion, provides milk and cheese to the small French village of Minna-Saint Chabot. However, Jean finds out that long hardships mounting from the drought have turned the villagers against Marion. With everyone blaming Marion for their life struggles in an increasingly charged atmosphere, Jean attempts to stand up for what is right and defend her from injustice. The story explores themes of perseverance, family, friendship, courage, self-sacrifice and dignity. ""Timeless."" ""Feel-good."" ""Uplifting."" ""Spectacular."" ""Bravo.""",https://m.media-amazon.com/images/I/31GNkUgpQ5L._SY445_SX342_.jpg,https://www.amazon.com/dp/B0FCD4PVJJ,"[""Friendship"",""Comedy"",""Animals""]","[""[#25 in Contemporary Literary Fiction](https://www.amazon.com/gp/bestsellers/digital-text/7588747011/ref=pd_zg_hrsr_digital-text)\n[#26 in Romance Literary Fiction](https://www.amazon.com/gp/bestsellers/digital-text/7588853011/ref=pd_zg_hrsr_digital-text)\n[#73 in Teen & Young Adult eBooks](https://www.amazon.com/gp/bestsellers/digital-text/3511261011/ref=pd_zg_hrsr_digital-text)""]",,Third,false,false,true
