ingested_date,genre,asin,title,author,author_url,series,price,rating,review_count,rank_overall,release_date,publisher,blurb_text,cover_url,product_url,topic_tags,subcategories,blurb_keyphrases,estimated_pov,has_supernatural,has_romance,cover_ok
2025-08-11,Fantasy,B01M8NHXGH,Tower of Dawn (Throne of Glass Book 6),Sarah J. Maas,https://www.amazon.com/stores/author/B0070291GK,Throne Of Glass Series,8.21,4.60,92034,257,2017-09-05,Bloomsbury Publishing,"A glorious empire. A desperate quest. An ancient secret. The search for allies extends to a new land in the sixth book of the #1 bestselling Throne of Glass series by Sarah J. Maas. Chaol Westfall and Nesryn Faliq have arrived in the shining city of Antica to forge an alliance with the Khagan of the Southern Continent, whose vast armies are Erilea's last hope. But they have also come to Antica for another purpose: to seek healing at the famed Torre Cesme for the wounds Chaol received in Rifthold. After enduring unspeakable horrors as a child at the hands of Adarlanian soldiers, Yrene Towers has no desire to help the young lord from Adarlan, let alone heal him. Yet she has sworn an oath to assist those in need, and she will honor it. But Lord Westfall carries his own dark past, and Yrene soon realizes that those shadows could engulf them both. Chaol, Nesryn, and Yrene will have to draw on every scrap of their resilience to overcome the danger that surrounds them. But while they become entangled in the political webs of the khaganate, long-awaited answers slumber deep in the mountains, where warriors soar on legendary ruks. Answers that might offer their world a chance at survival . . . or doom them all. The final battle looms in this sixth book in the #1 New York Times bestselling Throne of Glass series.",https://m.media-amazon.com/images/I/51qv3sw7EHL._SY445_SX342_.jpg,https://www.amazon.com/dp/B01M8NHXGH,"[""Military"",""Aristocracy""]","[""[#19 in Epic Fantasy (Kindle Store)](https://www.amazon.com/gp/bestsellers/digital-text/158580011/ref=pd_zg_hrsr_digital-text)\n[#24 in New Adult & College Romance (Books)](https://www.amazon.com/gp/bestsellers/books/8373230011/ref=pd_zg_hrsr_books)\n[#35 in Romantasy eBooks](https://www.amazon.com/gp/bestsellers/digital-text/158569011/ref=pd_zg_hrsr_digital-text)""]","Erilea's last hope #1 New York Times his own dark past famed Torre Cesme khaganate, long-awaited answers slumber",Third,false,false,true
2025-08-11,Fantasy,B0CXQDZZCT,The Songbird and the Heart of Stone (Crowns of Nyaxia Book 3),Carissa Broadbent,https://www.amazon.com/stores/author/B01N1NMBV6,Crowns of Nyaxia,6.99,4.30,28987,242,2024-11-19,Independently Published,"New York Times bestselling author and BookTok sensation Carissa Broadbent returns with a brand new novel in the Crowns of Nyaxia series, Songbird and the Heart of Stone, where A Court of Thorns and Roses meets Dante’s Inferno, in an epic fantasy romance of love and treachery between mortals and gods.  Mische lost everything when she was forcibly Turned into a vampire–her home, her humanity, and most devastating of all, the love of the sun god to whom she had devoted her life. Now, sentenced to death for murdering the vampire prince who Turned her, redemption feels impossible.  But when Mische is saved by Asar, the bastard prince of the House of Shadow with a past as brutal as his scars, she’s forced into a mission worse than execution: a journey to the underworld to resurrect the god of death himself.  Yet, Mische’s punishment may be the key to her salvation. In a secret meeting, her sun god commands her to help Asar in his mission, only to betray him… by killing the god of death.  Mische and Asar must travel the treacherous path to the underworld, facing trials, beasts, and the vengeful ghosts of their pasts. But most dangerous of all is the alluring call of the darkness–and her forbidden attraction to Asar, a burgeoning bond that risks invoking the wrath of gods.  As her betrayal looms, the underworld closes in and angry gods grow restless. Mische will be forced to choose between the redemption of the sun or the damnation of the darkness.",https://m.media-amazon.com/images/I/51xRwOC-MrL._SY445_SX342_.jpg,https://www.amazon.com/dp/B0CXQDZZCT,"[""Ghosts"",""Crime"",""Epic Fantasy"",""Vampire"",""Supernatural""]","[""[#10 in Sword & Sorcery Fantasy eBooks](https://www.amazon.com/gp/bestsellers/digital-text/6809432011/ref=pd_zg_hrsr_digital-text)\n[#11 in Sword & Sorcery Fantasy (Books)](https://www.amazon.com/gp/bestsellers/books/16205/ref=pd_zg_hrsr_books)\n[#15 in Romantic Fantasy (Books)](https://www.amazon.com/gp/bestsellers/books/13922577011/ref=pd_zg_hrsr_books)""]",epic fantasy romance BookTok sensation Carissa Broadbent brand new novel,Third,true,false,true
2025-08-11,Fantasy,B0DPJ9FRYL,While the Dark Remains (The Winter Dark Book 1),Joanna Ruth Meyer,https://www.amazon.com/stores/author/B074HSX5NZ,The Winter Dark,4.99,4.30,1289,249,2025-08-01,47North,"In an icebound palace of magic and menace, a young woman plots to outwit a cruel king in a bracing fantasy about love, found family, and immeasurable revenge.  Brynja spent her childhood as a captive performer in Tenebris, the imposing mountain palace of King Kallias. Every night she risked death for the king’s entertainment until his rebellious son, Prince Ballast, helped her escape. Now twenty, Brynja has never forgotten the brutal king. Or forgiven him. Under the cloak of a three-month-long Winter Dark, Brynja is returning to Tenebris for revenge.  Accompanied by a rival court, including the alluring Prince Vil, Brynja poses as diplomatic royalty to barter peace between nations. No one is better equipped to infiltrate the palace than Brynja—she remembers every hidden passage like a bad dream. But her quest to destroy Kallias is complicated by her feelings for Prince Ballast, whom she isn’t sure she can still trust. And Kallias’s own quest to mine a catastrophic weapon of war buried in the mountain’s heart will threaten them all, and force Brynja to face the darkest parts of herself.  The lives of everyone she loves depend on the choices she must make. So, too, does the fate of the world.",https://m.media-amazon.com/images/I/51n8F2WM1VL._SY445_SX342_.jpg,https://www.amazon.com/dp/B0DPJ9FRYL,"[""Aristocracy"",""Magic""]","[""[#1 in Fairy Tales (Books)](https://www.amazon.com/gp/bestsellers/books/297517/ref=pd_zg_hrsr_books)\n[#3 in Fairy Tale Fantasy (Kindle Store)](https://www.amazon.com/gp/bestsellers/digital-text/169457011/ref=pd_zg_hrsr_digital-text)\n[#10 in Dark Fantasy Horror](https://www.amazon.com/gp/bestsellers/digital-text/157062011/ref=pd_zg_hrsr_digital-text)""]",king’s entertainment three-month-long Winter Dark imposing mountain palace Kallias’s own quest mountain’s heart alluring Prince Vil,Third,true,false,true
2025-08-11,Fantasy,B0F9VMQX47,The Dark Lord's Guide to Dating (And Other War Crimes) (Guides to Villainy and Love Book 1),Tiffany Hunt,https://www.amazon.com/stores/author/B0BMPWYVRZ,Guides to Villainy and Love,4.99,4.40,1856,250,2025-05-24,,"Perfect for fans of Assistant to the Villain, but darker and spicier. In this riotously funny dark romantasy, a conflicted villain and his unstoppable bride form the realm's most chaotic alliance.  “What’s mine, stays mine.”  Step One: Kidnap someone cute.  Step Two: Force her into marriage.  Step Three: Try not to get feelings.  When Dark Lord Kazimir Blackrose kidnaps Lady Arabella for a forced marriage, he expects an obedient, trembling bride. What he gets is a knife to the throat and a furious woman with her own terms. He may need her heroic bloodline to achieve ultimate dominion, but she's not about to make this easy for him.  Arabella has already survived her father's tower prison and a lifetime of being treated like property. Being abducted by the realm's most notorious villain is just another Tuesday. If she must be married to the infuriating (and infuriatingly attractive) Dark Lord, she'll do it on her terms: freedom within his fortress, hands strictly to himself, and complete honesty about his plans.  But when his plans go awry, Kazimir faces his most terrifying challenge yet. He must actually date his own wife. Between magical training sessions, playing golf with the eyeballs of his enemies, and aphrodisiac dinners gone spectacularly wrong, his villainous seduction plans are failing at every turn.  As they navigate magical explosions and jealous exes, they discover a far more terrifying prospect than war or magical catastrophe:  They might actually be falling for each other.  This dark and sexy fantasy romance is perfect for readers who love:  A morally gray antihero (who stays that way) A strong heroine who embraces her dark side (she doesn't need rescuing, thanks) Touch her and die Hilarious, wicked banter and sizzling spice One bed/forced proximity Kidnapped bride/forced marriage Dark humor",https://m.media-amazon.com/images/I/51ao8GjfobL._SY445_SX342_.jpg,https://www.amazon.com/dp/B0F9VMQX47,"[""Magic"",""Crime"",""Comedy""]","[""[#1 in Humorous Fantasy (Kindle Store)](https://www.amazon.com/gp/bestsellers/digital-text/11650864011/ref=pd_zg_hrsr_digital-text)\n[#8 in Humorous Fantasy (Books)](https://www.amazon.com/gp/bestsellers/books/11764648011/ref=pd_zg_hrsr_books)\n[#11 in Sword & Sorcery Fantasy eBooks](https://www.amazon.com/gp/bestsellers/digital-text/6809432011/ref=pd_zg_hrsr_digital-text)""]","her father's tower prison obedient, trembling bride his most terrifying challenge morally gray antihero his villainous seduction plans realm's most notorious villain riotously funny dark romantasy One bed/forced proximity Kidnapped bride/forced marriage Dark humor realm's most chaotic alliance far more terrifying prospect dark and sexy fantasy romance",Third,true,false,true
2025-08-11,Fantasy,B0CZ8XFQ84,When the Moon Hatched: A Novel (The Moonfall Series Book 1),Sarah A. Parker,https://www.amazon.com/stores/author/B095JHHY8C,Moonfall,12.99,4.40,46334,260,2024-04-02,Avon,"NEW YORK TIMES BESTSELLER  The #1 internationally bestselling phenomenon, When the Moon Hatched, is a fast-paced fantasy romance featuring an immersive, vibrant world with mysterious creatures, a unique magic system, and a love that blazes through the ages.  The Creators did not expect their beloved dragons to sail skyward upon their end. To curl into balls just beyond gravity’s grip, littering the sky with tombstones. With moons. They certainly did not expect them to FALL.  As an assassin for the rebellion group Fíur du Ath, Raeve’s job is to complete orders and never get caught. When a rival bounty hunter turns her world upside down, blood spills, hearts break, and Raeve finds herself imprisoned by the Guild of Nobles—a group of powerful fae who turn her into a political statement.  Crushed by the loss of his great love, Kaan Vaegor took the head of a king and donned his melted crown. Now on a tireless quest to quell the never-ebbing ache in his chest, he is lured by a clue into the capitol’s high-security prison where he stumbles upon the imprisoned Raeve …  Echoes of the past race between them.  There’s more to their story than meets the eye, but some truths are too poisonous to swallow.  ""A wild ride that thrills as much as it enchants . . . This remarkable book is an instant classic.” — Thea Guanzon, New York Times bestselling author of The Hurricane Wars  “ When The Moon Hatched breathes new, beautiful life into the genre, as Sarah A. Parker weaves lyrical prose with undeniable chemistry. I laughed, I cried, I got everything out of this. It’s an absolutely stunning fantasy world that everyone should sink their teeth into.” — Raven Kennedy, internationally bestselling author of The Plated Prisoner series",https://m.media-amazon.com/images/I/51SljhsgseL._SY445_SX342_.jpg,https://www.amazon.com/dp/B0CZ8XFQ84,"[""Dragon"",""Mystery"",""Fae/Elves"",""Magic"",""Supernatural""]","[""[#3 in Dragons & Mythical Creatures Fantasy (Books)](https://www.amazon.com/gp/bestsellers/books/16926919011/ref=pd_zg_hrsr_books)\n[#12 in Sword & Sorcery Fantasy eBooks](https://www.amazon.com/gp/bestsellers/digital-text/6809432011/ref=pd_zg_hrsr_digital-text)\n[#25 in Epic Fantasy (Books)](https://www.amazon.com/gp/bestsellers/books/16197/ref=pd_zg_hrsr_books)""]","immersive, vibrant world never-ebbing ache unique magic system fast-paced fantasy romance capitol’s high-security prison rival bounty hunter #1 internationally bestselling phenomenon When the Moon Hatched NEW YORK TIMES BESTSELLER",Third,true,false,true
2025-08-11,Fantasy,B0CC44Z73T,Feathers so Vicious: A Dark Fantasy Romance (Court of Ravens Book 1),Liv Zander,https://www.amazon.com/stores/author/B096XZW7GK,Court of Ravens,4.99,4.40,28542,253,2023-08-24,Ink Heart Publishing,"More treacherous than war... are the battles within a heart. Perched between branches and shadows, We watch, we scheme, Fighting for a kingdom forgotten and forlorn. Until we rip her away with our claws, Our prisoner, our pawn, our plaything. She’s innocent and pure, Fragile and helpless… …but oh so guilty by blood. She calls us beasts, Wicked and evil, Vicious and cruel. We are all that and worse. One of us offers her shelter beneath his wings, Whispering promises of pleasure, Seeking redemption. The other longs to shatter her into a million pieces, Whispering promises of pain, Seeking revenge. Caught between our feathers, She endures our deranged desires, Our secrets, our lies, Our twisted plans. Will she surrender to our darkness, or fight for a destiny growing ever elusive? Welcome to the Court of Ravens, little white dove. Feathers so Vicious is a full-length dark fantasy romance novel, and book one in the Court of Ravens duet. The two-part story features two morally gray raven shifters, a young woman at the mercy of their shadows, and a HEA. This world contains dark elements, violence, and themes some may find disturbing. Readers can find more detailed information on www.livzander.com. What this book doesn't contain is a hero - because villains do it better. And two do it better than one…",https://m.media-amazon.com/images/I/51w2K+Li9NL._SY445_SX342_.jpg,https://www.amazon.com/dp/B0CC44Z73T,"[""Shifter"",""Dark Fantasy""]","[""[#1 in Ancient World Historical Romance (Kindle Store)](https://www.amazon.com/gp/bestsellers/digital-text/6361465011/ref=pd_zg_hrsr_digital-text)\n[#1 in Ancient World Historical Romance (Books)](https://www.amazon.com/gp/bestsellers/books/7538387011/ref=pd_zg_hrsr_books)\n[#4 in Gothic Romance](https://www.amazon.com/gp/bestsellers/digital-text/6487830011/ref=pd_zg_hrsr_digital-text)""]",two morally gray raven shifters full-length dark fantasy romance novel two-part story,First,true,true,true
2025-08-11,Fantasy,B08V4QSV6W,The Dungeon Anarchist's Cookbook: Dungeon Crawler Carl Book 3,Matt Dinniman,https://www.amazon.com/stores/author/B002BLP1QY,Dungeon Crawler Carl,4.99,4.70,24714,404,2021-04-02,Dandy House,"Welcome to the Gun Show!  The top ten list is populated. The sponsorship program is open. The difficulty is ramping up. The first three floors were nothing compared to what Carl and Donut now face.  The Iron Tangle. An impossibly-complicated subway system built out of the world's subterranean railway systems, all combined and then tied together into a knot. Up is down. Down is up. Close is far. The cars are filled with monsters, the railway stations are less than safe, and the exit is always just a few stops away.  But there is hope. For the first time, the crawlers are all working together. The loot is better than ever. And the secret to unraveling it all may be hidden in the pages of a seemingly-useless book. Welcome, crawlers. Welcome to the fourth floor of the dungeon.",https://m.media-amazon.com/images/I/51f9CYkFRPL._SY445_SX342_.jpg,https://www.amazon.com/dp/B08V4QSV6W,"[""Monsters""]","[""[#3 in Humorous Fiction](https://www.amazon.com/gp/bestsellers/books/10159382011/ref=pd_zg_hrsr_books)\n[#7 in General Humorous Fiction](https://www.amazon.com/gp/bestsellers/digital-text/7588841011/ref=pd_zg_hrsr_digital-text)\n[#7 in Fantasy TV"",""Movie & Game Tie-In](https://www.amazon.com/gp/bestsellers/digital-text/6809433011/ref=pd_zg_hrsr_digital-text)""]",top ten list seemingly-useless book first three floors impossibly-complicated subway system world's subterranean railway systems just a few stops,Third,true,false,true
2025-08-11,Fantasy,B0F198KFDC,Neverthorn: A Dark Academia Urban Fantasy (Of Quirks and Curses Book 1),Shannon Mayer,https://www.amazon.com/stores/author/B005L43124,Of Quirks and Curses,6.99,4.60,1164,258,2025-07-22,Hijinks Ink Publishing,"In a realm where magic reigns, a legendary Hero once stood against the encroaching darkness. But with his death, hope dwindled, and the best the world can muster is Harlow Daygon—a thief, magic school dropout, and notorious troublemaker.  At nearly thirty, Harlow can't even cast a simple rune without blundering it. So why does anyone think she can take up the mantle of Hero? Reluctantly, she’s dragged back to Neverthorn Academy with seven former classmates, tasked with training to confront and defeat the Villain of their world.  But the challenges are stacked against her:  Professor Hot-As-Sin makes it clear she’s a failure.  Professor Used-To-Be-A-Mean-Girl has a vendetta.  And lurking in her past is a secret so dark it could reveal she’s not the Hero the world needs—but the next Villain.  With fate hanging in the balance, can Harlow embrace her destiny before the shadows claim her? Visit www.Neverthorn.com to read the first two chapters.",https://m.media-amazon.com/images/I/515iZkaCgDL._SY445_SX342_.jpg,https://www.amazon.com/dp/B0F198KFDC,"[""Magic"",""School/Academy"",""Teacher"",""Urban Fantasy""]","[""[#1 in Dragons & Mythical Creatures Fantasy (Kindle Store)](https://www.amazon.com/gp/bestsellers/digital-text/16232449011/ref=pd_zg_hrsr_digital-text)\n[#3 in New Adult & College Fantasy (Books)](https://www.amazon.com/gp/bestsellers/books/10387329011/ref=pd_zg_hrsr_books)\n[#3 in New Adult & College Fantasy (Kindle Store)](https://www.amazon.com/gp/bestsellers/digital-text/8604756011/ref=pd_zg_hrsr_digital-text)""]",Mean-Girl first two chapters Professor Hot-As-Sin,Third,true,false,true
2025-08-11,Fantasy,B0B4F9G5JD,Gold (The Plated Prisoner Series Book 5),Raven Kennedy,https://www.amazon.com/stores/author/B07GT8KZCC,The Plated Prisoner Series,6.99,4.30,36507,263,2023-12-07,,"Book 5 of this adult fantasy series continues in this epic story inspired by the myth of King Midas, fae, and fated romance. ""Find me in another life. Find me in them all."" Every end is also a beginning. I thought I was going to die, and would have if it weren’t for Slade. The only way he could save me was to open a rip between worlds. The only way for me to save myself was to go through it. Sometimes, fleeing one dangerous place just brings you to another. Annwyn. The realm of the fae. There is magic and beauty here, though around every corner, threats lurk. But I’m a threat too. I’m not a girl in a gilded cage anymore, and no one is going to stop me from finding my way back to Slade. But returning home means facing danger and secrets. So I have to burn bright enough to light my own way… Or else I might be swallowed by the dark. Please note: This adult fantasy book includes dark elements that may be triggering, including violence, cruelty, death, adult language, and explicit romance. It is intended for ages 18 years and older. Read at your own discretion.",https://m.media-amazon.com/images/I/51wZPByvAFL._SY445_SX342_.jpg,https://www.amazon.com/dp/B0B4F9G5JD,"[""Fae/Elves"",""Magic""]","[""[#2 in Greek & Roman Myth & Legend](https://www.amazon.com/gp/bestsellers/books/10387332011/ref=pd_zg_hrsr_books)\n[#4 in Greco-Roman Myth & Legend Fantasy eBooks](https://www.amazon.com/gp/bestsellers/digital-text/6809429011/ref=pd_zg_hrsr_digital-text)\n[#14 in Romantic Fantasy (Books)](https://www.amazon.com/gp/bestsellers/books/13922577011/ref=pd_zg_hrsr_books)""]",adult fantasy series adult fantasy book,First,true,false,true
2025-08-11,Fantasy,B0DVQZBFBK,Metal Slinger: Fire & Metal: Book One,Rachel Schneider,https://www.amazon.com/stores/author/B01GK7BYFG,Fire & Metal,12.99,4.50,31736,276,2025-02-14,Saturday Books,"This breakout romantasy sensation by Rachel Schneider that has taken the Internet by storm bursts with suspense, romance, and a breathtaking twist you won't see coming. Even though she's not one of them, Brynn has spent her life among the Alaha, training to be a guard and waiting for the chance to attend the annual market hosted by the Kenta–the very same people who exiled her adopted community to a life at sea. Going to the market is a rite of passage eagerly anticipated by all young guards, but Brynn does not anticipate breaking a century-long peace treaty while there. Nor does she plan for the intense encounter with an enemy soldier that now threatens to unwind the fragile coexistence between their people–and everything Brynn once believed about herself to be true. Brynn's loyalty to the Alaha is tested when the truth of her identity is brought to light by this soldier who's taken an oath to bring her back to where she belongs. Narrowly escaping death on the violent high seas, Brynn's connection to the Alaha is further tested when she learns about the world of magic she's been denied. She was once certain of her fate and where she belonged, but the dark, knowing eyes of this stranger have her questioning everything, including her heart. Packed with knife fights and seafaring adventure, METAL SLINGER is the smash-hit start to the romantic fantasy duology, the Fire & Metal series.",https://m.media-amazon.com/images/I/41EJaZRL14L._SY445_SX342_.jpg,https://www.amazon.com/dp/B0DVQZBFBK,"[""Suspense"",""Military"",""Magic""]","[""[#4 in Action & Adventure Romance (Books)](https://www.amazon.com/gp/bestsellers/books/11764651011/ref=pd_zg_hrsr_books)\n[#6 in Action & Adventure Romance (Kindle Store)](https://www.amazon.com/gp/bestsellers/digital-text/11650866011/ref=pd_zg_hrsr_digital-text)\n[#32 in Romantic Fantasy (Books)](https://www.amazon.com/gp/bestsellers/books/13922577011/ref=pd_zg_hrsr_books)""]",smash-hit start romantic fantasy duology breakout romantasy sensation violent high seas century-long peace treaty very same people Fire & Metal series,Third,true,false,true
2025-08-11,Fantasy,B0DJZSJHJF,On Wings of Blood: A Novel (Bloodwing Academy Book 1),Briar Boleyn,https://www.amazon.com/stores/author/B0BLWFKHWC,Bloodwing Academy,1.99,4.20,21703,268,2025-06-17,MIRA,"Welcome to Bloodwing Academy. Expect magic. Expect competition. Expect blood. I didn't sign up for this. A half-fae in a school of highblood vampires? That's a recipe for suffering. I'm Medra Pendragon, last of the dragon riders—or so they tell me. Funny thing is, there are no dragons left. Not a single one. But somehow, that hasn't stopped the vampires from deciding I'm worth capturing. Now I'm stuck at Bloodwing Academy, where the highbloods run everything, and blightborn like me? We're just blood in their veins, pawns in their games. But that's not even the worst part. Enter Blake Drakharrow: cold, arrogant, and way too gorgeous for his own good. He's been tormenting me since the moment we met, and now, thanks to some ancient ritual, we're betrothed. He acts like he owns me, but I'm not going down without a fight. Bloodwing isn't just a school—it's a battlefield. Highbloods fight for power, and if you're weak, you're dead. Between deadly competitions, lies that could get me executed, and a dragon-shaped secret looming over my head, all I have to do is survive. Easy, right? Except I'm starting to think the real danger isn't the academy—it's what I'm becoming in this twisted game of power. And Blake? He might just be the one who pushes me over the edge. They think they can control me. They think they can use me. But they have no idea what they've awakened.",https://m.media-amazon.com/images/I/51hs2zo9tuL._SY445_SX342_.jpg,https://www.amazon.com/dp/B0DJZSJHJF,"[""School/Academy"",""Dragon"",""Fae/Elves"",""Vampire"",""Magic"",""Supernatural""]","[""[#5 in Action & Adventure Romance (Kindle Store)](https://www.amazon.com/gp/bestsellers/digital-text/11650866011/ref=pd_zg_hrsr_digital-text)\n[#6 in Vampire Romances](https://www.amazon.com/gp/bestsellers/books/16399311/ref=pd_zg_hrsr_books)\n[#7 in Contemporary Fantasy (Books)](https://www.amazon.com/gp/bestsellers/books/16195/ref=pd_zg_hrsr_books)""]",half-fae even the worst part dragon-shaped secret Not a single one,First,true,false,true
