ingested_date,genre,asin,title,author,author_url,series,price,rating,review_count,rank_overall,release_date,publisher,blurb_text,cover_url,product_url,topic_tags,subcategories,blurb_keyphrases,estimated_pov,has_supernatural,has_romance,cover_ok
2025-08-11,Romance,B07W54QG2X,The Happy Ever After Playlist (The Friend Zone Book 2),Abby Jimenez,https://www.amazon.com/stores/author/B07KX5X24Y,The Friend Zone,11.99,4.50,44631,148,2020-04-14,Forever,"From the New York Times bestselling author of Part of Your World comes a romantic comedy full of ""fierce humor and fiercer heart"" about how one adorable puppy brings together two perfect strangers (Casey McQuiston, NYT bestselling author of Red, White & Royal Blue). Artist Sloan Monroe just can't seem to get her life on track. But one trouble-making pup who randomly jumps into her car with a ""take me home"" look in his eyes is about to change everything. With Tucker by her side, Sloan finally starts to feel more like herself. Then, after weeks of unanswered texts, Tucker's owner reaches out. He's a musician on tour in Australia. And bottom line: He wants Tucker back. Well, Sloan's not about to give up her dog without a fight. But what if this Jason guy really loves Tucker? As their flirty texts turn into long calls, Sloan can't deny a connection. Jason is hot and nice and funny. There's no telling what could happen when they meet in person. The question is: With his music career on the rise, how long will Jason really stick around? And is it possible for Sloan to survive another heartbreak?  USA Today bestseller Publishers Weekly bestseller Featured on NBC, NPR, PopSugar, Entertainment Weekly, Forbes, Business Insider, Bustle, Oprah.com Goodreads Choice Award Finalist for Best Romance SheReads Award Best Romance of the year Frolic’s Best Books of the year",https://m.media-amazon.com/images/I/51hGW7mPegL._SY445_SX342_.jpg,https://www.amazon.com/dp/B07W54QG2X,"[""Comedy"",""Animals"",""Aristocracy""]","[""[#11 in Women's Friendship Fiction](https://www.amazon.com/gp/bestsellers/books/542662/ref=pd_zg_hrsr_books)\n[#15 in Romantic Comedy (Kindle Store)](https://www.amazon.com/gp/bestsellers/digital-text/6487841011/ref=pd_zg_hrsr_digital-text)\n[#25 in Women's Romance Fiction](https://www.amazon.com/gp/bestsellers/digital-text/7588898011/ref=pd_zg_hrsr_digital-text)""]",Oprah.com Goodreads Choice Award Finalist Best Romance SheReads New York Times one trouble-making pup Frolic’s Best Books,Third,false,false,true
2025-08-11,Romance,B075818VDG,A Court of Frost and Starlight (A Court of Thorns and Roses Book 4),Sarah J. Maas,https://www.amazon.com/stores/author/B0070291GK,A Court of Thorns and Roses,8.06,4.20,170004,166,2018-05-01,Bloomsbury Publishing,"A tender addition to the #1 New York Times bestselling Court of Thorns and Roses series by Sarah J. Maas, bridging the events of A Court of Wings and Ruin and upcoming books. Feyre, Rhysand, and their friends are still busy rebuilding the Night Court and the vastly altered world beyond, recovering from the war that changed everything. But Winter Solstice is finally approaching, and with it, the joy of a hard-earned reprieve. Yet even the festive atmosphere can't keep the shadows of the past from looming. As Feyre navigates her first Winter Solstice as High Lady, her concern for those dearest to her deepens. They have more wounds than she anticipated-scars that will have a far-reaching impact on the future of their court. Bridging the events of A Court of Wings and Ruin with the later books in the series, A Court of Frost and Starlight explores the far-reaching effects of a devastating war and the fierce love between friends.",https://m.media-amazon.com/images/I/51zRpAiY8KL._SY445_SX342_.jpg,https://www.amazon.com/dp/B075818VDG,,"[""[#9 in Romantasy](https://www.amazon.com/gp/bestsellers/books/7654406011/ref=pd_zg_hrsr_books)\n[#13 in Epic Fantasy (Kindle Store)](https://www.amazon.com/gp/bestsellers/digital-text/158580011/ref=pd_zg_hrsr_digital-text)\n[#16 in Epic Fantasy (Books)](https://www.amazon.com/gp/bestsellers/books/16197/ref=pd_zg_hrsr_books)""]",far-reaching impact far-reaching effects her first Winter Solstice hard-earned reprieve Thorns and Roses series vastly altered world #1 New York Times even the festive atmosphere,Third,false,false,true
2025-08-11,Romance,B00P42X1P0,Maybe in Another Life: A Novel,Taylor Jenkins Reid,https://www.amazon.com/stores/author/B00DX8B85M,,3.99,4.10,33156,150,2015-07-07,Washington Square Press,"From the New York Times bestselling author of The Seven Husbands of Evelyn Hugo A People Magazine Pick * US Weekly “Must” Pick * Named “Best Book of the Summer” by Glamour * Good Housekeeping * USA TODAY * Cosmopolitan * PopSugar * Working Mother * Bustle * Goodreads A breathtaking new novel about a young woman whose fate hinges on the choice she makes after bumping into an old flame; in alternating chapters, we see two possible scenarios unfold—with stunningly different results. At the age of twenty-nine, Hannah Martin still has no idea what she wants to do with her life. She has lived in six different cities and held countless meaningless jobs since graduating college. On the heels of leaving yet another city, Hannah moves back to her hometown of Los Angeles and takes up residence in her best friend Gabby’s guestroom. Shortly after getting back to town, Hannah goes out to a bar one night with Gabby and meets up with her high school boyfriend, Ethan. Just after midnight, Gabby asks Hannah if she’s ready to go. A moment later, Ethan offers to give her a ride later if she wants to stay. Hannah hesitates. What happens if she leaves with Gabby? What happens if she leaves with Ethan? In concurrent storylines, Hannah lives out the effects of each decision. Quickly, these parallel universes develop into radically different stories with large-scale consequences for Hannah, as well as the people around her. As the two alternate realities run their course, Maybe in Another Life raises questions about fate and true love: Is anything meant to be? How much in our life is determined by chance? And perhaps, most compellingly: Is there such a thing as a soul mate? Hannah believes there is. And, in both worlds, she believes she’s found him.",https://m.media-amazon.com/images/I/41SM3ZHvjgL._SY445_SX342_.jpg,https://www.amazon.com/dp/B00P42X1P0,"[""College"",""School/Academy""]","[""[#1 in Single Women Fiction](https://www.amazon.com/gp/bestsellers/books/542666/ref=pd_zg_hrsr_books)\n[#10 in Contemporary Women's Fiction](https://www.amazon.com/gp/bestsellers/digital-text/6190493011/ref=pd_zg_hrsr_digital-text)\n[#12 in Women's Friendship Fiction](https://www.amazon.com/gp/bestsellers/books/542662/ref=pd_zg_hrsr_books)""]",large-scale consequences fate and true love two alternate realities her high school boyfriend New York Times Glamour * Good Housekeeping,Third,false,false,true
2025-08-11,Romance,B096BKV268,Hunting Adeline (Cat and Mouse Duet Book 2),H. D. Carlton,https://www.amazon.com/stores/author/B07H74G916,Cat and Mouse Duet,4.99,4.40,128137,149,2022-01-28,,"AN AMAZON TOP 25 BESTSELLER! The conclusion to the Cat and Mouse Duet is here... “If she were to die… the world would die with her.” The worst Adeline Reilly expected for her life were a few unholy ghosts haunting the hallways of Parsons Manor, not falling in love with her stalker and ending up in the clutches of a trafficking ring. Trapped in a house used to groom women for the elite, she faces the biggest fight of her life—survive the Culling and escape. But that’s not so easy when watchful eyes are determined to see her fail. However, Adeline may have an unlikely ally, who just might be the key to her getting out alive. But trusting them is a risk that could cost her everything. Meanwhile, Zade will stop at nothing until Adeline is safe in his arms again, even if he must burn the world to find her. Hunting his little mouse is what he’s best at, but who she’ll be when he finds her is a battle that he doesn’t know he can win. It won’t be the test of time they must survive, but the memories of who they once were. Warning: This is the second and final installment to the Duet. You must read Haunting Adeline first. Recommended Reading Order for the C&M Universe: Satan's Affair Haunting Adeline Hunting Adeline Where's Molly",https://m.media-amazon.com/images/I/51WCe+hpaKL._SY445_SX342_.jpg,https://www.amazon.com/dp/B096BKV268,"[""Ghosts""]","[""[#2 in Gothic Romance](https://www.amazon.com/gp/bestsellers/digital-text/6487830011/ref=pd_zg_hrsr_digital-text)\n[#6 in Romantic Suspense (Kindle Store)](https://www.amazon.com/gp/bestsellers/digital-text/158574011/ref=pd_zg_hrsr_digital-text)\n[#7 in Romantic Suspense (Books)](https://www.amazon.com/gp/bestsellers/books/13389/ref=pd_zg_hrsr_books)""]",second and final installment few unholy ghosts worst Adeline Reilly Cat and Mouse Duet,Third,true,false,true
2025-08-11,Romance,B00CU7YHQY,Crown of Midnight (Throne of Glass Book 2),Sarah J. Maas,https://www.amazon.com/stores/author/B0070291GK,Throne Of Glass Series,8.21,4.60,132666,167,2013-08-27,Bloomsbury Publishing,"Never trust an assassin. Celaena's story continues in this second book in the #1 bestselling Throne of Glass series by Sarah J. Maas. Celaena Sardothien won a brutal contest to become the King's Champion. But she is far from loyal to the crown. Though she goes to great lengths to hide her secret, her deadly charade becomes more difficult when she realizes she is not the only one seeking justice. Her search for answers ensnares those closest to her, and no one is safe from suspicion-not the Crown Prince Dorian; not Chaol, the Captain of the Guard; not even her best friend, Nehemia, a princess with a rebel heart. Then, one terrible night, the secrets they have all been keeping lead to an unspeakable tragedy. As Celaena's world shatters, she will be forced to decide once and for all where her true loyalties lie . . . and what she is willing to fight for. The second book in the #1 New York Times bestselling Throne of Glass series returns readers to a land destroyed by liars, where one woman's truth is the only thing that can save them all.",https://m.media-amazon.com/images/I/51IIbR3tj5L._SY445_SX342_.jpg,https://www.amazon.com/dp/B00CU7YHQY,"[""Aristocracy""]","[""[#3 in Teen & Young Adult Epic Fantasy eBooks](https://www.amazon.com/gp/bestsellers/digital-text/15249163011/ref=pd_zg_hrsr_digital-text)\n[#4 in Teen & Young Adult Epic Fantasy](https://www.amazon.com/gp/bestsellers/books/13922498011/ref=pd_zg_hrsr_books)\n[#10 in Epic Fantasy (Books)](https://www.amazon.com/gp/bestsellers/books/16197/ref=pd_zg_hrsr_books)""]",Crown Prince Dorian one woman's truth Celaena's world shatters King's Champion not even her best friend #1 New York Times,Third,false,false,true
2025-08-11,Romance,B09NJBVM8Z,Praise (Salacious Players' Club),Sara Cate,https://www.amazon.com/stores/author/B07Y8SVDN7,Salacious Players' Club (6 books),4.99,4.40,73317,154,2022-03-17,,"He calls me perfect.  His flawless pet.  His good girl.  Broken down and wounded by my emotionally neglectful ex, I wanted someone to tell me I was good enough.  Then, I stumbled into a new job with a boss who brings me to my knees—literally. He has me do things a real secretary would never do.  Emerson Grant tells me I’m more than just good enough.  I’m worthy of his praise.  There are a million reasons why I should stay away. The owner of the Salacious Players’ Club is not just my new boss, he’s twice my age.  And my ex-boyfriend’s father.  With him, I am treasured. I am adored. I am his.  I’m a good girl, but I’m falling for the wrong man.  Emerson Grant knows what he wants—  And he wants me.  So how far will I go to hear his approval?",https://m.media-amazon.com/images/I/41QOlbVq43L._SY445_SX342_.jpg,https://www.amazon.com/dp/B09NJBVM8Z,,"[""[#1 in City Life Fiction (Kindle Store)](https://www.amazon.com/gp/bestsellers/digital-text/17744524011/ref=pd_zg_hrsr_digital-text)\n[#17 in Contemporary Romance Fiction](https://www.amazon.com/gp/bestsellers/digital-text/7588748011/ref=pd_zg_hrsr_digital-text)\n[#24 in Contemporary Romance (Books)](https://www.amazon.com/gp/bestsellers/books/13354/ref=pd_zg_hrsr_books)""]",just my new boss my emotionally neglectful ex,First,false,false,true
2025-08-11,Romance,B088F5W9ZK,The Brooklyn Book Boyfriends: a collection,Kayley Loring,https://www.amazon.com/stores/author/B01N91ARO0,,0.99,4.80,503,155,2020-05-28,Amazon Digital Services,"One New York borough (okay two boroughs). Four book boyfriends to fall in love with. Four full-length standalone novels with crossover characters that appear together in The Plus Ones. Bonus epilogues for all four novels that can only be found in this collection. This collection includes: Rebound with Me (bonus epilogue and 5000 words longer than the original 2018 version), Come Back to Bed (bonus epilogue), Tonight You’re Mine (bonus epilogue) and The Plus Ones (bonus epilogue). REBOUND WITH ME *Vince and Nina* A man and a woman whose exes are now dating each other. One awesome bad idea. One hot summer fling that just might be the real thing. COME BACK TO BED *Matt and Bernadette* Two neighbors. Nothing in common except a wall and a dog. No strings. No problem! TONIGHT YOU’RE MINE *Chase and Aimee* Just the two of them. Just for one night. Except that tomorrow they’ll have to start working together, and his business partner likes her too… THE PLUS ONES *Keaton and Roxy* One Caribbean couples-only resort. Reservations for six friends who want to escape Brooklyn in the dead of winter. Two married couples. Two fakers who hate each other’s freaking guts.",https://m.media-amazon.com/images/I/410TUXfr2AL._SY445_SX342_.jpg,https://www.amazon.com/dp/B088F5W9ZK,"[""Animals""]","[""[#1 in Romance Collections & Anthologies (Kindle Store)](https://www.amazon.com/gp/bestsellers/digital-text/6190486011/ref=pd_zg_hrsr_digital-text)\n[#1 in Romance Collections & Anthologies (Books)](https://www.amazon.com/gp/bestsellers/books/12827/ref=pd_zg_hrsr_books)\n[#10 in Contemporary Women Fiction](https://www.amazon.com/gp/bestsellers/books/3559170011/ref=pd_zg_hrsr_books)""]",One New York borough original 2018 version Roxy* One Caribbean couples other’s freaking guts Four full-length standalone novels One awesome bad idea okay two boroughs One hot summer fling,Unknown,false,false,true
2025-08-11,Romance,B08Y6DCS1Y,Twisted Love,Ana Huang,https://www.amazon.com/stores/author/B00X0CEQNW,Twisted,5.99,4.20,134437,157,2021-04-29,,"★★ A New York Times, USA Today, and WSJ Bestselling Romance ★★ He has a heart of ice...but for her, he'd burn the world. Alex Volkov is a devil blessed with the face of an angel and cursed with a past he can’t escape. Driven by a tragedy that has haunted him for most of his life, his ruthless pursuits for success and vengeance leave little room for matters of the heart. But when he’s forced to look after his best friend’s sister, he starts to feel something in his chest: A crack. A melt. A fire that could end his world as he knew it. *** Ava Chen is a free spirit trapped by nightmares of a childhood she can’t remember. But despite her broken past, she’s never stopped seeing the beauty in the world…including the heart beneath the icy exterior of a man she shouldn’t want. Her brother’s best friend. Her neighbor. Her savior and her downfall. Theirs is a love that was never supposed to happen—but when it does, it unleashes secrets that could destroy them both…and everything they hold dear. Twisted Love is a contemporary brother’s best friend/grumpy sunshine romance. It's book one in the Twisted series but can be read as a standalone. WARNING: This book contains a possessive antihero, explicit sexual content, and profanity. No cheating or menage, but if you're looking for a traditionally sweet, loveable hero, this is not the book for you. Recommended for 18+.",https://m.media-amazon.com/images/I/41MYo2iFlQS._SY445_SX342_.jpg,https://www.amazon.com/dp/B08Y6DCS1Y,"[""Menage"",""Contemporary""]","[""[#1 in Multicultural & Interracial Romance (Books)](https://www.amazon.com/gp/bestsellers/books/68262/ref=pd_zg_hrsr_books)\n[#2 in Multicultural & Interracial Romance (Kindle Store)](https://www.amazon.com/gp/bestsellers/digital-text/6487837011/ref=pd_zg_hrsr_digital-text)\n[#6 in New Adult & College Romance (Kindle Store)](https://www.amazon.com/gp/bestsellers/digital-text/6487838011/ref=pd_zg_hrsr_digital-text)""]","traditionally sweet, loveable hero contemporary brother’s best friend/grumpy sunshine romance his best friend’s sister Her brother’s best friend New York Times",Third,false,true,true
2025-08-11,Romance,B08RW8MW3D,Glint (The Plated Prisoner Series Book 2),Raven Kennedy,https://www.amazon.com/stores/author/B07GT8KZCC,The Plated Prisoner Series,5.99,4.50,67148,158,2021-01-11,Raven Kennedy,"“You want to make your life easier? Then be the caged bird that you are and sing.” For ten years, I’ve lived in a gilded cage inside King Midas’s golden castle. But one night changed everything. Now I’m here, a prisoner of Fourth Kingdom’s army, and I’m not sure if I’m going to make it out of this in one piece. They’re marching to battle, and I’m the bargaining chip that will either douse the fire or spark a war. At the heart of my fear, my worry, there’s him—Commander Rip. Known for his brutality on the battlefield, his viciousness is unsurpassed. But I know the truth about what he is. Fae. The betrayers. The murderers. The ones who nearly destroyed Orea, wiping out Seventh Kingdom in the process. Rip has power sizzling beneath this skin and glinting spikes down his spine. But his eyes—his eyes are the most compelling of all. When he turns those black eyes on me, I feel captive for an entirely different reason. I may be out of my cage, but I’m not free, not even close. In the game of kings and armies, I’m the gilded pawn. The question is, can I out maneuver them? This is the captivating second book of The Plated Prisoner series. It’s an adult epic fantasy story blending romance, intrigue, and beautiful imagery. Return to the seductive story of magic inspired by the myth of King Midas, and get caught up in the world of Orea. Please note: This adult fantasy book contains explicit content and dark elements that may be triggering to some. It includes explicit romance, mature language, violence, effects of Stockholm Syndrome, trauma, and manipulation. It is not intended for anyone under 18 years of age. This is book 2 in a series.",https://m.media-amazon.com/images/I/51l1oSrh+XL._SY445_SX342_.jpg,https://www.amazon.com/dp/B08RW8MW3D,"[""Crime"",""Military"",""Magic"",""Fantasy"",""Fae/Elves"",""Epic Fantasy""]","[""[#2 in Fairy Tale Fantasy (Kindle Store)](https://www.amazon.com/gp/bestsellers/digital-text/169457011/ref=pd_zg_hrsr_digital-text)\n[#2 in Greco-Roman Myth & Legend Fantasy eBooks](https://www.amazon.com/gp/bestsellers/digital-text/6809429011/ref=pd_zg_hrsr_digital-text)\n[#3 in Folklore (Books)](https://www.amazon.com/gp/bestsellers/books/12615/ref=pd_zg_hrsr_books)""]",King Midas’s golden castle captivating second book Plated Prisoner series adult fantasy book entirely different reason adult epic fantasy story Fourth Kingdom’s army,First,true,false,true
2025-08-11,Romance,B0FHXRVP7N,Wicked Refusal (Lozhkin Bratva Book 2),Nicole Fox,https://www.amazon.com/stores/author/B01NA0897Q,Lozhkin Bratva,7.99,4.50,2121,162,2025-07-16,,"What's worse: the man who doesn't love you anymore, or the man who never did? Three months ago, I made a deal. One night with a Russian mobster for a million dollars. It was supposed to solve everything. Spoiler: It did not. Now, I'm trapped in a nightmare with my abusive ex. My son thinks I'm a liar. And I'm pregnant with a baby whose father wants nothing to do with me. All because I had to choose: Tell Yulian Lozhkin the truth and watch my ex put a gun to my child's head...? Or lie to the only man I've ever loved and keep my family alive? I chose the lie. I chose survival. I chose my son. But now, the past is catching up to all of us. Yulian's enemies are coming. My ex won't let us go. And I'm running out of time to protect the people I love. They say the devil you know is better than the devil you don't. But what happens when both devils want to destroy you? What happens when the only person who can save you... is the one whose heart you just broke?  WICKED REFUSAL is Book 2 of the Lozhkin Bratva duet. Yulian and Mia’s story begins in Book 1, WICKED PROPOSAL.",https://m.media-amazon.com/images/I/41VXk23S+kL._SY445_SX342_.jpg,https://www.amazon.com/dp/B0FHXRVP7N,"[""Pregnancy"",""Organized Crime""]","[""[#7 in Mafia Romance eBooks](https://www.amazon.com/gp/bestsellers/digital-text/120220975011/ref=pd_zg_hrsr_digital-text)\n[#11 in Billionaires & Millionaires Romance eBooks](https://www.amazon.com/gp/bestsellers/digital-text/120220974011/ref=pd_zg_hrsr_digital-text)\n[#11 in Billionaires & Millionaires Romance](https://www.amazon.com/gp/bestsellers/books/120214349011/ref=pd_zg_hrsr_books)""]",Yulian and Mia’s story my child's head Lozhkin Bratva duet,First,false,true,true
2025-08-11,Romance,B0DQ1Y9YKS,You'll Find It All Still Here: A Novel,Lisa Greenwald,https://www.amazon.com/stores/author/B001JS7UQE,,1.99,3.70,287,163,2025-09-01,Lake Union Publishing,"An emotional trip down memory lane, author Lisa Greenwald’s playful second-chance romance is perfect for anyone who grew up reading her middle-grade books or spent fervent summers away at camp.  Successful event planner Mira Erdman never expected to see Brush Hill Camp again. But these days, the old sleepaway camp in the Berkshires offers “adult” experiences for New York’s twentysomething Jewish singles. And Mira’s bubbie knows it’s the perfect place for her granddaughter to find love.  Since losing her mom, Mira has basically given up on dating. But for Bubbie’s sake—and with best friend Josie at her side—she’s resigned to giving grown-up camp a try. The beer garden and coed cabins are wild, though not enough to stop the flood of old memories. And when her onetime camp crush turns up, Mira’s teenage anxieties threaten to resurface…along with a rush of other feelings.  Rooted in nostalgia, You’ll Find It All Still Here weaves together themes of friendship, community, and family. Mira’s soulmate may be out there, but she’ll have to learn to love and accept herself first, with the help of those she holds dearest.",https://m.media-amazon.com/images/I/51GemIgGgCL._SY445_SX342_.jpg,https://www.amazon.com/dp/B0DQ1Y9YKS,"[""Friendship""]","[""[#6 in Friendship Fiction (Books)](https://www.amazon.com/gp/bestsellers/books/17745818011/ref=pd_zg_hrsr_books)\n[#6 in Friendship Fiction (Kindle Store)](https://www.amazon.com/gp/bestsellers/digital-text/17744528011/ref=pd_zg_hrsr_digital-text)\n[#14 in Women's Friendship Fiction](https://www.amazon.com/gp/bestsellers/books/542662/ref=pd_zg_hrsr_books)""]",her middle-grade books old sleepaway camp author Lisa Greenwald’s playful second-chance romance her onetime camp crush Mira’s teenage anxieties adult” experiences grown-up camp Successful event planner Mira Erdman,Third,false,false,true
