ingested_date,genre,asin,title,author,author_url,series,price,rating,review_count,rank_overall,release_date,publisher,blurb_text,cover_url,product_url,topic_tags,subcategories,blurb_keyphrases,estimated_pov,has_supernatural,has_romance,cover_ok
2025-08-11,Romance,B0FHXP96YM,Wicked Proposal (Lozhkin Bratva Book 1),Nicole Fox,https://www.amazon.com/stores/author/B01NA0897Q,Lozhkin Bratva,2.99,4.50,2154,62,2025-07-16,,"What's worse than being dragged to a wedding? Finding out the groom is your ex. And he’s still not over you. Yulian Lozhkin was crafted by the Good Lord Himself. Stormy-gray eyes. GQ stubble. Cheesegrater abs. Too bad he's one of the most dangerous, powerful men in the city. He needs a fake fiancé to seal the deal that will crown him king. And I need his help to get my son the special care he needs. So I make a deal to be his date for the night. But imagine my surprise when we arrive at the ceremony and I see who's getting married... MY EX. And as the wedding unfolds, I realize just how not over me he is. I broke up with him for good reason. Namely, he’s a terrible person. Him awkwardly hitting on me in front of his wife-to-be explains it all. But Yulian needs to close this deal and stay. And I can suck it up for one night for my son’s well-being. Which brings me to maybe the worst moment of my entire life… When the pastor asks, “Do you take this woman to be your lawfully wedded wife?” And my ex says, “No… I want HER instead.”",https://m.media-amazon.com/images/I/51uN87xzmHL._SY445_SX342_.jpg,https://www.amazon.com/dp/B0FHXP96YM,"[""Organized Crime""]","[""[#2 in Mafia Romance eBooks](https://www.amazon.com/gp/bestsellers/digital-text/120220975011/ref=pd_zg_hrsr_digital-text)\n[#3 in Billionaires & Millionaires Romance](https://www.amazon.com/gp/bestsellers/books/120214349011/ref=pd_zg_hrsr_books)\n[#4 in Billionaires & Millionaires Romance eBooks](https://www.amazon.com/gp/bestsellers/digital-text/120220974011/ref=pd_zg_hrsr_digital-text)""]","Stormy-gray eyes your lawfully wedded wife my son’s well-being Good Lord Himself most dangerous, powerful men",First,false,false,true
2025-08-11,Romance,B0FDKCB9TW,"His Son's Ex: An Age Gap, Mafia Romance (Silver Fox Daddies)",K.C. Crowne,https://www.amazon.com/stores/author/B07H4X4LN1,Silver Fox Daddies (26 books),2.99,4.40,4795,63,2025-06-30,,"TOP 12 BESTSELLER IN THE WHOLE AMAZON STORE Crashing my ex’s wedding was for closure… Until his plastic bride called me fat i n front of everyone. Three hundred witnesses. Dead silence. That's when the Mafia king put her in her place. Dante Bellacino. Devil in an Armani suit. My ex’s father. He shuts her up with a single look. ""Apologize,"" he growls. Then turns to me like I’m the last sin he’ll ever commit. ""You’re staying."" I should run. But fate traps us in an elevator between floors— And that’s where I get my first taste of sweet submission. Now I’m working for him. Trapped in his world. His rules. My ruin. Because the man who owns my body… Who touches me like I’ll break, And ruins me like I won’t… Might be the one behind a murder that shattered my world. And falling for him? Might be my deadliest mistake. Readers note: This is full-length standalone featuring an ex's dad, age-gap, mafia and office romance. K.C. Crowne is an Amazon Top 6 Bestseller and International Bestselling Author.",https://m.media-amazon.com/images/I/51ECQ42KxdL._SY445_SX342_.jpg,https://www.amazon.com/dp/B0FDKCB9TW,"[""Organized Crime"",""Office/Workplace"",""Crime"",""Age Gap""]","[""[#1 in Classic Romance Fiction](https://www.amazon.com/gp/bestsellers/digital-text/7588786011/ref=pd_zg_hrsr_digital-text)\n[#2 in Action & Adventure Romance (Kindle Store)](https://www.amazon.com/gp/bestsellers/digital-text/11650866011/ref=pd_zg_hrsr_digital-text)\n[#2 in Action & Adventure Romance (Books)](https://www.amazon.com/gp/bestsellers/books/11764651011/ref=pd_zg_hrsr_books)""]","ex's dad WHOLE AMAZON STORE Amazon Top 6 Bestseller My ex’s father full-length standalone age-gap, mafia and office romance",First,false,true,true
2025-08-11,Romance,B0DKKRGTC7,Both Things Are True: A Novel,Kathleen Barber,https://www.amazon.com/stores/author/B01LYZ684H,,1.99,4.00,504,64,2025-09-01,Lake Union Publishing,"For two exes who meet again, moving on is harder than ever in a funny and heartfelt romantic comedy about starting over by the author of Truth Be Told, now a major Apple TV+ series.  Vanessa is a yoga influencer living high in New York. But after her crypto-entrepreneur fiancé ruins both their lives by fleeing the country amid fraud allegations, Vanessa’s only choice is to start over—by flying home to Chicago and moving in with her sister.  Just as Vanessa puts her life back together, she bumps into Sam. Years ago, they fell hard and too fast. Their relationship ended in heartbreak after an impromptu Las Vegas wedding officiated by a Dolly Parton impersonator—and an annulment that was just as sudden. Now Sam is co-owner of a solar company with a promising future, a future Vanessa wants to be included in. But she can’t shake the whiff of scandal from her AWOL fiancé, and to protect Sam’s reputation, she’s keeping her distance. Then again…  If anyone can turn a negative into a positive—and a first love into a second chance—it’s a young woman with influence.",https://m.media-amazon.com/images/I/41PfKRvqgvL._SY445_SX342_.jpg,https://www.amazon.com/dp/B0DKKRGTC7,"[""Comedy"",""Second Chance""]","[""[#4 in Sisters Fiction](https://www.amazon.com/gp/bestsellers/books/542664/ref=pd_zg_hrsr_books)\n[#4 in Marriage & Divorce Fiction](https://www.amazon.com/gp/bestsellers/digital-text/17744526011/ref=pd_zg_hrsr_digital-text)\n[#7 in Women's Friendship Fiction](https://www.amazon.com/gp/bestsellers/books/542662/ref=pd_zg_hrsr_books)""]",major Apple TV+ series funny and heartfelt romantic comedy Dolly Parton impersonator Vanessa’s only choice impromptu Las Vegas wedding her crypto-entrepreneur fiancé,Third,false,true,true
2025-08-11,Romance,B015FELXQ0,A Court of Mist and Fury (A Court of Thorns and Roses Book 2),Sarah J. Maas,https://www.amazon.com/stores/author/B0070291GK,A Court of Thorns and Roses,8.21,4.80,268941,73,2016-05-03,Bloomsbury Publishing,"The seductive and stunning #1 New York Times bestselling sequel to Sarah J. Maas's spellbinding A Court of Thorns and Roses. Feyre has undergone more trials than one human woman can carry in her heart. Though she's now been granted the powers and lifespan of the High Fae, she is haunted by her time Under the Mountain and the terrible deeds she performed to save the lives of Tamlin and his people. As her marriage to Tamlin approaches, Feyre's hollowness and nightmares consume her. She finds herself split into two different people: one who upholds her bargain with Rhysand, High Lord of the feared Night Court, and one who lives out her life in the Spring Court with Tamlin. While Feyre navigates a dark web of politics, passion, and dazzling power, a greater evil looms. She might just be the key to stopping it, but only if she can harness her harrowing gifts, heal her fractured soul, and decide how she wishes to shape her future-and the future of a world in turmoil. Bestselling author Sarah J. Maas's masterful storytelling brings this second book in her dazzling, sexy, action-packed series to new heights.",https://m.media-amazon.com/images/I/51oOo8rGKqL._SY445_SX342_.jpg,https://www.amazon.com/dp/B015FELXQ0,"[""Fae/Elves""]","[""[#4 in Romantasy](https://www.amazon.com/gp/bestsellers/books/7654406011/ref=pd_zg_hrsr_books)\n[#6 in Paranormal Romance (Books)](https://www.amazon.com/gp/bestsellers/books/13356/ref=pd_zg_hrsr_books)\n[#7 in Epic Fantasy (Books)](https://www.amazon.com/gp/bestsellers/books/16197/ref=pd_zg_hrsr_books)""]","feared Night Court Bestselling author Sarah J. Maas's masterful storytelling her dazzling, sexy, action-packed series seductive and stunning #1 New York Times",Third,true,false,true
2025-08-11,Romance,B0DFB6P17L,Chasing Shelter (Sparrow Falls Book 5),Catherine Cowles,https://www.amazon.com/stores/author/B07FYVGV93,Sparrow Falls,5.99,4.60,7244,67,2025-07-22,"PageSmith LLC, The","I came here seeking sanctuary, I never meant to fall for the broody single dad next door. I've spent my life hiding in plain sight, burying my past beneath layers of carefully constructed lies. Moving to Sparrow Falls was supposed to be a fresh start. A place to lay low. But when I end up living next door to the single dad who just happens to be one of my brother’s best friends, everything changes. Trace Colson sees too much, asks too many questions, and his protectiveness is as infuriating as it is alluring. And when danger comes calling, it’s Trace who stands between me and the darkness. But being close to him is its own kind of risk. Because with every heated glance and every stolen touch, Trace tempts me to open my heart, to dream of a life I’d long since given up on. The only problem? Trace has his own demons, and when they collide with mine, the fallout could destroy us both. Forever.",https://m.media-amazon.com/images/I/51nlBeHlhnL._SY445_SX342_.jpg,https://www.amazon.com/dp/B0DFB6P17L,"[""Single Dad""]","[""[#5 in Small Town Romance eBooks](https://www.amazon.com/gp/bestsellers/digital-text/120220981011/ref=pd_zg_hrsr_digital-text)\n[#6 in Romantic Suspense (Books)](https://www.amazon.com/gp/bestsellers/books/13389/ref=pd_zg_hrsr_books)\n[#7 in Contemporary Romance Fiction](https://www.amazon.com/gp/bestsellers/digital-text/7588748011/ref=pd_zg_hrsr_digital-text)""]",my brother’s best friends broody single dad,First,false,true,true
2025-08-11,Romance,B00OZP5VRS,A Court of Thorns and Roses,Sarah J. Maas,https://www.amazon.com/stores/author/B0070291GK,A Court of Thorns and Roses,8.21,4.60,294912,66,2015-05-05,Bloomsbury Publishing,"The sexy, action-packed first book in the #1 New York Times bestselling Court of Thorns and Roses series from Sarah J. Maas. When nineteen-year-old huntress Feyre kills a wolf in the woods, a terrifying creature arrives to demand retribution. Dragged to a treacherous magical land she knows about only from legends, Feyre discovers that her captor is not truly a beast, but one of the lethal, immortal faeries who once ruled her world. At least, he's not a beast all the time. As she adapts to her new home, her feelings for the faerie, Tamlin, transform from icy hostility into a fiery passion that burns through every lie she's been told about the beautiful, dangerous world of the Fae. But something is not right in the faerie lands. An ancient, wicked shadow is growing, and Feyre must find a way to stop it, or doom Tamlin-and his world-forever. From bestselling author Sarah J. Maas comes a seductive, breathtaking book that blends romance, adventure, and faerie lore into an unforgettable read.",https://m.media-amazon.com/images/I/51ZvROcTcfL._SY445_SX342_.jpg,https://www.amazon.com/dp/B00OZP5VRS,"[""Magic"",""Fae/Elves""]","[""[#1 in Folklore (Books)](https://www.amazon.com/gp/bestsellers/books/12615/ref=pd_zg_hrsr_books)\n[#5 in Epic Fantasy (Books)](https://www.amazon.com/gp/bestsellers/books/16197/ref=pd_zg_hrsr_books)\n[#6 in Romantasy eBooks](https://www.amazon.com/gp/bestsellers/digital-text/158569011/ref=pd_zg_hrsr_digital-text)""]","sexy, action-packed first book beautiful, dangerous world lethal, immortal faeries treacherous magical land nineteen-year-old huntress Feyre ancient, wicked shadow seductive, breathtaking book Thorns and Roses series #1 New York Times",Third,true,false,true
2025-08-11,Romance,B0C9MXW2JL,Insatiable (The Edge of Darkness: Book 1) (The Edge of Darkness Trilogy),Leigh Rivers,https://www.amazon.com/stores/author/B0C9MXQ7Z7,The Edge of Darkness Trilogy,3.99,4.40,25972,68,2023-08-10,,"IF HE CAN'T HAVE HER, NO ONE ELSE CAN Kade Mitchell is obsessed with someone he despises. A snake in an angel’s skin, Stacey Rhodes is everything he can’t forget – the girl who shattered his heart and drove him deep into the darkness of the underworld. He watched her for years. Killed anyone who came close to her. But now, granted a brief moment of freedom from the life he’s trapped in, he’s back home and driven to claim her again, breaking every rule he’s ever made for himself. Not even his hatred can stop the pull between them. But he’ll never forgive her… will he? As this is a dark romance, the author highly recommends reading the 'content warning' page.",https://m.media-amazon.com/images/I/51uD0Oy9D0L._SY445_SX342_.jpg,https://www.amazon.com/dp/B0C9MXW2JL,"[""Dark Romance""]","[""[#1 in Romantic Erotica (Books)](https://www.amazon.com/gp/bestsellers/books/10159309011/ref=pd_zg_hrsr_books)\n[#1 in Romantic Erotica (Kindle Store)](https://www.amazon.com/gp/bestsellers/digital-text/7620225011/ref=pd_zg_hrsr_digital-text)\n[#1 in Enemies to Lovers Romance](https://www.amazon.com/gp/bestsellers/books/120214344011/ref=pd_zg_hrsr_books)""]",Not even his hatred angel’s skin 'content warning' page,Third,false,true,true
2025-08-11,Romance,B0F4Q24BT9,The Alpha And The Baker,Roxie Ray,https://www.amazon.com/stores/author/B07YL8WPF3,,4.99,4.40,794,69,2025-07-25,Special Fiction Books,"A grumpy-sweet alpha. A broke but brilliant baker. One emergency cake order that might just be fate. When Castiel’s pack reunion turns into a frosting-fueled disaster, the last thing he expects is to find salvation in the form of a tiny bakery—and the fiery, flour-dusted woman who runs it. Felicia’s barely keeping her business alive, her heart is still healing, and she has zero time for distractions—especially not the ridiculously hot country guy begging for last-minute cakes. But with a hundred people waiting for dessert and a cash offer she can’t refuse, she says yes. One rushed bake. Three ruined ovens. A van full of dreams. And a connection that neither of them saw coming. She’s a human with a whisk. He’s an Alpha with responsibilities. But when their worlds collide, it’s anything but half-baked. Fans of small-town shifter romance, soft alpha energy, and banter that melts frosting will devour this slow-burn standalone with found family, first shifts, and the sweetest damn love story this side of the forest.",https://m.media-amazon.com/images/I/51etd++9HsL._SY445_SX342_.jpg,https://www.amazon.com/dp/B0F4Q24BT9,"[""Shifter"",""Alpha Male"",""Slow Burn""]","[""[#3 in Werewolf & Shifter Romance](https://www.amazon.com/gp/bestsellers/books/13922582011/ref=pd_zg_hrsr_books)\n[#3 in Paranormal Werewolves & Shifters Romance](https://www.amazon.com/gp/bestsellers/digital-text/6401742011/ref=pd_zg_hrsr_digital-text)\n[#6 in Small Town Romance eBooks](https://www.amazon.com/gp/bestsellers/digital-text/120220981011/ref=pd_zg_hrsr_digital-text)""]","sweetest damn love story last-minute cakes fiery, flour-dusted woman especially not the ridiculously hot country guy grumpy-sweet alpha small-town shifter romance frosting-fueled disaster broke but brilliant baker One emergency cake order Castiel’s pack reunion slow-burn standalone",Third,true,true,true
2025-08-11,Romance,B0DGCLB3X3,Great Big Beautiful Life: Reese's Book Club,Emily Henry,https://www.amazon.com/stores/author/B01BW7AX4W,,14.99,4.30,49655,78,2025-04-22,Berkley,"A REESE’S BOOK CLUB PICK ∙ AN INSTANT #1 NEW YORK TIMES BESTSELLER ∙ Two writers compete for the chance to tell the larger-than-life story of a woman with more than a couple of plot twists up her sleeve in this dazzling and sweeping novel from Emily Henry. As featured in The New York Times ∙ Rolling Stone ∙ People ∙ Good Morning America ∙ NPR ∙ Vogue ∙ The Cut ∙ USA Today ∙ Cosmopolitan ∙ Harper's Bazaar ∙ Marie Claire ∙ Glamour ∙ ELLE ∙ E! Online ∙ The New York Post ∙ Bustle ∙ Reader's Digest ∙ BBC ∙ PopSugar ∙ SheReads ∙ Paste ∙ and more! Alice Scott is an eternal optimist still dreaming of her big writing break. Hayden Anderson is a Pulitzer-prize winning human thundercloud. And they’re both on balmy Little Crescent Island for the same reason: to write the biography of a woman no one has seen in years—or at least to meet with the octogenarian who claims to be the Margaret Ives. Tragic heiress, former tabloid princess, and daughter of one of the most storied (and scandalous) families of the twentieth century. When Margaret invites them both for a one-month trial period, after which she’ll choose the person who’ll tell her story, there are three things keeping Alice’s head in the game. One: Alice genuinely likes people, which means people usually like Alice—and she has a whole month to win the legendary woman over. Two: She’s ready for this job and the chance to impress her perennially unimpressed family with a Serious Publication. Three: Hayden Anderson, who should have no reason to be concerned about losing this book, is glowering at her in a shaken-to-the core way that suggests he sees her as competition. But the problem is, Margaret is only giving each of them pieces of her story. Pieces they can’t swap to put together because of an ironclad NDA and an inconvenient yearning pulsing between them every time they’re in the same room. And it’s becoming abundantly clear that their story—just like the tale Margaret’s spinning—could be a mystery, tragedy, or love ballad . . . depending on who’s telling it.",https://m.media-amazon.com/images/I/51rD-WhAJ-L._SY445_SX342_.jpg,https://www.amazon.com/dp/B0DGCLB3X3,"[""Mystery"",""Forbidden Love""]","[""[#4 in Contemporary Women's Fiction](https://www.amazon.com/gp/bestsellers/digital-text/6190493011/ref=pd_zg_hrsr_digital-text)\n[#4 in Romantic Comedy (Books)](https://www.amazon.com/gp/bestsellers/books/9059885011/ref=pd_zg_hrsr_books)\n[#4 in Contemporary Women Fiction](https://www.amazon.com/gp/bestsellers/books/3559170011/ref=pd_zg_hrsr_books)""]",New York Post ∙ Bustle ∙ Reader's Digest ∙ BBC ∙ PopSugar ∙ SheReads most storied (and scandalous) families her big writing break Pulitzer-prize her perennially unimpressed family New York Times ∙ Rolling Stone tale Margaret’s spinning REESE’S BOOK CLUB PICK more than a couple balmy Little Crescent Island ∙ Cosmopolitan ∙ Harper's Bazaar one-month trial period dazzling and sweeping novel INSTANT #1 NEW YORK TIMES BESTSELLER inconvenient yearning pulsing,Third,false,true,true
2025-08-11,Romance,B00TG1CZFC,The Deal (Off-Campus Book 1),Elle Kennedy,https://www.amazon.com/stores/author/B002WHBZOO,Off-Campus,4.99,4.50,123590,72,2015-02-24,Elle Kennedy Inc.,"The international bestseller! A standalone novel* from New York Times and international bestselling author Elle Kennedy! She’s about to make a deal with the college bad boy… Hannah Wells has finally found someone who turns her on. But while she might be confident in every other area of her life, she’s carting around a full set of baggage when it comes to sex and seduction. If she wants to get her crush’s attention, she’ll have to step out of her comfort zone and make him take notice…even if it means tutoring the annoying, childish, cocky captain of the hockey team in exchange for a pretend date. ...and it’s going to be oh so good All Garrett Graham has ever wanted is to play professional hockey after graduation, but his plummeting GPA is threatening everything he’s worked so hard for. If helping a sarcastic brunette make another guy jealous will help him secure his position on the team, he’s all for it. But when one unexpected kiss leads to the wildest sex of both their lives, it doesn’t take long for Garrett to realize that pretend isn’t going to cut it. Now he just has to convince Hannah that the man she wants looks a lot like him.",https://m.media-amazon.com/images/I/51tA+oeAdDL._SY445_SX342_.jpg,https://www.amazon.com/dp/B00TG1CZFC,"[""Sports"",""College"",""Bad boy"",""Fake Relationship""]","[""[#1 in Contemporary](https://www.amazon.com/gp/bestsellers/digital-text/15195303011/ref=pd_zg_hrsr_digital-text)\n[#2 in New Adult & College Romance (Books)](https://www.amazon.com/gp/bestsellers/books/8373230011/ref=pd_zg_hrsr_books)\n[#2 in Sports Romance (Kindle Store)](https://www.amazon.com/gp/bestsellers/digital-text/6487842011/ref=pd_zg_hrsr_digital-text)""]","college bad boy her crush’s attention annoying, childish international bestselling author Elle Kennedy",Third,false,true,true
2025-08-11,Romance,B08HJDG47W,Gild (The Plated Prisoner Series Book 1),Raven Kennedy,https://www.amazon.com/stores/author/B07GT8KZCC,The Plated Prisoner Series,5.99,4.00,73827,74,2020-10-16,Raven Kennedy,"By bestselling author Raven Kennedy, comes the first book in a stunning new fantasy series, perfect for fans of Sarah J Maas and Jennifer L Armentrout. The fae abandoned this world to us. And the ones with power rule. Gold. Gold floors, gold walls, gold furniture, gold clothes. In Highbell, in the castle built into the frozen mountains, everything is made of gold. Even me. King Midas rescued me. Dug me out of the slums and placed me on a pedestal. I’m called his precious. His favored. I’m the woman he Gold-Touched to show everyone that I belong to him. To show how powerful he is. He gave me protection, and I gave him my heart. And even though I don’t leave the confines of the palace, I’m safe. Until war comes to the kingdom and a deal is struck. Suddenly, my trust is broken. My love is challenged, and I realize that everything I thought I knew about Midas might be wrong. Because these bars I’m kept in, no matter how gilded, are still just a cage. But the monsters on the other side might make me wish I’d never left. The myth of King Midas reimagined. This compelling adult fantasy series is as addictive as it is unexpected. With romance, intrigue, and danger, the gilded world of Orea will grip you from the very first page. Please Note: This book contains explicit content and darker elements that may be triggering to some, including mature language, violence, manipulation, Stockholm Syndrome, and non-consensual sex. It is not intended for anyone under 18 years of age. This is book one in a series.",https://m.media-amazon.com/images/I/51eggftAN4L._SY445_SX342_.jpg,https://www.amazon.com/dp/B08HJDG47W,"[""Fantasy"",""Monsters"",""Fae/Elves""]","[""[#1 in Greco-Roman Myth & Legend Fantasy eBooks](https://www.amazon.com/gp/bestsellers/digital-text/6809429011/ref=pd_zg_hrsr_digital-text)\n[#2 in Folklore (Books)](https://www.amazon.com/gp/bestsellers/books/12615/ref=pd_zg_hrsr_books)\n[#7 in Romantasy eBooks](https://www.amazon.com/gp/bestsellers/digital-text/158569011/ref=pd_zg_hrsr_digital-text)""]",non-consensual sex stunning new fantasy series very first page compelling adult fantasy series,First,true,false,true
2025-08-11,Romance,B01LOWN78Y,A Court of Wings and Ruin (A Court of Thorns and Roses Book 3),Sarah J. Maas,https://www.amazon.com/stores/author/B0070291GK,A Court of Thorns and Roses,8.21,4.70,252147,84,2017-05-02,Bloomsbury Publishing,"The epic third novel in the #1 New York Times bestselling Court of Thorns and Roses series by Sarah J. Maas. Feyre has returned to the Spring Court, determined to gather information on Tamlin's actions and learn what she can about the invading king threatening to bring her land to its knees. But to do so she must play a deadly game of deceit. One slip could bring doom not only for Feyre, but for everything-and everyone-she holds dear. As war bears down upon them all, Feyre endeavors to take her place amongst the High Fae of the land, balancing her struggle to master her powers-both magical and political-and her love for her court and family. Amidst these struggles, Feyre and Rhysand must decide whom to trust amongst the cunning and lethal High Lords, and hunt for allies in unexpected places. In this thrilling third book in the #1 New York Times bestselling series from Sarah J. Maas, the fate of Feyre's world is at stake as armies grapple for power over the one thing that could destroy it.",https://m.media-amazon.com/images/I/41FHCa6pErL._SY445_SX342_.jpg,https://www.amazon.com/dp/B01LOWN78Y,"[""Magic"",""Fae/Elves""]","[""[#7 in Paranormal Romance (Books)](https://www.amazon.com/gp/bestsellers/books/13356/ref=pd_zg_hrsr_books)\n[#8 in Epic Fantasy (Books)](https://www.amazon.com/gp/bestsellers/books/16197/ref=pd_zg_hrsr_books)\n[#9 in Romantasy eBooks](https://www.amazon.com/gp/bestsellers/digital-text/158569011/ref=pd_zg_hrsr_digital-text)""]",cunning and lethal High Lords epic third novel Thorns and Roses series #1 New York Times thrilling third book,Third,true,false,true
